,title,synopsis,category
25,백 투 더 퓨쳐,  밸리             에 사는 주인공 마티 맥플라이              마이클    폭스 분 는 록큰롤  스케이트보드  그리고 자동차를 좋아하는 명랑 쾌할한 고교생으로  아버지 죠지                       크리스핀 글로버 분 와 어머니 로레인                  리아 톰슨 분   그리고 형과 누나가 있는 가정의 평범한 청소년이다  평소 친하게 지내던 괴상한 발명가 에메트 브라운 박사                                   크리스토퍼 로이드 분 가 스포츠카 드로리안          을 개조해 타임머신을 만들지만  뜻밖의 사고로 브라운 박사가 테러범들에게 총을 맞고 위험해진 마티는 급기야   년 전으로 간다   극장 간판에는  류 배우인 로널드 레이건이 보이고 청년인 아버지와 어머니를 보게 된다  그러나 젊은 아버진 여전  멍청하고  무엇보다 어머니가 미래의 아들인 마티를 좋아해 야단이다  마티가 미래로 가는 것을 도와 줄 사람은   년 전인 젊은 브라운 박사뿐  댄스 파티가 열리는 날에 아버지와 어머니가 만났던 것을 기억한 마티는 두 사람을 결합시키고자 어머니와 파티장으로 간다  그런데  심술장이 밥              토마스    윌슨 분 이 나타나 어머니를 겁탈하려 하나 화가 난 아버지가 일격에 때려 눕혀 그때부터 소심했던 아버지의 성격이 바낀다  무사  부모님은 만나 마티의 존재는 없었지지 않지만 마티의  미래로의 귀환                     이 어려워지는 사태를 맞는데    ,sf_fantasy
26,트랜스포머 3,시카고 도심 한복판  정체 불명의 푸른 빛이 하늘을 향해 쏘아 올려진다 빛은 오랜 시간 동안 달의 어둠 속에 잠들어 있던 디셉티콘 군단을 깨우게 되고 순식간에 시카고를 점령한 디셉티콘 군단의 무차별 공격으로 인해 도시는 초토화된다 오토봇의 수장 옵티머스 프라임은 디셉티콘의 도심 공격이   년 전 인류의 달 착륙과 관련이 있다는 것을 알아내고 다시 한번 우주의 운명을 건 최후의 전면전에 나서는데  수천년을 끌어온 오토봇    디셉티콘의 전쟁  그 최후의 전투가 지금 시작된다 ,sf_fantasy
27,더 울버린,사랑하는 사람들을 모두 잃고  혼자 남겨진 고통으로 괴로워하는  울버린      어느 날 영원불멸의 삶을 버리고  유한한 삶을 얻을 수 있는 일생일대의 기회를 제안 받는다     처음으로 스스로의 약한 모습을 느낀 울버린은  극한의 상황에서 치명적인 적들과 대적하게 되고   이제껏 본 적 없는 가장 강력하고 위험한 존재로 거듭나게 되는데 ,sf_fantasy
28,하늘에서 음식이 내린다면 2,엉뚱한 발명가 플린트가 또 일을 냈다   물로 거대한 음식을 만들어내던 플린트의 기계가 이번엔 살아 있는 푸드 몬스터를 만들어 낸 것   햄버거미  악어타코  메론염소  수박코끼리 등등  푸드 몬스터들이 사람들을 먹어버리기 전에 어서 빨리 그들을 막아야 해   플린트와 친구들이 함께하는 짜릿한 모험이 시작됐다   자  이제 다함께 꿀꺽퐁담섬으로 출 발 ,sf_fantasy
29,스파이더맨 3,대중의 사랑을 듬뿍 받으며 진정한 영웅으로 거듭난 스파이더맨  피터 파커 토비 맥과이어   어느 날  스파이더맨은 외계에서 온 수수께끼의 유기체인 심비오트          에 감염되고 스파이더맨은 오리지날 스파이더맨에서 블랙 슈트 스파이더맨으로 변화한다  한층 업그레이드 되고 강력해진 파워를 얻게 된 스파이더맨은 자신의  에 도취되어 마음껏 세상을 즐긴다  아버지의 복수를 위해  뉴 고블린 제임스 프랑코  이 된 해리와 물리 실험에 노출되어 능력을 얻게 된 피터의 삼촌을 죽인 진범  샌드맨 토마스 헤이든 처치  은 호시탐탐 스파이더맨을 노리는데    한편  피터의 삶에서도 변화의 조짐이 보인다  직장 동료인 에디 브록 토퍼 그레이스 이 스파이더맨을 쫒아다니며 연신 특종을 잡아 신문사의 영웅으로 떠오르며 그를 위협한 것  하지만 브록은 스파이더맨이 자신의 여자친구 그웬 브라이스 달라스 하워드 을 위험에서 구해준 후  그녀의 관심이 온통 그에게 쏠리자 스파이더맨에게 증오의 감정을 갖게 된다  그리고 그가 벗어 던진 심비오트가 브록에게 전이되어 가장 강력한 악당인  베놈 으로 진화한다  상상을 초월하는  을 지니게 된 스파이더맨과 그를 노리는 뉴 고블린  샌드맨  베놈과의 피할 수 없는 사상 최대의 대결이 시작된다 ,sf_fantasy
