,title,synopsis,category
0,NULL,NULL,sf_fantasy
1,엣지 오브 투모로우(2.35:1 극장판),가까운 미래  미믹이라 불리는 외계 종족의 침략으로 인류는 멸망 위기를 맞는다   빌 케이지 톰 크루즈 는 자살 작전이나 다름없는 작전에 훈련이나 장비를 제대로 갖추지 못한 상태로 배정되고 전투에 참여하자마자 죽음을 맞는다   하지만 불가능한 일이 일어난다   그가 다시 그 끔찍한 날이 시작된 시간에 다시 깨어나 다시 전투에 참여하게 되고 다시 죽었다가 또 다시 살아나는 것   외계인과의 접촉으로 같은 시간대를 반복해서 겪게 되는 타임 루프에 갇 게 된 것이다 ,sf_fantasy
2,배트맨 대 슈퍼맨: 저스티스의 시작,슈퍼맨과 조드 장군의 격렬한 전투 이후 메트로폴리스는 파괴되었고 슈퍼맨은 세계 최고 논쟁의 인물이 되어버린다  한편 배트맨은 그 동안 타락했던 많은 자들처럼 슈퍼맨 역시 언젠가 타락을 할 것이라 생각하며 사회에서 가장 위험한 존재로 여긴다  세계의 미래를 위해 무모하고 제어할 수 없는  을 가진 슈퍼맨으로 인해 벌어졌던 일들을 바로 잡으려 하는데 ,sf_fantasy
3,하늘의 푸르름을 아는 사람이여,산으로 둘러 싸인 시골 마을  그곳엔 꿈을 위해 쉼 없이 달려가는 자매  아오이    아카네  그리고  신노 가 있었다    신노 는 함께 도쿄 상경을 약속했던  아카네 를 찾아갔지만   아카네 는 혼자 남을 동생  아오이 로 인해 꿈을 접는다     년 후  고등학생이 된  아오이 는 언니에 대한 죄책감과 자신의 꿈 사이에서 방황하고 두 사람의 관계는 점점 멀어져 간다   그러던 어느 날  두 사람 앞에 다시는 만날 수 없을 것 같았던  그 가 전혀 다른 모습의 두 사람이 되어 동시에 나타나게 되는데    어째서 내게 다시 찾아온 거야    과거와 현재를 잇는  신비로운 두 번째 첫사랑이 시작된다 ,sf_fantasy
4,미녀와 야수(패키지상품 : 더빙판 추가증정),데이빗 오크덴 스티어스의 나레이션으로 야수가 이기적인 왕자로부터 현재의 모습으로 변한 경위를 듣게 된다  한때는 헛된 허영심으로 가득찬 이 왕자는 크고 아름다운성에서 살고 있었다  어느날 늙은 노파가 문가에 와서 하룻밤 재워주는 조건으로 장미 한송이를 제의한다  그러나 왕자는 잘못 결정하여 그녀를 문가에서 쫑아낸다  늙은 노파는 아름다운 마법사로 변신하고 겁이난 왕자는사과하려 했지만 너무 늦었다  마법사는 그를 야수로 만들고   살 되는 생일 이전에 한 여성의 사랑을 얻지 못하면 평생 야수로 지내야 한다  이제 작은 프랑스 마을에 살고 있는 아름다운 여성인 벨이 뮤지칼로 등장한다  자아도취에 빠져있는 젊은이 개스통  그는 우쭐대는 미남으로서 벨을 마음에 두고 있으며  어떠한 것도 그녀와의 결혼을 방해하지 못한다고 주장한다  벨은 발명가 아버지와 함께 살고 있는데 모리스는 뚱뚱하지만 사랑스러운 백발의 신사이다  발명가 대회에 참가하기위해 그과 그의 말 필립은 숲을 가로지르는 지름길을 택한다  늑대가 그들을 쫓아 오고 모리스는 도망가다가 근처의 성에 다다르고 비를 피하기 위해 그안으로 들어간다  성에 들어서 그가 발견한 촛대가 말을 하자 깜작 놀란다  그 성은 저주를 받았고  촛대인 뤼미에르과 뚱뚱한 탁상시계 콕스워스는 두명의 중요 인물들이다  뤼미에르는 그의 매력적인 모리스 슈발리에 목소리와 태도로서 모리스를 초청하며  반면 새침한 콕스워스의 반대는 무시된다  말하는 주전자 폿스 부인과 그녀의 아들인 찻잔 칩이 모리스에게 차를 대접하고  방안을 강아지처럼 뛰어다니는 발의자가 앞에 뛰어나와 그의 팔을 올려놓는다  그리고 다음 순간 공포분위기와 함께 야수가 뛰어든다  이것이 관객이 처음으로 야수를 보는 순간인데  이때의 애니메이션은 정말 뛰어나기 그지없다  사람과 동물의 동작을 합친 움직임을 가지느 야수는 무섭고 흉칙하며  그에 걸맞는 불같은 성격을 가지고 있다  웅장한 목소리 로비 벤슨의 목소리 로서 모리스를 침입자로 몰아 지하감옥에 가두어 버린다  모리스의 말이 혼자 집으로 돌아오자 벨은 그 말을 타고 성으로 가며  그곳에서 모리스의 모자가 땅에 떨어져 있는 것을 발견  아버지를 찾기위해성으로 들어오고  감옥에 갇혀 아픈 아버지를 발견한다  그때 야수가 나타나 다시금 자신의 성에 침입자가 들어온 것에 불같이 화를 낸다  벨은 놀라운 희생정신으로 아버지 대신 자기가 영원  갇혀있겠다고 제의하고 야수는 이것을 받아들인다  뤼미에르는 벨이 마법을 깨트릴 사람이라고 확신하고 좋아한다  하지만 벨과 야수의 첫 만남은 순탄치 못하여  그녀의 의지와 야수의 성미가 충돌한다  벨은 용감하지만 자상한 여성으로서 야수가 그녀를 저녁식사에 초청하자 거절하고 차라리 혼자서 굶고 있기를 택한다  그러나 그후에는 방에서 빠져나와 부억에 먹을 것을 찾으러 들어가고  그곳에서 흥겨운 뮤지컬 공연을 대접받는다  이 진정한 버스비 버클리 전통에 따른 곡에서 뤼미에르가모자를 쓰고  손님이 되어주세요               를 부르며 에스터 윌리암스 영화를 흉내내어 찻숫갈들이 펀치 그릇에 다이빙한다  벨과 야수는 계속 충돌하며  특  밸이 야수의 방에 들어가 유리덥게 속의 장미를 발견함으로서 절정에 달한다  그 장미의 잎사귀들은 그의   번째 생일이 다가옴에 따라 하나씩 떨어지고 있었다  야수는 벨에게 당장 나가라고 소리치며  놀라고 겁이난 벨은 성에서 도망친다  성밖에서 필립을 타고 가던 벨은 늑대들의 습격을 받으며  야수는 벨을 구하면서 그 과정에서 부상을 당한다  이 행동은 벨의 마음에 친절과 애정을 불러 일으켜  그녀는 상처를 다정  치료해 준다  겨울은 두 사람이 눈장난 치는 장면을 장면을 연출해주며  그들이 서로에게 느끼는 감정을 처음으로 느끼는 장면이 아름다운 발라드  그 무엇인가                   를 통해 노래된다  두사람이 멋진 저녁식사를 나누고 안젤라 랜스배리가 노래하는 주제가  미녀와야수  에 맞추어 춤을 추는데  그 고결한 금빛과푸른색의 무도장은 어떠한신데렐라를 꿈꾸는 여성의 상상을 초월하는 멋진 곳이다  야수는 벨에게선물로서 마법의 거울을 통해 아버지를 보도록 해주는데  병들고 걱정하는아버지 모습에 벨이 어쩔 줄 모르자 야수는 그녀에게 떠나도 좋다고 허락하며  그로서 자신의 운명을 포기한다  벨이 아버지와 함께 집에 도착하고  개스통이 벨의 야수에 대한 애정을 눈치채자  그는 마을 사람들을 이끌고 그를 죽이기 위해 성으로 쳐들어간다  벨은 야수를 구하기 위해 쫓아가며  죽어가던 야수는 벨이 그에게 사랑을 고백하자 사람으로 돌아온다 ,sf_fantasy
5,호빗 : 뜻밖의 여정(확장판),호빗족  빌보 배긴스 는 어느 날 갑자기 찾아온 회색의 마법사  간달프 로부터 뜻밖의 제안을 받는다  오래 전 난쟁이족의 영토였지만 무시무시한 용  스마우그 에게 빼앗겨 지금은 황무지로 변한 동쪽의  외로운 산  에레보르 왕국을 되찾기 위해 함께 떠나자는 것  어쩔 수 없이 전설의 용사  소린 이 이끄는   명의 난쟁이족과 함께 고블린과 오르크  흉악한 괴수 와르그  마법사들과 마주쳐야 하는 위험 가득한 여정에 오른다   외로운 산에 가기 위해서 반드시 거쳐야 하는 고블린 동굴에서 일행과 떨어져 헤매던 빌보는 그의 일생을 뒤바꿔놓는 존재인  골룸 과 마주치게 되고  골룸과의 수수께끼 대결 중에 대단한  을 지닌 골룸의 보물  절대반지 를 얻게 된다   험난한 여행의 길에서 빌보는 그 동안 자신도 몰랐던 용기와 능력을 발견하지만  바로 그 절대반지로 인해 아직 짐작도 못할 중간계의 거대한 운명에 휘말리게 되는데    스페셜 영상    뉴질랜드 지구 중심의 고향            감독 피터 잭슨은 자신의 고향인 뉴질랜드에서 호빗들의 마을인         을 만들었다  천혜의 광활한 대자연이         으로 만들어지는 제작 과정  그리고 그 결과물이   와 함께 영화속에서 얼마나 아름답게 탄생되었는지를 살펴보도록 하자    스페셜 영상    배긴스 씨            배우 마틴 프리먼이 빌보 배긴스로 탄생하는데에는 수많은 비하인드 스토리가 있었다  캐스팅 작업부터 영화속 배긴스씨로 완벽  재현되는 순간  또한 배우 마틴 프리먼의 일상까지 훔쳐볼 수 있는 절호의 기회    스페셜 영상    소린과 난쟁이들            원작  호빗 의 책 속에만 존재했던 호빗족들을 살아 움직이는 영상으로 표현해내기 위해 거친 작업들을 낱낱이 살펴볼 수 있는 기회  호빗족들의 성격과 행동  디테일한 특징들을 모두 잡아내기 위하여 실제 인물을 선발하는 오디션 부터 완벽한 영화 속 캐릭터로 탄생하기 까지의 메이크업과    작업 등의 전 과정을 살펴보자 ,sf_fantasy
6,이터널 선샤인,조엘은 아픈 기억만을 지워준다는 라쿠나사를 찾아가 헤어진 연인 클레멘타인의 기억을 지우기로 결심한다  기억이 사라져 갈수록 조엘은 사랑이 시작되던 순간  행복한 기억들  가슴 속에 각인된 추억들을 지우기 싫어지기만 하는데    당신을 지우면 이 아픔도 사라질까요  사랑은 그렇게 다시 기억된다 ,sf_fantasy
7,캐리비안의 해적 4 - 낯선 조류,영원한 젊음을 선사한다는 샘을 찾아 새로운 항해를 시작한 캡틴 잭 스패로우  사랑인지 사기인지 정체를 알 수 없는 안젤리카   바다를 공포의 대상으로 만든 냉혹한 해적 검은수염과 아름답지만 잔인한 바다의 괴수 같은 배  앤 여왕의 복수  호  다시 예측할 수 없는 운명의 소용돌이와 초자연적인 대혼란의 거대한 막이 오른다 ,sf_fantasy
8,헝거게임 : 판엠의 불꽃,세상을 변화시킬 거대한 혁명의 불꽃이 타오른다    개의 구역으로 이루어진 독재국가  판엠 이 체재를 유지하기 위해 만든 생존 전쟁  헝거게임   일년에 한번 각 구역에서 추첨을 통해 두 명을 선발  총   명이 생존을 겨루게 되는 것   헝거게임 의 추첨식에서  캣니스 는 어린 여동생의 이름이 호명되자 동생을 대신해 참가를 자청하며 주목을 받는다  과거 자신을 위기에서 구해줬던  피타  역시 선발되어 미묘한 감정에 휩싸인다   캣니스 는 금지구역에서 함께 사냥을 했던  게일 에게 가족을 부탁하며 생존을 겨루게 될 판엠의 수도  캐피톨 로 향하는데 ,sf_fantasy
9,신비한 동물들과 그린델왈드의 범죄, 뉴트 스캐맨더  에디 레드메인 의 활약으로 강력한 어둠의 마법사  겔러트 그린델왈드  조니 뎁 가 미합중국 마법부       에 붙잡 지만  이내 장담했던 대로 탈출해 추종자를 모으기 시작한다  순혈 마법사의 세력을 모아 마법을 사용하지 않는 사람들을 지배하려는 그린델왈드의 야욕을 막기 위해  알버스 덤블도어  주드 로 는 제자였던 뉴트에게 도움을 요청한다  마법사 사회는 점점 더 분열되어 가는 가운데  앞날의 위험을 알지 못한 채 뉴트는 이를 승낙하는데 ,sf_fantasy
10,인류멸망보고서,인류멸망보고서    피조물인 인간  신의 영역을 넘보다   천상의 피조물  로봇이 인간의 노동을 대체한 미래  천상사의 가이드 로봇     가 스스로 깨달음을 얻어 설법을 하는 경지에 이른다  이를 인류에 대한 위협으로 간주한 제조사   은 해체를 결정하지만 그를 인명스님으로 부르며 숭배하는 승려들은 반대한다  해체 직전  일촉즉발의 순간    의 엔지니어 박도원 김강우 이 상부의 결정에도 불구하고 인명의 앞을 막아 서는데  인류멸망보고서    욕망의 끝은 섬뜩한 종말일지니  멋진 신세계  가족이 해외여행을 떠나고 홀로 남은 연구원 윤석우 류승범 는 소개팅 약속에 음식물 쓰레기를 분리 수거하지 않고 한번에 처리한 후 집을 나선다 킹카  고준희   맛있는 고기 요리  즐거운 클럽  온갖 유희 끝 그녀와의 달콤한 키스 현장을 덮친 고교생들을 괴력으로 응징한 석우의 몸에 이상한 변화가 온다  거리를 뒤덮은 좀비의 물결  광우병도 조류독감도 아닌 괴 바이러스의 정체를 캐는 매스컴의 호들갑도 무색하게 서울의 거리는 멸망으로 치닫는데  인류멸망보고서    그날 이후  살아있음을 기뻐하라  인류  제 의 탄생  해피 버스데이  당구광 아빠의  번 당구공을 부셔버린 초등학생 박민서 진지희 는 정체불명의 사이트에 접속  당구공을 주문한다  하지만  년 후 당구공 모양의 괴 혜성이 지구를 향해 날아오기 시작하고 임박한 멸망에 민서 가족은 오타쿠 삼촌 송새벽 이 설계한 지하 방공호로 대피한다  그리고  년 후  엄청나게 밝은 광채에 홀려 민서 배두나 는 용감하게 지상으로 향하는데 ,sf_fantasy
11,시간을 달리는 소녀,저 마코토에게는 남들에게 말 못할 비밀이 하나 있어요  타임리프라고 하는 능력이죠 어느 날 우연  그 능력을 가지게 됐어요 카즈야 이모 말에 따르면 내 또래 여학생들에게 자주 일어날 수 있는 일이라더군요 아무튼 그 능력 덕택에 학교 성적도 좋아지고 지각도 안하고 잦은 실수도 훨씬 줄어들었어요 세상 만사가 다 내 손안에 있는 느낌이었죠 친한 친구인 고스케와 치아키도 저의 변화가 싫지 않은 것 같아요  매일 셋이서 야구놀이하며 즐거운 나날을 보낼 수 있을 것 같았죠  그런데 느닷없이 치아키가 저에게 고백을 하는 거에요  마코토  나랑 사귀지 않을래   전혀 남자로 보이지 않던 녀석인데 저는 깜짝 놀라고 말았어요  어떻게든 그 고백을 없애기 위해 다시 과거로 돌아가 결국은 그 고백을 듣지 않게 되었어요  하지만 과거로 돌아가면 돌아갈수록  일이 점점 꼬여만 가요  친구인 유리와 치아키가 연인 사이로 발전하는걸 지켜보려니 마음만 씁쓸하고  고스케를 짝사랑하고 있던 후배 여학생의 고민상담까지 받은 저는 어떻게서든 두 사람을 이어주기 위해 과거에서 현재로 몇 번을 오갔는지 몰라요  게다가 제가 당할 뻔한 사고를 대신 고스케가 당하는 불상사까지 타임리프로 사람의 마음을 내 멋대로 바꾼 벌을 받고 있나 봐요  전 이제 어떡하면 좋을까요 ,sf_fantasy
12,신과함께-죄와 벌,저승 법에 의하면  모든 인간은 사후   일 동안  번의 재판을 거쳐야만 한다  살인  나태  거짓  불의  배신  폭력  천륜  개의 지옥에서  번의 재판을 무사  통과한 망자만이 환생하여 새로운 삶을 시작할 수 있다    김자홍 씨께선  오늘 예정 대로 무사  사망하셨습니다   화재 사고 현장에서 여자아이를 구하고 죽음을 맞이한 소방관 자홍  그의 앞에 저승차사 해원맥과 덕춘이 나타난다  자신의 죽음이 아직 믿기지도 않는데 덕춘은 정의로운 망자이자 귀인이라며 그를 치켜세운다  저승으로 가는 입구  초군문에서 그를 기다리는 또 한 명의 차사 강림  그는 차사들의 리더이자 앞으로 자홍이 겪어야 할  개의 재판에서 변호를 맡아줄 변호사이기도 하다  염라대왕에게 천년 동안   명의 망자를 환생시키면 자신들 역시 인간으로 환생시켜 주겠다는 약속을 받은 삼차사들  그들은 자신들이 변호하고 호위해야 하는   번째 망자이자   년 만에 나타난 의로운 귀인 자홍의 환생을 확신하지만  각 지옥에서 자홍의 과거가 하나 둘씩 드러나면서 예상치 못한 고난과 맞닥뜨리는데   누구나 가지만 아무도 본 적 없는 곳  새로운 세계의 문이 열린다 ,sf_fantasy
13,트루먼 쇼,트루먼 버뱅크                 짐 캐리 분 는 평범한 샐러리맨이다  적어도 그가 아는 한은 그렇다  그는 메릴                            로라 린니 분 이란 여인과 결혼했고 보험회사에서 근무하며 어린 시절 아빠               브라이언 디레이트 분 가 익사하는 것을 보고 물에 대한 공포증이 있는 남자다  그런데 어느 날 그는 익사한 것으로 알던 아버지를 길에서 만나고 알 수 없는 사람에 의해 아빠가 끌려가는 것을 보면서 자신의 생활이 뭔가 평범치 못하다는 것을 확신하게 된다   그는 하루   시간 생방송 되는 트루먼 쇼의 주인공이다  전 세계의 시청자들이 그의 탄생부터   이 가까운 지금까지 일거수 일투족을   를 통해 보고 있다  그는 만인의 스타지만 정작 본인은 짐작도 못하고 있다  그의 주변 인물은 모두 배우이고 사는 곳 또한 스튜디오이지만 그는 실비아                        나타샤 맥엘혼 분 를 만날 때까지 전혀 알지 못한다  대학 때 이상형의 여인 실비아와 만난 트루먼은 그 여인으로부터 모든게 트루먼을 위해 만들어진 가짜란 얘기를 듣는데 그 여인이 피지섬으로 간다는 얘길 듣고 늦게나마 그 여인을 찾아 떠나기로 결심한다  아내와 함께 떠나려는 시도를 하지만 번번  실패하면서 가족  친구 조차 믿을 수 없다는 것을 깨닫게 되고 혼자서 고향을 빠져나가려는 시도를 한다 ,sf_fantasy
14,가타카,  하느님이 행하신 일을 보라  하느님이 굽게 하신 것을 누가 능  곧게 하겠느냐     전도서  장   절    우리가 자연을 함부로 바꾸려 하지만 자연도 우릴 바꾸려 할 것이다     윌리암 게리린  가까운 미래  우주 항공 회사 가타카의 가장 우수한 인력으로 손꼽 고 있는 제롬 머로우                 에단 호크 분   큰 키에 잘생긴 외모  우주 과학에 대한 탁월한 지식과 냉철함  그리고 완벽한 우성인자 유전법칙의 우 열성이 아닌  우수한 유전자 을 가르킴 를 갖추고 있다  토성 비행 일정을 일주일 남겨두고 약간은 흥분을 느끼고 있는 그의 과거는 우주 비행은 꿈도꾸지 못할 부적격자 빈센트 프리만이었다  부모님의 사랑으로 태어난 신의 아이 빈센트의 운명은 심장 질환에  범죄자의 가능성을 지니고    살에 사망하는 것이었다  빈센트의 운명에 좌절한 부모는 시험관 수정을 통해 완벽한 유전인자를 가진 그의 동생 안톤을 출산한다  어린 시절부터 우주에 대한 남다른 관심을 가지고 있던 빈센트는 부모의 만류에도 불구하고  우주 비행사가 되는 꿈을 펼쳐 나간다  그러나 성인이 된 후 그는 우주 비행사가 되는 그 어떤 시험이나 면접도 통과하지 못하는 자신의 운명을 발견하고  집을 나간다  동생과의 수영 시합 중에 바다 한 가운데서 익사하려는 동생을 구해냈을 때  은 육체에서 나오는 것이 아니라 정신에서 나오는 것이다라는 믿음과 자신이 꿈을 간직한 채  청소부 생활을 전전하던 빈센트는 어느 날 최고의 우주 항공 회사 가타카에서 청소부로 일하게 된다  그리고 자신의 예견된 미래에 반기를 든 그는  우주 비행사가 되기 위해 위험한 도박을 시작한다  유전학적으로 열성인 자에게 가짜 증명서를 파는     중계인 게르만은 우성인자를 팔려고 하는 유진 머로우와 빈세트를 연결시켜 준다  유진의 유전학적 우성인자는 빈센트가 인생에 있어 순수하게 원하던 모든 것을 이룰 수 있게 하기 때문이다  성공을 위해서 빈센트는 피한 방울  피부 한 조각  타액으로 인간의 증명을 읽어내는 사회를 속여야만 한다  물론 쉬운 것은 아니다  그는 자신의 열성을 감추기 위해 그의 근시안  유진과 같은 키를 맞추기 위해 고통스럽고 고문같은 수술까지도 견뎌야 했다  유진 머로우와 빈센트 프리만의 결합을 통해 제롬 머로우는 탄생했다  그후 당당  가타카에 입사했고  가타카에 같이 근무하는 아이린                우마 써먼 분 과 사랑에 빠지는 행운까지 누리게 되는데 ,sf_fantasy
15,배트맨 대 슈퍼맨: 저스티스의 시작(확장판),슈퍼맨과 조드 장군의 격렬한 전투 이후 메트로폴리스는 파괴되었고 슈퍼맨은 세계 최고 논쟁의 인물이 되어버린다  한편 배트맨은 그 동안 타락했던 많은 자들처럼 슈퍼맨 역시 언젠가 타락을 할 것이라 생각하며 사회에서 가장 위험한 존재로 여긴다  세계의 미래를 위해 무모하고 제어할 수 없는  을 가진 슈퍼맨으로 인해 벌어졌던 일들을 바로 잡으려 하는데 ,sf_fantasy
16,2012,고대 마야 문명에서부터 끊임없이 회자되어 온 인류 멸망      년  저명한 과학자들은 오랜 연구 끝에 실제로 멸망의 시기가 다가오고 있음을 감지하고 각국 정부에 이 사실을 알린다  그리고 곧 고대인들의 예언대로 전세계 곳곳에서는 지진  화산 폭발  거대한 해일 등 각종 자연 재해들이 발생해 그 누구도 막을 수 없는 최후의 순간이 도래한다  한편  이혼 후 가족과 떨어져 살던 소설가 잭슨 커티스 존 쿠삭 는 인류 멸망에 대비해 진행되어 왔던 정부의 비밀 계획을 알아차리고 가족과 함께 살아남기 위한 필사의 사투를 벌이는데 ,sf_fantasy
17,브레이킹 던 part2,르네즈미를 잉태하면서 죽음의 순간까지 닿았던 벨라는 그녀를 살리기 위한 에드워드의 노력으로 마침내 뱀파이어로 다시 태어나고  제이콥이 자신의 딸 르네즈미에게  각인 되었다는 사실을 알고 충격에 빠진다  한편 르네즈미를 뱀파이어에게 위험한  불멸의 아이 라고 판단한  볼투리 가는 그녀를 제거하기 위해 군대를 모으기 시작한다  신이 허락하지 않은 인간과 뱀파이어의 사랑이 불러 온 위험천만한 전운이  컬렌 가를 감돌고 벨라와 르네즈미를 지키기 위해 전세계에 흩어져 있는 뱀파이어들을 모은 에드워드는 볼투리의 군대와 최후의 전쟁을 시작하는데    전세계가 열광하는 매혹적인 판타지 대서사의 화려한 피날레가 마침내 시작된다 ,sf_fantasy
18,맨 프럼 어스2: 홀로신,     년을 살아가는 남자의 일상과 그의 주변 인물들을 그린    영화,sf_fantasy
19,레드슈즈,사건 사고가 끊이지 않는 동화의 섬  사라진 아빠를 찾던 화이트 왕국의 공주는 우연  마법구두를 신고 이전과 완벽하게 다른  레드슈즈 로 거듭난다  한편  초록색 난쟁이가 된 일곱 왕자들은 우연  자신들의 집에 머물게 된  레드슈즈 가 저주를 풀 유일한 희망이라 생각해 그녀를 돕기 시작하고  영원한 아름다움을 꿈꾸는 왕비  레지나 는 마법구두를 신고 성을 빠져나간  레드슈즈 를 쫓기 시작하는데   위기에 빠진 동화의 섬  레드슈즈  그리고 일곱 왕자들의 운명은 ,sf_fantasy
20,이프 온리,눈앞에서 사랑하는 연인을 잃은 남자는 다음 날 아침  자신의 옆에서 자고 있는 연인을 보고 소스라치게 놀란다  기쁨도 잠시  정해진 운명은 바꿀 수 없단 것을 깨달은 그는 더 늦기 전에 자신의 진정한 사랑을 전하기로 마음먹는데   네가 아니었다면 난 영영 사랑을 몰랐을 거야 사랑하는 법을 알게 해줘서 고마워  사랑받는 법도 ,sf_fantasy
21,NULL,NULL,sf_fantasy
