,title,synopsis,category
0,찬실이는 복도 많지,집도 없고  남자도 없고  갑자기 일마저 똑 끊겨버린 영화 프로듀서  찬실   현생은 망했다 싶지만  친한 배우  소피 네 가사도우미로 취직해 살길을 도모한다  그런데  소피 의 불어 선생님  영 이 누나 마음을 설레게 하더니 장국영이라 우기는 비밀스런 남자까지 등장  새로 이사간 집주인 할머니도 정이 넘쳐 흐른다  평생 일복만 터져왔는데  영화를 그만두니 전에 없던  복 도 들어오는 걸까 ,melo
1,우리 사이의 거대한 산,비행기가 눈 덮인 깊은 산 속으로 추락하는 사고가 난다  구조대가 올 수 없다는 걸 직감한 유일한 생존자 벤과 알렉스는 살아남기 위한 험난한 여정을 시작한다   파라다이스 나우 와  오마르 로 잘 알려진 하니 아부 아사드 감독의 신작 스릴러로 주연은 케이트 윈슬렛이 맡았다    제  회 부산국제영화제 ,melo
2,NULL,NULL,melo
3,어린 신부,세상 여자가 모두 자기 여자인양 온갖 작업을 펼치던 잘 나가던 대학생 상민  수다떨기 좋아하고 얼짱 보면 가슴 설레는 앙큼상큼한 여고생 보은 둘은 보은 할아버지에게서 날벼락 같은 명령을 받게 된다  둘이 결혼해야 한다는 것   평소 둘이 결혼하는 게 소원이었던 할아버지의 병세가 악화되자   세 상민과   세 보은은 어쩔수 없이 결국 결혼을 하고야 만다  결혼을 하긴 했지만 첫 키스도 못해본   살 어린 신부를 어떻게 할 수도 없는 상민  게다가 유부남 도장까지 찍혔으니 작업 길도 꽉꽉 막혀있다  애타고 아쉬운 마음이야 하늘을 찌르지만 결혼생활에 충실하고  보은이 뒷바라지도 해주려고 마음먹은 상민  그런데 이게 웬일  보은이는 신혼 여행을 떠나는 공항에서 도망간다  제주도에서 나홀로 외로운 밤을 보내는 상민의 눈에는 신혼 부부들이 굉장  거슬리는데  같은 시간 보은은 평소 마음에 있던 야구부 주장 정우와 꿈에 그리던 데이트를 하게 된다  뜻하지 않은 결혼을 한 이들에게 아슬아슬한 하루하루가 끊임없이 계속되는데  결혼 사실을 들키면 안 되는 이들의 위험한 부부관계는 상민이 보은의 학교에 교생 실습을 나가면서 더욱 더 첨예한 위기가 계속된다  수업 시간에 보은의 팬티로 땀을 닦는 상민  불시에 상민의 방으로 쳐들어오는 스토커 같은 김샘  게다가 보은은 한 술 더 떠서 정우와의 위험한 데이트를 계속 하는데 이들의 결혼 생활 과연 오래갈 수 있을까 ,melo
4,NULL,NULL,melo
5,러브 앳, 어느 날  눈 떠보니 평행세계  아내  올리비아 와 다투고 만취 상태로 잠에서 깨어난  라파엘 은 평소와 다름을 느낀다  같은 듯 다른 세상  베스트셀러 스타 작가로서의 삶은 간데없고 중학교 선생님이라고  베프  펠릭스 는 탁구광이 되어 있고 결정적으로   아내  올리비아 는 자신을 아예 모른 채 유명 피아니스트로 살고 있다    이 사랑을 기억하니  평행세계로 오게 된 원인이 운명적 사랑이었던  올리비아 와의 관계가 소원해졌기 때문이라고 생각한  라파엘 은 다시 그녀의 사랑을 얻으면 현실세계로 돌아갈 수 있다고 믿고 다가가지만 그녀 곁엔 모든 게 완벽한  마크 가 버티고 있다  이 세계에서 유일하게 자신을 믿어주는 친구  펠릭스 의 도움으로 그녀의 마음을 공략할 기회를 얻게 되는데   과연  그들은 다시 사랑할 수 있을까 ,melo
6,NULL,NULL,melo
7,옐라,옐라는 실패한 결혼생활과 부서진 꿈을 뒤로한 채 새로운 삶을 찾아 고향을 떠나기로 결심한다  무엇도 그녀를 막을 수 없다  심지어 정신이상자인 전 남편이 그녀가 떠나던 날 교통 사고를 일으켜도  그녀의 앞을 막지는 못한다  젊은 이사 필립에게 비서직을 제안 받은 후 옐라의 인생은 바뀌기 시작한다  투자 사업 쪽에는 전혀 경험이 없지만  아름다운 외모와 도도함을 무기로 협상에 능력을 발휘하는 옐라  이사 필립과의 애정 관계도 희망적이다  하지만 허공에서 이상한 소리가 들리고 기묘한 사건들이 옐라를 괴롭 다  그녀의 새 인생은 현실이라고 하기에는 너무 완벽했던 걸까  베를린영화제에서 여우주연상을 수상한 배우 니나 호스의 열연이 빛나는 작품 ,melo
8,NULL,NULL,melo
9,더 차일드,어린 커플 브뤼노와 소냐 사이에 아이가 태어나면서 인생이 변화하는 이야기    살의 브뤼노와   살의 소냐  그들은 소냐의 연금과 브뤼노와 그 일당들이 저지르는 도둑질로 하루 하루를 연명해나가고 있다  무책임한 브뤼노는 소냐와의 사이에서 아이가 태어나자 아이를 팔아치운다  이에 쇼크를 받은 소냐는 회복할 수 없는 상태에 빠진다  그제서야 자신의 잘못을 뉘우친 브뤼노는 아기를 되찾아 오지만 폭력배들의 협박에 시달리게 된다  소냐의 마음은 이미 얼어버리고 브뤼노는 폭력배들에게 줄 돈을 마련하기 위해 날치기를 하다가 이번에는 경찰에 걸리고 마는데    철없는   대 남녀가 원하지 않았던 아이를 갖게 되면서 부모가 돼 가는 이야기를 그린 작품  칸느 영화제 황금종려상 수상  벨기에 작가주의를 대표하는 다르덴 형제는 그들의 유명한 전작  약속   로제타   아들 에서 거칠고 열악한 상황에서 살아남기 위해 노동을 하는 캐릭터들에게 특별한 관심을 보여왔으며 이 작품 역시 예외가 아니다  이 영화에서는   살의 브뤼노가 틀에 박  삶에서 벗어나기 위해 고군분투한다  인간의 복합적인 감정 속에서 윤리의 문제를 언급하고 있는 이 작품은 다르덴 형제 특유의 관찰적 시선으로 더욱 더 빛이 난다  또한 다르덴 형제의 오랜 조력자인 알랭 마르코앤은 걸러지지 않은 자연광과 얕은 심도의 렌즈를 이용  핸드헬드로 훌륭  촬영해서 기술적인 성과도 함께 보여준다 ,melo
10,오스틴랜드,서른을 훌쩍 넘기고 외로운 솔로로 살아가는 제인 케리 러셀 은 펑범해 보이지만 특별한 비밀을 간직하고 있다  바로  제인 오스틴 의 골수 팬인 것  온 방안을 리젠시 시대의 인테리어로 장식하고   오만과 편견 의 책과 영화를 복습하고   오만과 편견 의 주인공  다아시 를 현실 속의 어떤 남자보다 더 사랑하는 제인  그녀는 모아둔 돈을 모두 털어 제인 오스틴의 소설 속 세계를 체험하는 영국의 리조트  오스틴 랜드 로 여행을 떠난다    세기 스타일로 완벽하게 변신한 제인  드레스를 차려 입은 그녀 앞에 로맨틱한 티타임과 화려한 무도회가 펼쳐지고 멋진 귀족들이 등장한다  거만하고 냉소적인 미스터 노블리 제이제이 필드   자유분방하고 다정다감한 마구간지기 마틴 브렛 맥켄지 을 만난 제인은 현실 세계과 가짜 세계 속의 사랑과 욕망 사이에서 갈등하는데   ,melo
11,라이온 킹 2(패키지상품 : 더빙판 추가증정),심바와 날라가 결혼한 후 귀여운 딸 키아라가 태어난다  심바는 키아라에게 진정한 왕의 길을 가르치려 하지만 키아라는 심바의 보호를 벗어나 혼자 돌아다니기를 좋아하고  심지어 금지된 땅으로 들어가는 모험도 감행한다  어느날 키아라는 금지된 땅에서 우연  악어떼의 습격을 받게 되고  간신  코부라는 이름의 사자에게 도움을 받게 되고 그와 친해지게 된다  그러나 코부는 심바의 적인 지라의 아들  호시탐탐 심바에게 복수할 기회를 엿보던 지라 일당은 이들의 만남을 이용하려 하는데   ,melo
12,더티 댄싱,    년 여름  베이비                제니퍼 그레이 분 라는 애칭으로 불리는   세의 프란시스는 의사인 아버지 제이크                제리 오바하 분 와 어머니 마조리                    켈리 비솝 분   그리고 언니 리사       제인 브루커 분 와 함께 아버지의 친구가 경영하는 켈러만 산장                            으로 피서를 떠난다  그곳에는 같은 또래의 젊은이들이 많이 있어 저녁이면 댄스 파티를 즐기곤 하지만 어딘지 틀에 박  파티가 썩 마음에 들지 않는다  그러다가 산책 도중 우연  숲속 산장에서 젊은이들의 기괴한 댄스 파티를 발견하다  기성세대에서는 볼 수 없는 음란한 율동의 춤  소위 더티 댄싱이었다  그곳에서 베이비는 낮에 본 핸섬한 댄스 교사 자니                패트릭 스웨이즈 분 와 그의 파트너인 페니                신시아 로즈 분 가 추는 춤에 그만 매료된다  그런데  우연  페니가 그곳에서 아르바이트를 하는 로비               맥스 캔터 분 라는 예일대생과의 관계로 임신한 사실을 알게 되었고  낙태 수술할    달러가 없어 고민하고 있는 것도 알게 된다  베이비는 아버지에게 돈을 빌려 건네주자  처음엔 거절하지만 그의 호의를 고마워하는데   스포일러  한편 페니가 수술을 받아야 할 시간에 대신 춤을 추게 된 베이비는 자니와 연습을 거듭하면서 사랑에 빠지게 된다  페니가 돌파리 의사에게 위험한 수술을 받아 사경을 헤메자 베이비는 의사인 아버지를 데려와 위기를 모면하지만 아버지의 감시를 받게 된다  더구나 자니가 사장의 오해를 받는 것을 보다 못해 자신과의 관계를 말해 아버지의 실망을 사게 되고  자니도 해고되어 그곳을 떠나게 된다  피서 마지막 날 파티에서  쓸쓸  공연을 지켜보던 베이비에게 떠났던 자니가 느닷없이 나타나 두 사람은 그동안 금기시 되어왔던 더티댄싱을 추게 된다  이를 황홀  지켜보는 홀안의 사람들은 모두 댄스에 합류하게 되고  제이크는 그동안 페니를 임신시켜 위험한 낙태 수술까지 가게 했다고 생각한 자니의 오해가 풀리자 그에게 사과를 한다 ,melo
13,매기스 플랜,       아이는 갖고 싶지만 결혼은 원치 않는 감성파 뉴요커  매기  그레타 거윅 는 소설가를 꿈꾸는 어른아이 같은 대학 교수  존  에단 호크 을 우연  만나게 된다           존 은 자신을 이해하고 소설을 좋아해주는 사랑스러운  매기 와 불 같은 사랑에 빠지게 되고                    존 과 결혼을 하고 그토록 원하던 귀여운 딸과 함께 행복한 결혼생활을 원했던  매기   하지만 시간이 지날수록  존 이 변해가는 것을 느끼게 되고   매기 는 뜻밖의 결심을 하게 되는데    만나고  사랑하고  결혼하고  그 다음 차례가 궁금해지는               ,melo
14,NULL,NULL,melo
15,미녀와 야수,칠흑같이 어둡고 시리도록 차가운 저주는  야수의 심장을 얼어붙게 만들었다     예기치 않게 찾아온 운명의 밤   장미 한 송이로 시작된 위험한 거래 그리고 사랑     순수한 사랑을 갈망하는 외로운 야수와 얼어붙은 그의 심장을 녹일 아름다운 벨의  폭풍보다 강렬하고 장미보다 매혹적인 초대형 판타지 로맨스가 시작된다 ,melo
16,NULL,NULL,melo
17,오직 사랑하는 이들만이 살아남는다,미국 디트로이트와 모로코 탕헤르라는 먼 거리에 떨어져 지내는 뱀파이어 커플 아담과 이브  수세기에 걸쳐 사랑을 이어온 이들이지만 언더그라운드 뮤지션으로 활동 중인 아담은 인간 세상에 대한 염증으로 절망에 빠져 있다  이브는 그를 위로하기 위해 디트로이트행 밤비행기에 몸을 싣고 마침내 두 사람은 재회한다  그러나 만남의 기쁨도 잠시  이브의 통제불능 여동생 애바의 갑작스런 방문은 숨겨두었던 뱀파이어의 본능을 일깨우기 시작하는데    세기 현대사회  아담과 이브는 과연 영원한 삶과 사랑을 이어갈 수 있을까 ,melo
18,NULL,NULL,melo
19,말할 수 없는 비밀(리마스터링),나는 너를 사랑해 너도 나를 사랑하니  예술학교로 전학 온 상륜 주걸륜 은 아버지의 영향을 받아 피아노에 천부적인 소질을 보인다  학교를 둘러보던 중  신비스러운 피아노 연주가 흘러나오는 옛 음악실을 발견하게 되고  그곳에서 샤오위 계륜미 를 만난다  그들은 아름다운 피아노 선율처럼 즐거운 시간을 보내고  둘 사이에는 애틋한 마음이 싹튼다  그러나 상륜이 샤오위를 더 알고 싶어할 때마다 그녀는 비밀이라고 일관하며 의미심장한 미소만 짓는다  그러던 어느 날  샤오위는 상륜이 같은 반 여학생 칭요와 뽀뽀하는 모습을 보게 되고  그의 곁에서 사라지는데 ,melo
20,NULL,NULL,melo
21,NULL,NULL,melo
22,파이브 피트,접근 금지 허그 금지 키스 금지 이 로맨스 성공할 수 있을까   같은 병을 가진 사람끼리  피트 이하 접근해서도  접촉도 해선 안되는    낭포성 섬유증 를 가진  스텔라 와  윌   첫눈에 반한 두 사람은 서로를 위해 안전거리를 유지하려고 하지만 그럴수록 더욱 빠져든다   손을 잡을 수도 키스를 할 수도 없는 그들은 병 때문에 지켜야 했던  피트에서  피트 더 가까워지는 걸 선택하고 처음으로 용기를 내 병원 밖 데이트를 결심한다   그러나 갑자기 숨을 쉬지 못하는  스텔라    윌 은 그녀를 살리기 위해 안전거리를 어기게 되는데 ,melo
23,로마의 휴일,왕실의 딱딱한 제약과 정해진 스케줄에 피곤해 지고 싫증난 앤 공주               오드리 헵번 분 는 거리로 뛰쳐나가 잠들었다가 어느 신사              그레고리 펙 분 를 만난다  그와 함께 아이스크림도 맛나게 먹고 신나게 스코터를 타고 다니면서 서민의 즐거운 생활을 맛 본 앤 공주는 신사와의 고별식이 다가오자 무척이나 아쉬워한다  한편 거리에서 벤취에 잠든 여인을 만난 그 신사는 특종을 찾는 신문기자였다  그저 불쌍한 여인인 줄 알았던 아가씨가 앤 공주임을 알아챈 기자는 굴러들어온 특종감을 만났으니 신나기 그지없었다  아무 것도 모르는 앤 공주는 신사가 이끄는 대로 로마 거리를 즐겁게 따라다니면서 헤프닝을 벌여서 그야말로 특종 사진감이 되어준다  친절하고 온건한 신사 죠에게 어느새 정이 든 앤 공주  그리고 자신의 특종을 위해서 열심  뛴 죠 기자도 이렇게 너무나 순순한 앤 공주에게 이끌리는 마음은 어쩔 수가 없었다  그래서 특종을 목표로 찍었던 사진을 앤 공주를 위해 보도를 않기로 하고 기자회견 석상에서 아무렇지도 않게 건네준다 ,melo
24,NULL,NULL,melo
25,헤이팅 게임,같은 사무실을 쓰는 루시와 조슈아는 서로 싫어하는 티를 굳이 숨기지 않는 자타 공인 회사 앙숙  딱 한 사람만 승진할 수 있는 기회가 생기자 두 사람은 더욱 티격태격하기 시작한다  라이벌 의식을 불태우던 루시는 어느 날 조슈아가 나오는 야한 꿈을 꾸게 된 뒤 그를 의식하게 되는데 ,melo
26,청춘적니,  살  빈 교실에서 우연  마주친  링이야오 에게 첫눈에 반한  뤼친양   그의 순수한 고백에  링이야오  역시 호감을 느끼며 두 사람은 사랑을 쌓아 나가기 시작한다  하지만 사랑이 전부일거라고 생각했던   대와 달리   대에 들어선 두 사람은 점차 현실적인 문제들로 지쳐가고  마침내 두 사람이 사랑한 지   년이 되는 날   뤼친양 은  링이야오 를 위해 운명적인 선택의 기로에 서게 되는데      내 청춘 속 누구보다 빛났던 너  세상 끝에서 다시 함께하게 될 거야 ,melo
27,어톤먼트,    년 영국  부유한 집안의 아름다운 딸 세실리아 키이라 나이틀리 는 시골 저택에서 여름을 보내던 중 집사의 아들이자 명문대 의대생 로비 제임스 맥어보이 와 마주친다  어릴 때부터 서로에게 애틋한 마음이 있었지만 쉽게 마음을 고백하지 못하던 이들은 그날 밤 서로의 사랑을 확인한다  하지만 이들을 지켜본 세실리아의 동생 브라이오니의 오해로 로비는 억울한 누명을 쓰고 전쟁터로 끌려가게 된다  이후 세실리아는 로비가 전쟁터에서 돌아오기만을 기다리며 간호사로 일하게 되고  로비 또한 세실리아를 다시 만난다는 단 하나의 일념으로 전쟁터에서 살아남는데 ,melo
28,5 투 7,  살 뉴요커  풋내기 작가 지망생 브라이언 매일매일 출판사의 거절 레터를 받으며 하루하루 지쳐가는 브라이언  그는 어느 날 길을 걷다가 그의 가슴에 들어온 운명의 그녀 아리엘을 만난다  인어공주와 같은 이름을 가진 그녀는 뉴욕에 온지 얼마 안 된다고 이야기하고 브라이언은 완숙하며 지적인 매력을 가진 그녀에게 더욱 끌리는데    살 파리지엔느  완숙한 그녀 아리엘 파리에서 온지 얼마 안되어서 아직 뉴욕이 낯선 그녀 아리엘  그녀에게 다가온 브라이언 때문에 사랑을 믿지 않던 그녀가 흔들린다  프랑스에선 배우자가 있어도 자신만의 시간을 가질 수 있는 오후  시에서  시  아리엘은 브라이언에게  시에서  시까지의 특별한 데이트를 제안하는데  센트럴 파크  쿠겐하임 미술관  쉐리 르만 와인샵  크로포드 도일 서점  뉴욕의 가을 속에서 이들의 시크릿 로맨스가 시작된다 ,melo
29,NULL,NULL,melo
