,title,synopsis,category
0,"어쩌다 공주, 닭냥이 왕자를 부탁해!",어쩌다 공주가 된 필  닭냥이가 된 왕자님을 구해야 한다  왕좌를 노리는 마법사 트리스탄을 막기 위해 필은 엉망진창 원정대를 이끌고 마법의 저주가 걸린 숲으로 모험을 떠나는데     어쩌다 시작된 필 공주와 일곱 기사들의 대환장 판타지 어드벤처 ,animation
1,신비아파트 극장판 하늘도깨비 대 요르문간드,겨울방학을 맞아 가족여행을 떠난  하리 와  두리  남매는 비행기 날개에 쓰러진 하늘도깨비  주비 를 발견하고  신비 와  금비 를 소환한다   주비 를 구해준 순간  정체를 알 수 없는  스큐트 들의 공격이 시작되고  깊은 바닷속 관에서 부활한 전설의 괴수  요르문간드 는 비행기를 집어 삼키려 한다   한편 창공의 퇴마사로 선택된  강림 이 친구들을 구하기 위해 합류하지만 세상을 파괴하려는  요르문간드 는 하늘도깨비들의 왕국까지 거세게 공격하고  하리 와 친구들의 피할 수 없는 하늘 위 모험이 시작되는데   ,animation
2,마다가스카의 펭귄(패키지: 자막판+더빙판),넘치는 유머  감쪽 같은 위장술  똑소리 나는 브레인  날 때부터 남달랐던 악동 펭귄 스키퍼  코왈스키  리코  프라이빗  어느 날 그들 앞에 복수심에 불타는 문어박사 옥토브레인이 나타나고  그의 거대한 음모를 알게 된 펭귄  총사는 비밀 조직  노스윈드 와 함께 세상을 구할 사상 최대의 작전을 펼치는데    악동 펭귄들의 특급 미션이 시작된다 ,animation
3,이모티: 더 무비,스마트폰 속 이모티들의 비밀 세계  텍스토폴리스 의 제 원칙은  인  표정  각자 맡은 표정을 완벽  해내야 하지만 다양한 감정의 소유자  진 은 출동한 첫날 당황한 나머지 실수를 저지른다   진 의 실수는 스마트폰 초기화라는  텍스토폴리스 의 파멸을 불러오고  텍스토폴리스 의 시장인  스마일 은 도시를 위기에 빠뜨린  진 을 파괴하기 위해 백신봇을 출동시키는데    진 은 친구  하이파이브   해커  핵키 브레이크 와 함께  텍스토폴리스 와 자신의 운명을 구하기 위해  소스 코드 를 찾기 위한 험난한 여정을 떠난다   깨알만한 귀요미 이모티들의 가장 스마트한 어드벤처가 시작된다 ,animation
4,극장판 요괴워치: 염라대왕과 5개의 이야기다냥!,평화롭던 진달래 마을에 이상한 일들이 일어나기 시작한다  갑자기 요괴가 되어 버린 민호를 시작으로     년 미래로 보내져 버린 지바냥과 정체불명의 인간동생이 생긴 백멍이와 황멍이 바쁜 산타 대신 크리스마스 선물을 배달하게 된    뿅 급기야  요괴와 인간이 서로를 볼 수 없게 된 최악의 사태까지 벌어지는데   이 모든 사건들이 벌어질 때 마다 모습을 드러내는 염라대왕 과연 그의 정체는 무엇이고 어떤 비밀을 숨기고 있는 것인가 ,animation
5,헤라클레스(패키지: 자막판+더빙판),신들의 신전인 올림포스 산의 제왕인 제우스와 그의 아내 헤라가 아들 헤라클레스를 얻는다  초인적인 신력을 타고난 헤라클레스에게 제우스는 페가소스라는 이름의 날개 달린 조랑말을 선물한다  헤라클레스가 선물을 받는 순간 모든 신들의 갈채와 축복이 쏟아진다  하지만 이때 질투와 시기에 불타는 눈으로 나타나는 악마가 있었으니  죽은 사람의 영토를 지배하는 하이데스다  축복 대신 저주를 퍼붓는 하이데스는 언젠가 올림포스 산을 차지하려는 속셈을 갖고 있다  하지만 운명의 세 여신은 하이데스가 헤라클레스와 싸우면 지게 된다고 예언을 하고 분노한 하이데스는 우스꽝스럽고 작은 악마들  페인과 패닉에게 헤라클레스를 처치할 것을 명한다  페인과 패닉은 어린 헤라클레스를 유괴하여 땅으로 데려간 뒤  신의 능력을 없애는 약물을 먹인다  하지만 갑자기 나타난 인간들 때문에 마지막 한방울을 먹이지 못한 채 달아나고  헤라클레스는 반은 신의 능력이 남겨진 인간이 되어 양부모의 손에 길러진다  하지만 스스로도 컨트롤할 수 없는 초인적인  과 능력으로 사사건건 말썽을 일으켜 마침내 사람들로부터 쫓겨나고 만다  그는 그의 양부모로 부터 그가 지니고 있던 제우스의 표식인 팬던트를 받아들고 제우스 신전에 찾아가 출생의 비밀을 알게되고 아버지와 재회를 한다  헤라클레스는 모든 사연을 알게 되지만 문제는 오직 신만이 올림포스 산에서 살 수 있다는 점이다  헤라클레스는 진정한 신이 되기 위해 옛 친구인 페가소스와  영웅 전문 트레이너 인 필록데데스 필 을 찾아가  영웅 훈련 코스 를 우수한 성적으로 끝마치고 마침내 자신의 놀라운  을 컨트롤할 수 있게 된다  필은 그를 테스트하기 위해 지진과 불과 홍수가 넘실거리고 괴물이 득실거리는 그래서 영웅의 출현을 갈망하는 도시 테베스로 데려간다  헤라클레스는 네소스란 괴물에 시달리던 아름다운 여자 사실 멕은 죽은 애인을 구하기 위해 저승의 제왕 하이데스에게 영혼을 팔았지만 되살아난 애인에게 버려지고 하이데스와의 계약에 묶어 네소스를 유혹하고 있는 중이었다  멕을 구출한 후 테베스에 도착  머리를 자르면 그 자리에서 새로운 머리  개가 솟아나는 괴물  드라를 비롯  무수한 괴물들을 무찌르고 마을의 영웅이 되지만  진정한 영웅이 되기 위해선 최후의 관문을 넘어야 한다  하이데스는 헤라클레스의 최대의 약점이 멕이라고 확신하여 멕에게 헤라클레스를 유혹하게 하고  헤라클레스를 계략에 빠뜨려 하루 동안  을 쓰지 않게 만든후 올림포스 산으로 쳐들어가는데 ,animation
6,타마코 러브 스토리,어려서부터 우사기야마 상점가 안  타마야 떡집의 딸로 자라온 고   소녀 타마코는 자나 깨나  떡 과 상점가  그리고 방과 후 서클 바통부에 대한 생각뿐이다  그러던 어느 날  이웃 사촌이자 오랜 시간을 함께 보낸 친한 친구 모치조가 타마코에게 좋아한다고 고백한다  갑작스러운 고백에 당황한 타마코는 그 자리를 황급  피해버리고  그 날 후로 모치조와 어색한 사이가 되어 버린다  하지만 친구 미도리로부터 모치조가 도쿄의 대학에 진학하기 위해 떠난다는 사실을 알게 된 타마코는 지금까지 자신도 알지 못했던 모치조에 대한 마음을 깨닫게 되는데 ,animation
7,넛잡: 땅콩 도둑들,도심 속 공원의 말썽쟁이 다람쥐 설리  그만 나타나면 모든 일이 엉망이 되는 바람에 공원에 사는 동물들은 항상 걱정투성이다  아니나 다를까  공원에 사는 모든 동물들의 겨울나기 식량창고인 떡갈나무를 홀랑 태워먹는 설리  제대로 된 재판도 없이 통솔자 라쿤의 주도 아래 공원식구들의 만장일치로 설리는 결국 공원에서 추방을 당하고  그의 곁엔 마음 착한 생쥐 친구 버디만 남는다   주린 배를 채우기 위해 식량을 찾아 떠나는 설리와 버디  평온했던 공원과는 달리 텃세 심한 도심에는 여기저기 위험이 도사리고 있는데  온갖 우여곡절 끝에 절망만이 남았다고 생각하던 바로 그 순간  기적처럼 설리와 버디 앞에 짠 하고 나타난 땅콩가게  보기만 해도 맛깔스런 땅콩이 수북수북  설리와 버디는 땅콩가게를 털기로 결심한다   한편  먹을 거리가 없어진 공원식구들을 위해 라쿤은 여장부 앤디와 호기로운 그레이슨에게 식량을 구해올 것을 지시한다  사명감을 가지고 도심으로 나선 그들이 도착한 곳은 다름 아닌 설리와 버디가 잠입한 바로 그 땅콩가게인데    그 러 나  그 땅콩가게에는 숨겨진 비밀이 있으니  그곳은 바로 은행털이 강도범들의 위장 은신처였던 것  설리 버디    앤디 그레이슨이 땅콩을 놓고 아웅다웅 하는 사이  더 큰 위험이 그들에게 다가오는데   설리와 친구들이 땅콩을 훔치기 위해 펼치는 좌충우돌 고군분투 스토리  과연 그들은 땅콩을 차지해 올 겨울을 따뜻하게 보낼 수 있을까 ,animation
8,바다 탐험대 옥토넛 시즌4: 아슬아슬 구조대작전,    사마귀 새우                자신의 집게발이 더 강력하다며 끊임없이 싸움을 해대는 두 사마귀 새우가 우연  옥토포드에 타게 되고 둘의 싸움으로 옥토포드는 순식간에 쑥대밭이 되고 마는데       죄수 베도라치                산호초 탐사를 나갔던 대쉬와셸링턴은 아치형의 거대한 돌에 균열이 생겨 무너질 위험에 처한 걸 발견하고 즉시 주변 동물들을 대피시키기 시작한다  하지만 아치 바로 아래 사는 엄마 베도라치는 절대 집을 떠나지 않겠다고 고집을 부리고 결국 바나클은 다른 방법을 생각해 내는데       옛 옥토포드의 수수께끼                   버블 변환기 고장으로 옥토포드가 움직이지 않자 바나클과 대원들은 옛 옥토포드로 변환기를 가지러 간다  하지만 누군가가 변환기를 훔쳐가는가 하면 계속 대원들을 괴롭 는데       신비의 대벌레                 폭풍에 밀려 바다 한 가운데 있는 거대한 바위섬에 가게 된 페이소는 멸종된 것으로 알려졌던 희귀 곤충   트리 로브스터  대벌레들을 만나게 된다  하지만 옥토포드로 돌아온 후 간밤에 있었던 일을 얘기해도 아무도 믿지 않자  콰지와페이소는 함께 도서관에서 자료를 찾고  그러던 중 페이소 머리에 붙어온 아기 대벌레를 발견하는데       노란배바다뱀                                동물들 진찰을 나갔다 거대한 무리를 이루고 있는 노란 배 바다뱀 무리를 발견한 페이소는 도움을 청하는 목소리를 듣고 바로 무리로 향한다  하지만 곧 몰아 닥친 폭풍에 쓸려 페이소와 뱀들은 해변으로 올라가고 뜨거운 햇빛과 부상으로 위험에 처하는데       바이올렛 바다달팽이                 해변으로 모처럼 휴일을 즐기러 간 옥토넛  오랜만에 서핑을 즐기던 대쉬는 서핑 달팽이로 불리는 바이올렛 바다달팽이 두 마리를 만나고 함께 거대한 파도에 도전한다  하지만 파도가 너무 커 거품 만들기에 실패한 달팽이들은 파도에 휩쓸려 위험에 처하는데 ,animation
9,거꾸로 된 파테마,멀지 않은 미래  끝없이 이어진 터널로 가득한 지하세계에 살고 있는  파테마 는 족장의 딸이자 호기심 많은   살 소녀이다  보지 못했던 세계를 경험하고 싶은  파테마 는 어느 날 접근금지지역을 탐사하던 중 공중에 떠다니는 작은 물체들과 이상한 빛으로 가득 차 있는 공간을 발견한다  그 곳을 살피던  파테마 는 천정에 서 있는 누군가에 놀라 터널 아래로 떨어지면서 중력이 반대로 되어 있는 또 다른 지상세계로 나오게 된다   파테마 는 지상세계에 살고 있던 소년  에이지 와 마주치게 되고  묘한 공감을 느끼면서 곧 친해진다  한편   에이지 가 살고 있는 지상세계를 독재하고 있는  이자무라 의 일당은 지하세계에서 온  파테마 를 쫓고   파테마 와  에이지 는 그를 피해 달아나던 중 두 개의 세계에 얽  놀라운 비밀과 맞닥뜨리게 되는데 ,animation
10,극장판 헌터X헌터 : 팬텀루즈,세계  대 미색 중 하나인  붉은 눈 을 가진 쿠르타족  위험도  클래스의 도적집단 환영여단은 이를 노리고 크라피카만을 남겨둔 채  쿠르타족 전원을 잔인하게 몰살 시킨다  유일하게 살아남은 크라피카는 오직 일족의 복수를 위해 헌터가 되기로 결심한다  헌터가 되기 위한 여행 도중  각기 다른 이유로 최고의 헌터를 꿈꾸는 곤  키르아  레오리오를 만나 우정을 쌓는다  그러나 즐거움도 잠시  크라피카마저 속수무책으로 붉은 눈을 빼앗기고 마는데  드디어 밝혀지는 크라피카의 비밀  피할 수 없는 운명을 건 복수   헌터 헌터  사상 단 한 번도 드러나지 않았던 이야기가 지금 시작된다 ,animation
11,밤의 이야기,매일 밤  작고 낡은 극장에 소년과 소녀  그리고 이들에게 놀라운 동화를 들려주는 중년의 남자가 찾아온다  이들이 누구인지  어디에서 왔는지  왜 이곳에 모이는지는 중요치 않다  시간과 공간을 초월하며 환상적인 동화를 만들어가는 세 사람  이들은 중세시대의 늑대인간  티벳의 아름다운 연인  아즈텍의 괴물과 상상의 세계로 이어지는 동굴  무시무시한 마법사와 사슴으로 변한 공주의 이야기를 만들며 자신들만의 동화세계를 꾸며나간다  빛과 어둠  경이로운 색채와 웅장한 음악으로 채워진 마법 같은 애니메이션이 오늘 밤  당신을 기다리고 있다 ,animation
12,몬스터 하우스2: 인비져블 피닉스,쉿  우리 집에 보이지 않는 누군가 있어   사람에게는 보이지 않지만 집을 돌보고 유지하는 집 요정  핀  열심  집을 지키는 핀들과 다르게 아웃사이더인  피닉 은 사람들을 싫어한다  사람은 그저 시끄럽고 자신을 괴롭 는 존재일 뿐   이사 오는 모든 사람들을 괴롭 며 내쫓기 바쁜  피닉 의 집에 범상치 않은 소녀  크리스틴  가족이 이사를 오게 되고 설상가상으로  크리스틴 에게 정체까지 들켜버린다   한편  마을에 미스터리한 소동이 일어나 평화가 깨져버리고 뜻하지 않은 위험에 처한  핀 과  크리스틴    과연 마을을 덮친  그것 의 정체를 밝 고 집을 지켜낼 수 있을까 ,animation
13,[극장판] 그날 본 꽃의 이름을 우리는 아직 모른다,어린 시절 단짝 친구들인  초평화 버스터즈   인방  감춰 두었던 첫사랑을 수줍게 고백한 어느 여름날   멘마 가 갑작스레 모두의 곁을 떠난다  이후 각자 상처와 짐을 안은 채 뿔뿔이 흩어진 친구들  그리고  년 후  팀의 리더였던  진땅 의 앞에  멘마 가 나타난다  모두와 함께 소원을 이루고 싶다는 그녀   진땅 은 그녀가 진심으로 바라는 소원을 찾기 위해 멀어졌던 친구들을 다시 찾게 된다   무심코 준 상처  전하지 못한 진심  내일 말하면 된다고 생각하다가 모든 것을 놓쳐버린 그들에게 다시 찾아 온 기회  친구들 사이에 멈춰있던 시간이 다시 흐르기 시작한다  과연 이들은  멘마 의 소원을 이루고 한여름의 첫사랑을 되돌릴 수 있을까 ,animation
14,짱구는 못말려 12기 - 폭풍을 부르는 석양의 떡잎마을 방범대,술래잡기를 하던 짱구와 친구들은 낡은 극장으로 들어간다  그런데 짱구가 화장실에 간 사이에 친구들은 모두 사라지고 집에도 가지 않았다고 한다  짱구는 가족들과 친구들을 찾으러 극장에 갔다가 영화 속으로 빨려 들어간다  그 안에서 사라진 친구들을 만났지만 친구들은 이미 예전 기억을 잃어버린 상태다  시간이 멈추고 기억이 사라지는 곳  저스티스 시티  이 이상한 공간에서 빠져 나가려면 악당 저스티스를 물리쳐야 하는데    짱구와 친구들은 과연 저스티스를 물리치고 다시 이 세계로 돌아올 수 있을까 ,animation
15,NULL,NULL,animation
16,숀더쉽 더 무비: 꼬마 외계인 룰라!,머 언 우주에서 길을 잃고 지구에 오게 된 꼬마 외계인  룰라   우연  양떼목장의 비글비글 사고뭉치들  숀 과 친구들을 만난다  달콤한 젤리와 초콜릿이 가득한 지구에서 즐거운 시간을 보내지만 엄마 아빠가 보고 싶은  룰라 를 위해 집을 찾아 주기로 하는  숀 과 친구들  우주에 가기 위해  룰라 가 잃어버린    를 찾아 나서고 한편 수상한 비밀요원  에이전트 레드  일당이  룰라 를 추적하는데  과연   룰라 는 무사  엄마 아빠 곁으로 돌아갈 수 있을까 ,animation
17,마다가스카3 : 이번엔 서커스다!,펭귄 일행을 찾아 몬테 카를로로 향한 뉴요커  인방  알렉스  사자    마티  얼룩말    멜먼  기린    글로리아  하마   마침내 도착한 유럽  하지만 펭귄들과 만난 반가움도 잠시   캡틴 듀브아 에게 쫓기는 신세가 된다  우연  유럽 서커스단의 도움으로 위기를 모면한  인방  서커스단이 미국으로 향한다는 말에 자신들을 뉴욕의 서커스단이라고 속이고 합류하지만 첫 공연을 엉망으로 망치고 만다  그러나 뉴욕으로 가기 위해서는 어떻게든 서커스를 성공시켜야 하는 상황  유럽 서커스단과  을 합친 뉴요커  인방은 전에 없던 새롭고 환상적인 서커스 공연을 준비하기 시작하는데   지금까지의 서커스는 잊어라  세상을 놀라게 할 그들의     가 시작된다 ,animation
18,제임스와 거대한 복숭아(자막판),바닷가 작은 마을에서 엄마  아빠와 행복하게 살고 있던 어린 소년 제임스  아빠는 제임스의 생일날 곧 이사가게 될 뉴욕의 사진을 보여주며 행복해한다  그러나 제임스의 부모는 동물원을 탈출한 코뿔소에게 사고를 당하고  졸지에 고아가 된 제임스는 이모들에게 맡겨진다  제임스의 이모 스파이커와 스폰지는 신데렐라의 계모를 능가할 정도의 고약한 심술꾼들  이모들은 어린 제임스에게  든 집안 청소에서부터 온갖 잡일을 시키며 제임스를 괴롭 다  이모들의 학대에  들고 외로운 나날을 보내던 제임스는 어려울 때마다 아빠가 남겨준 뉴욕 여행 책자를 보면서 꿈과 희망을 잃지 않는다  그러던 어느날 제임스는 정원에서 마법사 아저씨를 만나게 되고 마법사는 신비한 마법의 약을 건네며 약을 먹으면 신비한 일이 일어날 것이라고 말하고 사라진다  마법의 약을 받고 놀래서 급하게 뛰어가던 제임스는 그만 넘어지고  마법의 약은 죽은 복숭아 나무 아래에 쏟아진다  그런데 마법의 약이 쏟아진 뒤 죽은 복숭아 나무에는 열매가 열리고 집보다 더 큰 거대한 복숭아 나무가 된다  제임스는 다행  마법의 약을 담았던 봉투에서 마지막 남은 한 알을 먹게 되고  거대한 복숭아 안으로 들어가게 되는데     복숭아 안으로 들어간 제임스는 그곳에서 베짱이 할아버지  지네 아저씨  지렁이 아저씨  무당벌레 아줌마  반딧불 부인  거미 누나를 만나 친구가 된다  그리고 곤충 친구들과 함께 복숭아를 타고 바다 건너 꿈의 도시 뉴욕에 가기 위한 모험을 시작하는데 ,animation
19,꼬마참새 리차드: 아프리카 원정대,태어나자마자 황새의 손에 길러져 자신도 황새라고 믿는 꼬마참새  리차드   겨울이 다가오는 어느 날  리차드는 자신이 참새여서 황새가족과 아프리카로 갈 수 없다는 청천벽력 같은 이야기를 듣게 된다   충격에 휩싸인 채  떠나버린 황새가족을 찾아 아프리카로의 여정을 시작한 리차드는 남들에겐 보이진 않지만 자신만의 친구를 가진 식욕충만한 올빼미  올가 와 노래도 못하면서 아이돌인 줄 아는 앵무새  키키 를 만나고 스릴 넘치는 여정을 함께하는데   과연  꼬마참새 리차드와 친구들은 꿈을 이루고  아프리카에 무사  도착할 수 있을까 ,animation
20,하이큐!! 땅 VS 하늘,전국 대회 출전을 향한 치열한 접전 끝에 네코마  후쿠로다니  노헤비  이타치야마 고교 배구팀이 도쿄 대표 결정전에 오른다   마지막 결정전을 두고 더욱 치열해진 결전에 모든 고교팀이 최후의 승부수를 던지는데   최강이 되기 위한 운명의 승부  불타오른다  한번 더 ,animation
21,그린치,모두가 행복한 크리스마스를 참을 수 없는 그린치는 크리스마스를 훔치기 위해 산타가 되기로 결심한다  그린치는 만능집사 맥스  덩치만 큰 소심 루돌프 프레드와 함께 슈퍼배드한 크리스마스 훔치기 대작전에 돌입하는데   슈퍼배드한 그린치   만능 집사 맥스   덩치만 큰 소심 루돌프 프레드  크리스마스 훔치기 대작전이 시작된다 ,animation
22,NULL,NULL,animation
23,쿠스코? 쿠스코!, 옛날 옛적에  정글 깊숙한 곳에서                                                 먼 옛날  중남미의 어느 나라에 쿠스코란 이름의 황제가 있었다  세상을 쥐었다 놨다하는 권력을 가진 그는 뭐든 자기 기분대로 안되면 상대가 누구든 박살을 내버리는 괴팍한 황제다  마을에 있는 언덕의 따뜻한 양지에 여름 별장을 짓고 싶은 쿠스코는 마을 대표이자 마음씨 착한 농부 파차를 소환한다  한편 황제의 권력을 노리는 마법사 이즈마는 시종인 크롱크를 시켜서 황제를 독살시키려는 계획을 세운다  파차가 황제를 만나고 돌아간 뒤  크롱크는 쿠스코에게 독약을 먹인다  그런데 아뿔사  목숨이 끝장나야 되는 황제가 라마로 변한 게 아닌가  당황한 이즈마는 크롱크에게 라마 황제를 끌고 나가서 죽이라고 명령한다  그러나 천방지축 실수만 연발하는 크롱크는 자루에 넣은 라마 황제를 시장 바닥에서 잃어버리고 만다  자신의 마을이 황제의 별장으로 변해버릴 것을 걱정하며 집으로 돌아온 파차는 마차에서 꿈틀거리며 살려 달라고  말하는  라마를 발견하곤 경악한다  라마 황제를 확인 사살까지는 하지 못하고 돌아왔다는 크롱크의 설명를 듣고 이즈마는 화가 머리 끝까지 치민다  자신이 왜 라마가 됐는지 모르는 쿠스코 황제  어떤 수를 써서든 언덕 마을에 별장을 짓지 못하도록 막고 싶은 파차  살려 뒀다간 어떤 화가 닥칠지 모른다는 두려움 때문에 다급해진 이즈마  자신이 선과 악의 어느 쪽에 속하는 지 도무지 갈피를 못 잡는 크롱크    이들 네 사람 아니  세 인간과 한 마리 동물 사이에 목숨과 명예를 건  쫓고 쫓기는 추격전이 시작되는데     과연 라마가 된 황제는 다시 인간 황제가 될 수 있을 것인지   ,animation
24,NULL,NULL,animation
25,극장판 안녕 자두야,대한민국 국민 절친  명랑소녀 최자두   자두렐라    자두와 그레텔  명작동화 주인공이 된 자두의 동화나라 평정기가 시작된다  어린이날을 맞아 가족들과 함께 놀이공원  꿈의 랜드 로 놀러 가게 된 천방지축 최자두  동생들과 신나게 놀이기구를 타던 자두는 급  화장실을 찾게 되고  우연  들어가게 된 건물에서 오래된 책을 한 권 꺼내들게 된다  그런데 동화책을 펼치는 순간  알 수 없는 빛과 함께 자두는 책 속으로 빨려 들어가게 되는데    어린이날  꿈의 랜드에서 마법 같은 여정이 시작된다 ,animation
26,몬스터 하우스2: 인비져블 피닉스,쉿  우리 집에 보이지 않는 누군가 있어   사람에게는 보이지 않지만 집을 돌보고 유지하는 집 요정  핀  열심  집을 지키는 핀들과 다르게 아웃사이더인  피닉 은 사람들을 싫어한다  사람은 그저 시끄럽고 자신을 괴롭 는 존재일 뿐   이사 오는 모든 사람들을 괴롭 며 내쫓기 바쁜  피닉 의 집에 범상치 않은 소녀  크리스틴  가족이 이사를 오게 되고 설상가상으로  크리스틴 에게 정체까지 들켜버린다   한편  마을에 미스터리한 소동이 일어나 평화가 깨져버리고 뜻하지 않은 위험에 처한  핀 과  크리스틴    과연 마을을 덮친  그것 의 정체를 밝 고 집을 지켜낼 수 있을까 ,animation
27,극장판 짱구는 못말려 10기 - 태풍을 부르는 장엄한 전설의 결투,어느 날 밤 짱구 가족은 동시에 사극에서 본 듯한 아름다운 여성이 나오는 꿈을 꾼다  다음 날 짱구가 유치원에서 돌아오자 흰둥이가 마당의 흙을 파헤쳐 놓는 사건이 발생하는데  그 구덩이에서 나온 문서엔 서툰 글씨로 자기가 떡잎성에 있다는 내용이 적혀 있었다  문서를 읽어나가던 짱구는 굉장  아름다운 아가씨가 있다는 내용에서 지난 밤의 꿈을 회상하는데  문득 정신을 차려 보니 꿈에서 본 호숫가에 서 있는 것이 아닌가 ,animation
