,title,synopsis,category
0,리오 2,야생을 한 번도 겪어보지 못한 도시형 앵무새  블루 는 자신과 정반대의 매력을 지닌  쥬엘 을 만나 개구쟁이 세 아이를 낳고 평화로운 생활을 이어간다  그러던 어느 날 아마존에서 자신들의 동족인 파란 마코 앵무새들이 발견됐다는 소식을 접하게 되고  아내  쥬엘 의 설득에 못 이겨 도심에서         떨어진 아마존으로 모험을 떠난다  야생 라이프에 완벽 적응한  쥬엘 과 세 아이들과는 달리 도시생활에 길들여진  블루 는 깃털 나고 처음으로 가 본 아마존 정글이 불편하기만 하다  설상가상  블루 에게 두 날개를 빼앗긴 악당 앵무새  나이젤 이 복수를 위해 드림팀을 꾸려  블루 의 뒤를 바짝 쫓고  어둠의 세력까지 가세해 아마존 정글과  블루  가족을 위협하고 나서는데  ,animation
1,프랑켄위니,세상에 둘도 없는 친구이자 가족인 강아지  스파키 를 사고로 잃은 천재 과학소년  빅터 프랑켄슈타인 은 우연  수업 시간에 전기 쇼크로 개구리를 되살리는 실험을 본 후   스파키 를 되살리기 위한 비밀 작전에 돌입한다  비바람이 몰아치던 날  무덤 속  스파키 는  빅터 의 간절한 소원대로 백만 볼트의 전기 충격을 받은 후 다시 숨 쉬기 시작한다  문제는 단 하나   스파키 가 더 이상 예전의 모습이 아닌 온 몸에 꿰맨 자국과 철심이 박  채 되살아났다는 것  사상초유의 부활견  스파키 의 존재를 알게 된  빅터 의 악동 친구들은 같은 방식으로 마을 곳곳에 잠들어 있던 친구들을 깨우기에 이르는데   ,animation
2,잠자는 숲속의 공주(패키지상품 : 더빙판 추가증정),오랜 기다림 끝에 스테판 왕과 왕비 사이에 오로라 공주가 태어난다  스테판 왕은 이 날을 축제일로 정하고 온 왕국은 기쁨에 들떠 있다  프로라  포나  메리웨더 요정은 아기에게 한가지씩 축복을 내려준다  프로라는 아름다움을  포나는 고운 목소리를 그리고 메리웨더가 영원  행복하라고 축복을 내리려는 순간 축제에 초대 받지 못한 데 앙심을 품은 악의 요정 멀레피센트가 나타나 오로라 공주가   세 생일날 물레 바늘에 손가락이 찔려 죽을 것이라는 저주를 내리고 사라진다  그러자 축복을 하지 못했던 메리웨더는 공주가 죽는 대신 깊은 잠에 빠지고 진정한 사랑의 키스만이 공주를 깨울 수 있다고 고쳐 말한다  왕은 공주에게 닥쳐올 재앙을 막고자 나라안의 모든 물레를 불태우라고 명령을 내리지만 요정들은 마녀의 눈을 피해 숲속에서 공주를 기르도록 왕비를 설득한다  공주는 요정들에 의해 숲속에서 무럭무럭 자라고 어느날 숲속 동물들과 달콤한 노래를 부르다 근처를 지나던 이웃나라의 필립 왕자와 첫 눈에 사랑에 빠진다  한편 요정들에 의해 자신의 신분을 알게 된 공주는 궁으로 돌아가게 되고 왕궁의 탑 속에 홀로 남은 공주를 찾아낸 멀레피센트의 계략에 의해 마침내   세 생일날 깊은 잠에 빠지게 되는데   과연 오로라 공주는 왕자님으로부터 진정한 사랑의 키스를 받고 깊은 잠에서 깨어날 수 있을까 ,animation
3,NULL,NULL,animation
4,슈퍼 키드 헤일리,안녕  내 이름은 헤일리   슈퍼 라이언 이야  아기 혼자 탄 유모차가 움직이고 있어요 악동 여우원숭이가 동물원을 탈출했어요 기차의 브레이크가 고장나서 멈추지 않아요 마을의 안전과 평화를 지키는 슈퍼  어로   슈퍼 라이언 의 정체는 바로 우리 가족이야  수백 년 전부터 할머니  아빠까지 대대로  슈퍼 라이언 이 되어 마을을 지키고 있지  이제는 내가 그 자리를 물려 받을 차례  그런데 사촌 아드리안이 탐내고 있다고  비록 난 운동신경도 꽝  초능력도 꽝이지만  내가 진짜  슈퍼 라이언 이라는 걸 증명해내겠어 ,animation
5,디지몬 어드벤처 트라이 제1장: 재회,디지털 월드로 통하는 게이트가 원인도 모른 채 닫혀 버린 지도 대략  년이란 시간이 흐르고  이른바  선택받은 아이들 도 훌쩍 커서 타이치가 고등학교  학년이 되었다   선택받은 아이들 도 각자의 바쁜 생활에 쫓기며 서로 만나는 일도 점점 줄어들고 있던 가운데  어느날 도심 한가운데 쿠와가몬이 나타나 날뛰기 시작한다  날뛰는 쿠와가몬을 막기위해 홀로 아수라장으로 뛰어든 타이치  그러나 아구몬 없이 혼자서는 역부족이라는 것을 깨닫고 위기에 빠지는 순간  아구몬이 나타나 타이치를 구해준다   을 합쳐 쿠와가몬을 막아내고 디지몬과 선택받은 아이들이 한자리에 모두 모이며 재회의 기쁨을 나누는 것도 잠시  의문의 단체가 그들에게 접근해 오는데   ,animation
6,극장판 나에게 천사가 내려왔다! 프레셔스 프렌즈,언제나 사이가 좋은 하나   나타  노아  코요리  카논은 오늘도 미야코가 만든 수제 과자 앞에 옹기종기 모여 앉아 과자 파티를 한다  과자 중에는 하나가 꽂은 머리핀과 똑같이 생긴 꽃모양 쿠키가 있었다  그 머리핀은 하나가 어렸을 때 외할머니에게 받은 소중한 보물로 아이들은 하나와 외할머니 이야기를 흥미진진하게 듣는다  그러다가 문득 수학여행 연습도 할 겸 하나네 외할머니 댁에 놀러 가기로 하는데   ,animation
7,엄마의 땅: 그리샤와 숲의 주인,눈과 얼음의 땅에서 순록과 함께 살아가는 소녀  그리샤 는 원인 모를 병에 걸린 엄마를 살리기 위해 전설로 전해오는 숲의 주인을 찾아 떠난다   북극성을 따라서 땅의 끝에 다다른  그리샤  앞에 나타난 붉은 곰은 그녀가 선택받은 존재임을 알려주는데   설원의 소녀  새로운 운명을 맞이하다 ,animation
8,엄마의 땅: 그리샤와 숲의 주인,눈과 얼음의 땅에서 순록과 함께 살아가는 소녀  그리샤 는 원인 모를 병에 걸린 엄마를 살리기 위해 전설로 전해오는 숲의 주인을 찾아 떠난다   북극성을 따라서 땅의 끝에 다다른  그리샤  앞에 나타난 붉은 곰은 그녀가 선택받은 존재임을 알려주는데   설원의 소녀  새로운 운명을 맞이하다 ,animation
9,도라에몽: 스탠바이미 2, 할머니를 만나고 싶어   어느 날 진구는 돌아가신 할머니와의 추억이 담긴 낡은 곰 인형을 발견하고 할머니가 보고 싶은 마음에 도라에몽의  차원 비밀도구 타임머신을 타고 과거로 향한다  느닷없이 찾아온 소년을 금세 진구라고 믿어주시는 할머니는 한 가지 소원을 말씀하시는데    진구의 아내를 만나보고 싶구나  결혼식을 보여 드리기 위해 미래로 간 도라에몽과 진구  하지만 이슬이와의 결혼식 당일 신랑 진구는 도망가 버리고 퉁퉁이와 비실이가 진구를 찾는 동안 이슬이는 진구를 믿고 기다리는데  할머니의 소원을 위해  그리고 가족과 친구들  좋아하는 이슬이와의 약속을 위해 도라에몽과 진구의 과거와 현재  미래를 넘나드는 스펙터클한 대모험이 시작된다 ,animation
10,스머프: 비밀의 숲,스머프 마을의 꾸러기  인방  스머페트  똘똘이  덩치  주책이  숲 속에서 우연  동그란 눈  파란 몸을 가진 정체 모를 녀석   을 발견하지만 그 녀석은 이내 숲으로 사라진다  그의 정체가 너무나도 궁금했던 스머프들  파파 스머프를 감쪽같이 속이고 금지된 비밀의 숲으로 모험을 떠난다   파파 스머프가 절대 들어가지 말라고 했던 그 곳  비밀의 숲은 난생 처음 보는 생물들로 가득 찬 신비의 공간이었다  하지만 감탄도 잠시  마법사 가가멜 일당에게 쫓겨 혼비백산 도망가던 중 그렇게나 궁금했던 정체 모를 그 녀석들과 딱 마주치게 되는데    파란 몸  노란 모자의 너  누구냐   ,animation
11,극장판 미니특공대: 공룡왕 디노,호기심 많은 소년  얀 은 공룡왕 열쇠로  디노 를 만나 비밀친구가 된다  그러던 중 우주악당  퀸 이 지구를 위협하고 이에  미니특공대 는 공룡왕  디노 와 함께 역대급 대결을 펼치는데     과연   미니특공대 와 공룡왕  디노 는 지구를 지켜낼 수 있을까  ,animation
12,코쿠리코 언덕에서,항구가 보이는 언덕에서 코쿠리코 하숙집을 운영하는 열여섯 소녀  우미 는 바다에서 돌아가신 아버지를 생각하며 매일 아침 안전한 항해를 기원하는 깃발을 올린다  그 깃발을 매일 바다 위에서 바라보는 열일곱 소년  슌   한편  낡은 것을 모두 부수고 새로운 것으로 바꾸자는 사회적인 움직임과 함께   우미 의 고등학교에서도 오래된 동아리 건물의 철거를 두고 갈등이 일어난다   우미 와  슌 은 낡았지만 역사와 추억이 깃든 건물을 지키기 위해 친구들과 함께 보존운동을 시작하고  두 사람은 이를 계기로 서로에게 서서  끌리기 시작하는데        년  월  첫사랑의 설렘이 다시 찾아옵니다 ,animation
13,진격의 거인 크로니클,거인의 침공으로부터 인류를 지키려는 인간들의 이야기를 다룬 애니메이션,animation
14,추억은 방울방울,다카하타 이사오의 대표작으로  오카모토 호타루와 도네 유코의 만화를 애니메이션화한 작품이다  오피스 레이디인 타에코는 야마가타로 휴가를 떠난다  그곳에서 그녀는 귀농 청년 도시오를 만나고  둘은 점점 가까워진다  여름 휴가가 끝난 후  도쿄로 돌아가던 타에코는 자신이 진정으로 원하는 것이 무엇인지 깨닫게 된다    제   회 부산국제영화제 ,animation
15,바이올렛 에버가든 - 영원과 자동 수기 인형 -, 전하고 싶어  나의 마음을  소중한 동생을 지키는 대가로 요크 가문에 입성한  이자벨라   더 이상 꿈도 희망도 없는 그녀의 앞에 나타난 자동 수기 인형   바이올렛 에버가든     나도  행복을 전하고 싶어  언니의 편지를 받고     우편사를 찾아온  테일러 는 사람들에게 행복을 전하는 우편배달 일을 시작하고   이자벨라 에게도 자신의 마음을 전하기 위해  바이올렛 에게 대필을 부탁하는데 ,animation
16,NULL,NULL,animation
17,치킨 런(패키지: 자막판+더빙판),    년대 영국의 트위디 닭 농장  주인인 트위디 여사 목소리  미란다 리차드슨 는 몇 년간의 달걀 판매 끝에 치킨 파이를 만들어 파는 사업을 개시할 것을 결심한다  이에 모든 닭들은 곧 닭요리 식탁에 오를 자신들의 처지를 한탄하며 공포에 떨고  암탉 진저 목소리  줄리아 사왈라 은 자신과 동료들의 탈주계획을 세우고 또 세우지만 현실적으로 아무 소용이 없다  그러던 어느날 록키 목소리  멜 깁슨 라고 불리는 미국산 수탉이 농장에 들어와서 닭들에게 날 수 있는 법을 가르쳐주겠다고 약속하면서 농장내 닭들 사이에도 본격적인 자유의 바람이 불기 시작한다  진저과 사랑에 빠진 록키는 다른 닭들을 모두 규합해 대탈주의 계획을 세우고 목숨을 건 실천에 들어가는데 ,animation
18,천재강아지 미스터 피바디,       박사학위 취득  발명  요리  댄스  연주까지    못하는 게 없는 역사상 최고의 천재  미스터 피바디  하지만 그의 정체는 바로 강아지  게다가 똘똘한 아들  셔먼 을 둔 아들바보이다   셔먼 은 같은 반 친구  페니 로부터 아빠가 강아지라고 놀림을 당하지만 의기소침도 잠시  미스터 피바디와 셔먼에겐 남들은 상상도 못할 둘만의 비밀이 있다   바로 전세계 어느 곳  어느 시대든 갈 수 있는  타임머신 이 있다는 것  레오나르도 다빈치  반 고흐  셰익스피어를 만나고 고대 이집트  프랑스 혁명  트로이 전쟁을 넘나드는 그들의 시간여행은 지칠 줄 모르고 계속 되는데   시간여행 어디까지 가봤니  천재강아지 미스터 피바디와 셔먼의 급이 다른 모험이 펼쳐진다 ,animation
19,신밧드 - 7대양의 전설(패키지: 자막판+더빙판),넘치는 혈기와 모험심으로 광활한 바다를 항해하며 약탈을 일삼는 도적계의 섹시남  신밧드  거칠 것 없는 그의 용기와 패기 앞에 엄청난 사건이 도사리고 있었으니    그것은 바로 세계의 평화를 좌지우지할  평화의 책  도난 사건  평화의 책이 사라지는 순간  세상은 일순간에 어둠에 휩싸이고 사람들은 혼란에 빠지게 된다  혼돈의 여신 에리스의 모략으로  평화의 책 을 훔친 범인으로 지목된 신밧드는 위기에 몰리게 된다   평화의 책 을 수호하는 임무를 맡은 그의 절친한 친구 프로테우스는 신밧드를 대신해 감옥에 갇 고  만약 신밧드가  평화의 책 을 찾아오지 못하면 프로테우스는 죽음을 면치 못하게 된다  그러나 프로테우스의 죽음은 아랑곳 않고  피지 로 놀러 갈 계획만 세우는 신밧드  그 앞에 프로테우스의 약혼녀인 마리나가 등장해 그의 최대의 약점인 돈을 무기로 신밧드를 매수한다  신밧드는 당돌하기 그지없는 마리나에게 이끌려  결국  평화의 책 을 찾기 위한 대장정에 오르게 되는데    그들 앞에 놓여있는 수많은 공포와 위험  과연 그들은 혼돈의 여신 에리스에 맞서  평화의 책 을 되찾고  프로테우스의 목숨을 구할 수 있을 것인가 ,animation
20,메가마인드(패키지: 자막판+더빙판),메트로시티의 막강 라이벌 메트로맨과 메가마인드  도시의 영웅 메트로맨과 달리 슈퍼 악당 메가마인드는 모든 사람들이 두려워하는 대상  그러던 어느 날    꼭 한번 메트로맨을 이기고 싶었던 메가마인드는 회심의 일격을 가하고 얼떨결에 메트로맨을 제거하는데 성공한다  하지만 승리의 기쁨도 잠시  앙숙이자  숙적이자  자신을 대적할 유일한 상대였던 메트로맨이 사라진 후 메가마인드는 예상치 못한 무료함에 점점 시들해져 가는데   ,animation
21,알라딘 2 - 돌아온 자파(패키지: 자막판+더빙판),알라딘과 함께 사악한 마법사 자파를 물리치고 램프로부터 자유의 몸이 된 지니는 수천만년 만에 얻은 자유를 만끽하고자 세계 방방곡곡으로 여행을 떠났었다  그 사이 친구들의 사정도 많이 달라졌다  아그라바와 왕실을 위기에서 구한 알라딘은 명실공  자스민 공주의 배필로 인정받고 신임 수상으로 거론되고 있었으며  아부와 날으는 양탄자도 덩달아 신수가 폈다  그러나  무엇보다 놀라운 사실은 이아고가 그 대열에 합류했다는 것  마법사 자파의 앵무새로 갖가지 사악한 잔꾀를 꾸며 알라딘과 친구들의 생명을 위협했던 이아고는 자파가 램프의 요정이 되어버린 후 그와 더불어 사막을 헤메는 신세로 전락했다  그러나  부와 권력을 탐하는 이아고는 먼지나는 사막에 머물 생각이 전혀 없었다  어떻게든 왕궁으로 복귀하려고 잔꾀를 꾸미던 그는 알라딘의 환심을 사고자 백방으로 노력한 끝에 그를 위기에서 구해주고  이를 빌미로 왕궁에 따라들어온다  한편 깊은 어둠 속에서도 복수의 칼을 갈며 호시탐탐 기회를 노리던 자파는 램프가 어리숙한 도적 아비스말의 손에 들어가자  그를 자신의 복수를 돕도록 조종하는데  ,animation
22,바다 탐험대 옥토넛 스페셜,    마리아나 해구 탐험                                대쉬와 셸링턴이 트윅이 새로 만든 옥토 심해 연구실에서 몇 주 동안 심해 연구를 하게 되자  바나클과 대원들은 심해 연구실을 지구에서 가장 깊은 마리아나 해구 바닥에 설치하기 위해 마리아나 해구로 향한다  하지만 심해 열수구에 살던 설인 게와 갖가지 동물들이 따뜻한 집을 찾아 심해 연구실로 들어오면서 전기가 끊어지는 등 문제가 생기자 바나클과 대원들은 동물들에게 새로운 집을 찾아주려 하는데       베지 크리스마스                               크리스마스를 맞아 베지멀들이 만찬준비로 정신이 없는 사이  해저 소금호수를 구경하러 나갔던 잉클링 교수  셸링턴  대쉬가 급  구조신호를 보내자 바나클은 남은 대원들을 데리고 구조에 나서지만 모두 거대한 점액 덩어리에 갇 고 만다  아무리  을 써도 빠져나갈 수 없자  바나클은 옥토포드에 남아 있는 튜닙과 베지멀들에게 비상구조작전 파일을 전송하고 도움을 청하는데         북극 대탐험                              옥토포드가 대대적인 정비를 시작하자 바나클과 대원들은 각자 휴가지로 떠난다  페이소와 함께 쌍둥이 동생 비앙카와 조카들이 있는 북극으로 향한 바나클은 조카들을 데리고 첫 해빙 사냥을 떠나지만 도중에 쉴 만한 얼음을 찾지 못해 어려움을 겪게 되는데   ,animation
23,NULL,NULL,animation
24,팅커 벨 2: 팅커벨과 잃어버린 보물(패키지: 자막판+더빙판),전세계가 사랑하는 요정 팅커벨과 함께 상상의 요정 나라로 떠나보세요  픽시 할로우를 넘어서는 흥미진진한 팅커벨의 모험이 펼쳐집니다  가을 추수 때가 되면 절의 신비로움은 절정에 달하는데  올해 픽시 할로우에는 신비로운 푸른 보름달이 뜰 예정입니다  픽시 할로우 마을의 최고 재주꾼이 된 팅커벨에게 클라리온 여왕은 가을 축제에 푸른 보름달을 맞이할 새로운 가을 홀을 만들 것을 주문합니다  하지만 팅커벨이 실수로 온 픽시 할로우를 혼돈에 빠트리게 되자  친구 테란스와 함께 모든 것을 옳게 돌리기 위한 모험을 떠납니다 ,animation
25,"어쩌다 공주, 닭냥이 왕자를 부탁해!",어쩌다 공주가 된 필  닭냥이가 된 왕자님을 구해야 한다  왕좌를 노리는 마법사 트리스탄을 막기 위해 필은 엉망진창 원정대를 이끌고 마법의 저주가 걸린 숲으로 모험을 떠나는데     어쩌다 시작된 필 공주와 일곱 기사들의 대환장 판타지 어드벤처 ,animation
26,몬스터 호텔 2,몬스터 호텔 주인  드락 의 딸     살 열혈맘  마비스 와 철부지 아빠  조니  사이에서 사랑스런 손자  데니스 가 태어나고  마침내 몬스터와 인간 세상에도 평화가 찾아온다  그런데 혼혈 뱀파이어 데니스에게서 카리스마는 커녕 몬스터와 닮은 구석이라고는 하나도 찾아볼 수가 없다     마음이 조급해진 드락은 데니스를 인간이 아닌 뱀파이어로 키우기 위해  프랭크    머레이    웨인    그리핀    블라비 까지 절친 몬스터들을 불러모아  특급 몬스터 트레이닝 을 시작하게 되는데   몬스터와 인간 사이  데니스의 정체를 둘러싼 특급 어드벤처가 시작된다 ,animation
27,빅트립: 아기팬더 배달 대모험,혼자 조용  지내는 게 가장 편한 까칠한 집돌이 곰  믹믹  앞에 어느 날  엄마에게 배달되어야 할 귀염뽀짝 아기 팬더가 잘못 배송된다  사고를 해결하기 위해 호기심지수      천방지축 트러블 메이커  오스카  토끼   부리에 엔진을 장착한 투머치토커  듀크  펠리칸   겁 많은 두 얼굴의 쫄보  야누스  늑대   꽃을 사랑하는 외로운 감성시인  아무르  호랑이 까지 합류하면서 야생 월드 역사상 가장 확실한 서비스의 애니멀 특송단이 완성되고  아기 팬더의 엄마를 찾아주기 위한 이들의 거대한 모험이 시작되는데   아기 팬더의 엄마를 찾기 위해 배달의 동물들이 떴다 ,animation
28,슈퍼미니 2,겨울나기 준비가 한창인 숲속 친구들  흑개미  틈틈이 와 그의 친구들은  인간 세상에서 달콤한  절대 설탕 을 공수하던 중 숙적인 불개미  욕심이  일당을 다시 만나고 위기에 빠지게 된다   틈틈이 를 구하러 온 무당벌레  땡글이   하지만 구출 과정에서 사고로  땡글이  아들인  땡돌이 가 캐리비안  과들루프  섬으로 발송되는 택배 박스에 실리게 된다  아빠  땡글이 와 거미 친구  예민이   그리고 흑개미  틈틈이 는  땡돌이 를 구하기 위해 긴급 구조 드림팀을 결성해 캐리비안으로 떠나게 되는데  ,animation
29,XXX홀릭: 한여름밤의 꿈,어떤 소원이든 그에 상응하는 대가만 지불하면 다 해결해 주는 그녀 이치하라 유코는 마물을 물리쳐 달라는 와타누키의 소원을 들어주는 대신  반 강제적인 아르바이트를 시킨다  어느 날 유코에게 발신자를 알 수 없는 콜렉션 행사 초대장이 날아오고  와타누키는 무뚝뚝한 클래스메이트 도메키 그리고 유코와 서양식 대저택에 동행하게 된다  주인은 나타나지 않는 가운데  명의 초대받은 수집가들은 한 명씩 자취를 감추기 시작하는데   ,animation
