,title,synopsis,category
0,클래식,같은 대학에 다니는 지혜 손예진 분 와 수경 이수인 분 은 연극반 선배 상민 조인성 분 을 좋아한다  하지만 호들갑스런 수경이 상민에게 보낼 편지의 대필을 부탁하고  지혜는 수경의 이름으로 상민을 향한 자신의 감정을 고백한다  지혜의 편지로 맺어진 수경과 상민이 가까워지면서 지혜는 괜한 죄의식에 상민을 멀리 하려 하지만  우연하게도 자꾸만 마주치게 된다  한편  아빠를 일찍 여읜 지혜는 지금은 해외 여행 중인 엄마 주희와 단둘이 살다  엄마의 빈자리를 털기 위해 다락방을 청소하던 지혜는 우연  엄마의 비밀 상자를 발견하게 된다  주희의 첫사랑의 기억이 고스란  담겨있는 비밀 상자를 보면서 지혜는 엄마의 클래식한 사랑을 조금씩 알게 된다      년 여름    방학을 맞아 시골 삼촌댁에 간 준하 조승우 분 는 그곳에서 성주희 손예진 분 를 만나  한눈에 그녀에게 매료된다  그런 주희가 자신에게만 은밀하게  귀신 나오는 집 에 동행해줄 것을 부탁해온다  흔쾌  수락한 준하는 흥분된 마음을 가까스로 누르며 주희와의 약속 장소에 나간다  그런데 갑작스런 소나기를 만나 배가 떠내려가면서 귀가 시간이 늦어지고  이 일로 주희는 집안 어른에게 심한 꾸중을 듣고 수원으로 보내진다  작별 인사도 못하고 헤어진 주희를 향한 준하의 마음은 안타깝기만 하다  그렇게 방학이 끝나고 학교로 돌아온 준하는 친구 태수에게 연애편지의 대필을 부탁받는데  상대가 주희란 사실에 깜짝 놀란다  하지만 태수에게 그 사실을 말하지 못하고  태수의 이름으로 자신의 마음을 담아 주희에게 편지를 쓴다  편지를 대신 써주며 사랑이 깊어간 엄마와 자신의 묘하게도 닮은 첫사랑  이 우연의 일치에 내심 의아해하는 지혜는 상민에 대한 생각이 더욱 깊어만 간다  하지만 이미 친구의 연인이 되어버린 그를 포기하기로 마음먹는데   ,drama
1,원 데이(특별판),현실의 벽에 부딪혀도 작가의 꿈을 놓지 않는  엠마  그저 세상을 즐기며 살고 싶은  덱스터    월   일  대학교 졸업식 날 처음 만난 두 사람   사랑과 우정 사이를 맴돌며 함께 만들어낸 스무 번의 특별한 하루   다시 시작될 그날  우리의 기념일 ,drama
2,트와일라잇,  세의 평범한 고등학생 소녀  벨라 는 집안 사정으로 워싱턴 주 포크스에 있는 아빠의 집으로 이사를 온다  전학 첫날   벨라 는 냉담하지만 자신을 무장 해제시킬 정도로 잘생긴  에드워드 와 마주치고  전율과 두려움 넘치는 인생의 전환을 맞이한다    에드워드 와 돌이킬 수 없는 사랑에 빠져든  벨라   하지만  에드워드 와 그의 가족이 뱀파이어 일족이라는 사실을 알게 되고  예기치 못한 운명에 빠져든다 ,drama
3,NULL,NULL,drama
4,태양은 가득히,일확천금을 꿈꾸는 청년 톰 리플레이             알랑 드롱 분 는 고등학교 동창이자 방탕한 부잣집 외아들 필립                     모리스 로넷 분 의 아버지로부터 그림 공부를 하러 로마에 간 필립이 공부는 하지 않고 빈둥대고 놀면서 귀국하지 않는 필립을 데려오면  천 달러를 주기로 한다  학창시절부터 필립에게 항시 괄시를 받아온 톰은 필립을 만나 그의 돈과 지위에 꿈 참고 필립의 하인 노릇을 하면서 필립을 따라다닌다  필립은 톰을 멸시하면서도 톰이 자신의 비위를 잘 맞추니까 데리고 다니는 것이다  둘은 요트를 타고 어촌 몬지베로에서 나폴리로 와 필립의 애인 마르쥬              마리 라포넷 분 를 태우고 항해를 즐긴다  필립은 톰이 두 사람의 방해물이라 생각해 인간 이하의 취급을 하는가 하면 그가 보는 앞에서 애인과 섹스를 하는 등 톰을 자극하는 게 예사이다  톰을 방해자로 생각한 필립은 사소한 시비 끝에 톰을 구명 보트에 매달고 달리다  그만 구명보트를 잃어버리게 되는데  되돌아가 톰을 구출하지만 햇볕 때문에 톰은 심한 화상을 입고 마르쥬의 간호를 받는다  필립에 대한 톰의 컴플렉스는 점점 무서운 증오로 변하고 필립은 이런 톰을 떠보기 위해 여러가지 질문을 한다  이에 톰은 필립에게 직접 그를 죽인 뒤 싸인과 필립의 타자기를 이용해 재산을 가로챌 수 있다며 엄포를 놓는다  밤에 톰은 여자의 귀걸이를 몰래 필립의 옷속에 집어 넣고  결국 이것잉 화근이 되어 필립과 마르쥬는 심하게 다툰 뒤 마르쥬가 배에서 내려버린다  그리고 파도가 치는 날 톰과 포커를 치던 필립은 귀걸이와 재산을 가로챈다는 말을 계속하다 갑자기 톰이 필립을 찔러 죽이고 만다  톰은 필립의 시체를 우의를 싼 다음 와이어에 묶어 바닷속에 쳐넣은 다음 육지로 올라와 필립의 신분증면서를 위조하고 그의 싸인도 똑같이 쓸 수 있게 연습하고 목소리까지 똑같이 한다   스포일러  이렇게 필립 행세를 하면서 돈을 인출하고 숨어 살던 톰에게 필립을 만나러 필립의 친구인 프레디               빌 키어스 분 가 찾아와 들통나자  프레디도 살해하게 된다  그리고 프레디의 살해범을 필립으로 위장시킨 뒤 재산을 모두 마르쥬에게 주게하는 유언장과 함께 그가 자살한 것처럼 꾸며 경찰을 음험하게 따돌린다  톰은 필립을 잃고 비탄에 빠진 마르쥬에게 접근하여 결국 자기 여자로 만든다  그러나 죄는 숨길 수 없는 법  결과는 엉뚱한 데서 나타난다  미국에서 필립의 아버지가 마르쥬를 만나기 위해 오게 되어 그와 마르쥬는 요트를 팔기 위해 배를 육지로 끌어낸 순간 스큐류에 감긴 와이어에 묶인 시체가 글려 올라온다  경찰은 톰이 있는 해변으로 가서 그를 불러 달라고 한다  전화가 왔다는 소리에 사실을 전혀 모른 채 일광욕을 즐기던 톰은 일어선다  자신이 필립인 양 착각을 하면서 ,drama
5,주먹이 운다,왕년엔 복싱스타  지금은 매맞는 남자  이제 더 이상 물러설 곳이 없다   한때 아시안 게임 은메달리스트로 잘 나가던 태식  현재 그는 길거리 한복판에서 돈을 받고 사람들에게 매맞아 주는 일을 한다  도박으로 진 빚과 공장의 화재로 인해  가진 것을 모두 날린 후  생계를 위해 어쩔 수 없이 거리의 매맞는 복서로 나서게 된 것  그에게 유일하게 남은 것은 아내와 사랑하는 아들뿐  이제  그를 찾는 것은 소문을 듣고 전국 각지에서 몰려든 구경꾼들과 빚쟁이뿐인 처량한 신세다  몸과 마음이 모두 피폐해진 그에게 설상가상으로 아내는 이혼을 요구해 오고  삶의 유일한 희망인 아들  서진 이와 함께 살 수 없게 되자 태식은 깊은 절망감에 빠지게 된다  이제 더 이상 물러 설 곳도  잃을 것도 없는 인생 막장의 늙은 복서 태식은 다시금 희망을 품고 신인왕 전 출전을 결심하게 되는데  아무것도 하고 싶은 것이 없었다   하지만 이제 권투로 세상과 싸울 것이다  패싸움과 삥듣기가 하루 일과인 상환  어느 날 큰 패싸움에 휘말려 합의금이 필요하자 동네 유지의 돈을 노린 강도 사고를 벌이게 되고 이 사건으로 상환은 소년원에 수감된다  수감 첫날부터  권투부 짱  권록 과 한판 싸움을 벌이고 독방에 갇 고 순조롭지 않은 생활이 시작된다  권록과의 싸움을 눈 여겨 본 교도 주임은 상환에게 권투부 가입을 권한다  하고 싶은 것도 되고 싶었던 것도 없던   살의 상환에게 권투는 처음으로 무언가 할 수 있다는 의지와 기쁨을 깨달아 간다  그러던 어느 날  공사장에서 일 하던 아버지가 갑작스런 사고로 돌아가시고 할머니 마저 쓰려졌다는 청천벽력 같은 소식이 전해져 온다  쇼크에 쌓인 상환은 아버지를 잃은 슬픔을 잊고 할머니가 하루빨리 깨어 날수 있도록 신인왕 전에 출전해 결승의 꿈을 이뤄보려는 전의를 불태우는데  신인왕 전 결승  드디어 두 남자의 피할 수 없는 대결이 시작 된다  드디어 신인왕 전 예선이 치러진다  예전의 노련했던 권투 실력을 회복해가며 상대를 이겨나가는  태식 과 매 경기마다   로 승리하며 무섭게 질주하는  상환  두 남자는 각자의 상대들을 모두 굴복시키고 마침내 신인왕 전 결승에서 만나게 된다  독특한 이력  막상막하의 실력과 운명을 가진 두 남자  더 이상 물러 설 곳 없는 인생 막장의   세 거리의 복서  태식 과 태어나서 처음으로 누군가를 위해 싸우는   세 소년원 복서 상환  한치도 물러 설 수 없는 두 남자의 인생을 건 단 한번의 대결이 시작된다 ,drama
6,쿵푸 팬더 2,그토록 원하던 용의 전사가 되어 무적의  인방과 함께 평화의 계곡을 지키게 된 포  진정한 용의 전사로 거듭나기 위해 시푸 사부와 쿵푸 수련에 매진하던 중  셴 선생이 위대한 쿵푸 사부들을 하나 둘 씩 제거하고 있다는 소식을 듣게 된다  여전  바람을 가르는 주먹의 소리보다 배에서울리는 꼬르륵 소리가 더 크고  오랜 숙적인 계단 앞에서는 맥을 못 추는 천방지축 팬더 포  이제 막 정식 수련을 시작하려는 포에게 쿵푸를 지켜야 한다는 막중한 미션이 주어지고  포는 무적의  인방과 함께 길을 떠난다  과연 포는 쿵푸의 대가들도 막지 못한 셴 선생의 비밀병기에 맞서 쿵푸를 지켜낼 수 있을까 ,drama
7,소공녀,하루 한 잔의 위스키와 한 모금의 담배 그리고 사랑하는 남자친구만 있다면 더 바라는 것이 없는  년 차 프로 가사도우미  미소    새해가 되자 집세도 오르고 담배와 위스키 가격마저 올랐지만 일당은 여전  그대로다  좋아하는 것들이 비싸지는 세상에서 포기한 건 단 하나  바로  집    집만 없을 뿐 일도 사랑도 자신만의 방식대로 살아가는 사랑스러운 현대판 소공녀  미소 의 도시 하루살이가 시작된다 ,drama
8,NULL,NULL,drama
9,기도의 힘,소개 정보가 없습니다,drama
10,NULL,NULL,drama
11,나폴레옹,스스로 황제가 된 영웅      년 혁명의 불꽃이 프랑스 전역을 밝 기 시작한다  코르시카 출신의 장교  나폴레옹  호아킨 피닉스 은 혼란스러운 상황 속 국가를 위해 맞서며 영웅으로 떠오른다  한편  사교 파티에서 영웅  나폴레옹 을 만난  조제핀  바네사 커비 은 자신의 운명을 바꾸기 위해  나폴레옹 을 선택하고  나폴레옹 은 마침내 스스로 황제의 자리에 오르게 된다  하지만   조제핀 은 계속해서  나폴레옹 을 흔들고   나폴레옹 의 야망은  조제핀 과 끝없이 충돌하는데  세상을 정복한 영웅 아무것도 갖지 못한 황제   나폴레옹 의 대서사가 펼쳐진다 ,drama
12,리멤버,뇌종양 말기    대 알츠하이머 환자인 한필주  일제강점기 때 친일파들에게 가족을 모두 잃었다  아내가 세상을 떠나자 필주는   여 년을 계획해 온 복수를 감행하려고 한다  그는 알바 중인 패밀리 레스토랑에서 절친이 된   대 알바생 인규에게 일주일만 운전을 도와 달라 부탁한다    원래 이런 사람이었어요  정체가 뭐예요 도대체   같이 접시 닦던 사람 맞아요    이유도 모른 채 필주를 따라나선 인규는 첫 복수 현장의     에 노출되어 유력 용의자로 지목된다  경찰은 수사망을 좁혀오고 사라져가는 기억과 싸우며 필주는 복수를 이어가는데     년의 계획  복수를 위한 위험한 동행이 시작된다 ,drama
13,나 홀로 집에 3,미 국방부는 일급 기밀 컴퓨터 칩을 도난당한다  전문적이고 무자비한 절도 행위를 자행해온 국제 범죄 조직이 블랙 마켓에서 이 컴퓨터 칩을 대가로 수백만 달러를 요구하고 있다  이 무자비한 범죄조직의 악당들은 무선 조정 자동차에 숨겨서 공항을 빠져 나오던 중 가방이 할머니 것과 바뀌는 사건이 발생한다  일당들은 공항에서 할머니의 집까지 태워준 택시 기사를 협박하여 할머니의 집을 알아내지만 막상 할머니 집에 도착에 동네 전체    가구 모두가 운전 기사가 묘사한 집과 똑같았다  이제부터 네명의 능숙한고 고도의 훈련으로 무장한 국제 범죄자들은 컴퓨터 칩을 찾기 위한 계획적이고 치밀한 수색작업에 들어가는데 경찰과 인터폴     도 이들의 작전을 막을 수 없다  알렉스 프루이트       알렉스    린즈 분 는 상상력이 풍부한  살 짜리 꼬마이다  가족 모두는 휴가를 보내러 집을 비우게 되고  수두를 앓느라 집에 혼자 남겨진 알렉스는 무료함을 달래기 위해 동네를 망원경으로 관찰하던 중 수상한 사람들을 발견하고 이들의 음모에 대응하기로 결심하게 된다 ,drama
14,애프터,첫 끌림  첫 사랑  첫 경험  그리고  애프터   대학 입학 후 첫 파티에 초대 받게 된 신입생  테사 는 진실게임을 하던 중 키스 벌칙에 걸리고 만다  상대는 학교에서 유명한 반항아  하딘   키스를 앞둔    초 전  모두가 주목하는 그 순간  테사 는  하딘 의 입술을 거절하고 만다  강렬했던 첫 만남 이후  마치 새로운 세상을 발견한 듯 한번도 경험한 적 없던 감정에 눈을 뜨게 된 두 사람   하딘 은 자신의 비밀 장소로  테사 를 초대하고 이제 두 사람은 서로를 모르기 전으로 절대 되돌아 갈 수 없음을 알게 되는데 ,drama
15,비브르 사 비,레코드샵의 점원으로 일하는  나나  삶의 고단함 속에서도 세상을 놀라게 할 배우가 되겠다는 꿈을 가지고 있지만 생존을 위해  거리의 여자 가 되기로 한다  가혹하기만 한  나나 의 삶에 운명처럼 사랑이 찾아오고 그토록 그녀가 바라던 꿈을 펼칠 수 있는 기회도 갖게 되지만  곧 그 자유마저 빼앗길 위기에 처하고 마는데    나는 자유로워 ,drama
16,NULL,NULL,drama
17,당신이 사랑하는 동안에,기적 같은 타이밍으로 시작된 운명 같은 사랑  그때 내가 그 거리에서 당신을 만나지 않았더라면  하지만 아무 이유 없이  년 전  나를 떠난 그녀  리사   그리고 지금 내 앞에 그녀를 닮은  그녀의 흔적을 지닌 또 다른  리사 가 나타났다  잊으려 할수록 더욱 생생  떠오르는 그녀의 기억  우리의 사랑   사랑이 떠나버린 남자  사랑을 잃어버린 여자  그리고 또 다른 사랑을 꿈꾸는 여자  당신이 사랑하는 동안에  혼자서도 사랑은 계속된다 ,drama
18,노트북,  살 내 전부를 흔들어 버린 그녀    노아는 카니발에서 활달하고 천진난만한 앨리의 웃음을 보고 첫눈에 반한다  두 사람은 빠른 속도로 서로에게 빠져들고 전부를 주어도 아깝지 않은 사랑을 한다  그러나 신분 차이로 인한 집안의 반대로 두 사람은 이별을 하게 되고  갑자기 일어난 전쟁은 더욱 확실하게 두 사람간의 연결고리를 끊어버렸다  그렇게  년이란 시간은 지나간다    살이 되어서도 그녀는 여전  나의 전부였고    우연  신문에서 노아의 소식을 접한 앨리는 그를 찾아 나선다  오랜 시간이 지났어도 잊을 수 없었던 두 사람은 다시 만났지만  서로가 처한 현실에 더 가슴 아프다  앨리에게는 약혼자가 있었고  잊을 수 없는 첫사랑과 현실 앞에서 그녀는 선택의 기로에 서게 된다  나의 마지막 순간까지도 그녀와 함께 하고 싶습니다  시간이 지나고    앨리는 큰 병을 앓으면서 점점 모든 기억을 잃어간다  그녀가 세상의 전부였던 노아는 두 사람의 추억이 담긴 일기장을 남겨둔다  그녀만을 지키겠다는 약속을 위해   ,drama
19,말모이,우리말이 점점 사라져가고 있는     년대 경성  직장에서 해고된 판수는 아들의 학비 때문에 가방을 훔치려다 실패하고 만다  하필이면 새로 면접을 보러 간 조선어학회의 대표가 훔치려던 가방의 주인 정환이다  정환은 전과자에 글도 읽을 줄 모르는 판수를 탐탁지 않아 하지만  판수를 반기는 회원들의 모습에 글을 떼는 조건으로 그를 받아들인다  이렇게 모인 판수와 정환  그리고 조선어학회의 회원들은 바짝 조여오는 일제의 감시를 피해 전국의 말을 모은  말모이 를 만들기 시작하는데   우리말이 금지된 시대  말과 마음이 모여 사전이 되다,drama
20,NULL,NULL,drama
21,용과 주근깨 공주,  는 또 하나의 현실    는 또 한 명의 당신  아름다운 목소리를 지닌  스즈 는 사고로 엄마를 잃은 후 더이상 노래할 수 없게 된다  평범한 나날이 계속되던 중  우연  가상세계  에 접속하게 된  스즈   그는 그곳에서 신비로운 가수  벨 로 다시 태어나 순식간에 세계적인 스타가 된다  그런데  벨 의 대규모 콘서트가 열리는 어느 날   용 이라 불리는 의문의 존재가 나타난다  큰 상처를 안고 있는 듯한  용 에게 마음이 쓰이는  벨   그리고 현실의  스즈   과연  스즈 의 목소리는 그에게까지 닿을 수 있을까  두 세계가 하나로 이어질 때  기적이 일어난다 ,drama
22,NULL,NULL,drama
23,NULL,NULL,drama
24,NULL,NULL,drama
25,NULL,NULL,drama
26,나니아 연대기 - 캐스피언 왕자,나니아에서 현실의 세계로 돌아온 지  년 후  페벤시 남매들은 마법의  에 의해 다시 나니아의 세계로 들어간다  그러나 그곳은 이미 폐허로 변해 있었다  나니아 시간으로 벌써      년이란 세월이 흘렀던 것  그들이 없는 동안 나니아는 황금기의 종말을 고하고  인간인 텔마린 족에게 점령되어 무자비한 미라즈 왕의 통치를 받고 있었다  페벤시 남매들을 나니아로 불러낸 건 바로 텔마린족의 진정한 왕위 계승자인 캐스피언 왕자였다  삼촌 미라즈에게 왕위를 뺏기고 목숨의 위협을 느낀 그는 나니아인들이 숨어 사는 숲 속으로 피신  그곳에서 페벤시 남매와 만난다  부왕을 죽인 삼촌을 물리치고 자신의 왕위를 찾게 도와주면 나니아인들의 터전을 돌려 주겠다는 약속을 하는 캐스피언 왕자  이에 네 남매와 나니아인들은 그를 도와 미라즈의 군대와 전쟁을 벌이게 되는데 ,drama
27,선생님!... 좋아해도 될까요?,고등학교  학년인  비키는 아직 사랑을 모르는 내성적인 소녀  사랑 이야기를 늘어놓는 친구들이 신기하기만 하다  그런  비키가 처음으로 좋아하게 된 사람은 세계사 선생님 이토  학생들에게 엄격하고 무뚝뚝해 보이지만 방과 후 혼자 남은  비키의 과제를 도와주는 다정한 면도 있다  이토 선생님의 미소와 따뜻한 모습에 첫사랑의 감정을 느끼게 된  비키  마침내 이토 선생님에게 자신의 감정을 고백하는데    선생님     좋아해도 될까요  ,drama
28,NULL,NULL,drama
29,2001 스페이스 오디세이,인류에게 문명의 지혜를 가르쳐 준 검은 돌기둥의 정체를 밝 기 위해서 디스커버리호는 목성을 향해서 날아간다  초현대적인 디자인의 실내 장치와 구조물들  선장 보우만               케어 둘리아 분 과 승무원 풀              게리 룩우드 분 이 요한 스트라우스의  푸른 다뉴브 가 흐르는 가운데 편안한 비행을 계속하고 있다  평온하던 디스커버리호에 갑자기 재난이 찾아온다  우주선 내부에서 일어난 재난은 컴퓨터 할           더글러스 레인 목소리 분 이 반란을 일으킨 것이다  할은 풀을 우주선 밖으로 던져버리고  보우만까지도 모선 밖으로 끌어내지만 그는 필사의 노력으로 할을 제압한다  보우만은 마침내 목성 궤도에서 문제의 검은 돌기둥을 발견한다  그렇지만 그 순간 우주의 급류에 휘말리게 된다  이때부터 보우만이 지구로의 귀환을 노력하고  신비한 시간의 흐름을 경험하다  지구에 돌아온 보우만은 임종을 맞고 있는 자신의 모습을 보게 된다  숨을 거두는 보우만이 마지막으로 가리키는 곳에 검은 돌기둥이 보이고 이제 막 태어나기를 기다리는 태아의 모습이 보인다  그 태아는 새로 태어나는 보우만 자기 자신이다 ,drama
