,title,synopsis,category
0,해피 피트,가슴으로 부르는 노래  하트송 으로 구애하는 펭귄왕국  춤에는 특별한 재능을 가졌지만 노래만은 세계 최악인 음치펭귄 멈블 엘리야 우드 이 살고 있다  멈블의 엄마 노마 진 니콜 키드먼 은 아들의 탭 댄스가 귀엽다고 생각하지만 아빠 멤피스 휴 잭맨 는 멈블이 펭귄답지 못하다고 여긴다  멈블 역시 무리 중에서 노래를 가장 잘하는 여자친구 글로리아 브리트니 머피 에게 구애할 수 없는 자신이 서글프다  어느 날 멈블은 너무나 튀는 탭댄스 실력이 펭귄왕국의 질서를 어지럽 다는 이유로 추방당하고  우연  또 다른 펭귄 종족인 라몬 로빈 윌리암스 과 그의 일당을 만난다  이제 멈블은 자신의 현란한 발 동작에 매료된 라몬 일당과 함께 광활한 얼음대륙을 넘어 세상을 행복하게 만들 특별한 여행을 시작한다 ,animation
1,볼트(패키지: 자막판+더빙판),슈퍼독  볼트 는 온갖 모험과 위험으로 가득 찬 흥미 진진한 하루 하루를 보낸다  단  그가 카메라 앞에 있는 순간까지만  최고의   스타 볼트가 어느 날 우연  헐리우드 촬영장을 떠나 머나먼 뉴욕까지 오게 되면서 견생     최대의 도전이 시작된다  그의 주인이자 연기 파트너인  페니 에게 돌아가려면  미국 대륙을 가로질러야만 하니까  믿을 거라곤    속 멋진 전투 기술과 초능력밖에 없는데 그마저도 볼트의 착각일 뿐  그가 뛰어든 현실 세상에선 무용지물이다  그래도 다행인지 불행인지  볼트는 심상치 않은 동지들을 만나게 된다  왕년에 사랑 받던 고양이였지만 지금은 버림받고 좀 까칠해진  미튼스   엄청난    매니아이자 볼트의 열혈 팬인 햄스터  라이노  가 바로 그들  그리고 이 어설픈 두 친구와 함께하는 우리의 액션 영웅 볼트의 완전  리얼 액션 어드벤처 가 시작된다 ,animation
2,트롤: 밴드 투게더,최애 아이돌 그룹 재결합 초읽기  우리 함께하면 더 좋잖아  전 세계 모든 트롤을 열광케 했던 최고의 아이돌 그룹  브로존   역대급 무대 실수와 형제 간의 불화로 결국 해체한 뒤  모두에게 잊혀 간다  그러던 어느 날   브로존 의 황금막내  브랜치 는 메인보컬  플로이드 가 슈퍼스타  벨벳 과  비니어 에게 잡혀 재능을 빼앗기고 있다는 소식을 듣는다  그를 구하기 위해서는 흩어져 있는  브로존 을 재결합하고 완벽한 화음을 되찾아야 하는데 ,animation
3,몬스터 패밀리 2,몬스터에서 인간으로 겨우 돌아온  위시본  패밀리  새 가족이 된 전설 속 몬스터  바바 야가 와  렌필드 의 결혼식 날  그들은 슈퍼 소녀  밀라 에게 납치당한다  이들뿐 아니라 드라큘라  예티  네시  그리고 킹 콩가까지    위시본  패밀리는  밀라 에 의해 전 세계 몬스터들이 납치된 것을 알게 되는데  몬스터들을 구하기 위해 다시 몬스터로 변한  위시본  패밀리  과연  위시본  가족은 몬스터들을 구하고 다시 인간으로 돌아갈 수 있을까 ,animation
4,극장판 헬로카봇 : 달나라를 구해줘!,평화로웠던 지구에는 타워크레인  우주정거장이 사라지고  달의 뒷면에서 살던 토끼족 마을은 외계 로봇의 공격으로 위기에 처하게 된다  이 모든 것은 바로 지구를 정복하려는 치올라 외계인들의 공격이었던 것   평화를 수호하는 차탄과 카봇들은 달을 넘어 지구까지 혼란에 빠뜨린 치올라 외계 군단에 맞서기 위해 달나라로 떠나게 되는데    지구와 달을 구하기 위한 카봇과 토끼족들의 지상최대 연합작전이 시작된다 ,animation
5,천년여우, 도쿄의 마돈나 라 불리던 전성기를 뒤로 하고 은막 뒤로 사라진 전설적인 여배우  후지와라 치요코   그 발자취를 좇는 다큐멘터리를 제작하려는  타치바나 겐야 는 그녀의 작품을 수십 번도 더 본 열혈 팬이다  가장 소중한 것을 열 수 있다는 열쇠를 앞에 두고  평생에 걸쳐 소중  품어온  치요코 만의 이야기가 시작된다      년 관동대지진과 함께 태어난 그녀의 인생에는 영화가 있고  한 남자가 있고  천 년이 지나도 빛 바래지 않을 깊은 사랑이 있다 ,animation
6,갓파 쿠와 여름방학을,여름방학을 앞둔 어느 날  초등학생  코이치 는 강가에서 신기한 모양의 돌을 발견한다  그런데 이 돌에서 환상의 동물 갓파가 깨어나고   코이치  가족들은 그에게  쿠 라는 새로운 이름을 붙여준다  이렇게 한 식구가 된 그들은 즐겁고 신나는 여름날을 보낸다  하지만 도시 사람들의 눈을 피해 숨어 다녀야 하는  쿠 는 갓파 친구들과 함께했던 자연에서의 삶을 그리워한다  엄마를 겨우 설득한  코이치 는  쿠 와 함께 대자연으로 여행을 떠나지만  갓파 친구를 만나지 못한 채 집으로 되돌아온다   그런데 이때  오키나와에서 온 수상한 편지가 집으로 도착하는데   과연  쿠 는 갓파 친구를 찾을 수 있을까 ,animation
7,극장판 짱구는 못말려 : 습격!! 외계인 덩덩이,짱구의 엉덩이에 지구의 운명이 걸렸다   짱구의 집에 불시착한    의 주인 외계인  덩덩이    나스파디  별에서 온  덩덩이 는 무시무시한  꼬마꼬마 파워 로 짱구의 엄빠를 어린이로 만들어버린다  엄빠를 다시 어른으로 되돌리기 위해  덩덩이 의 아빠를 만나러 떠나지만 연락이 닿지 않고  심지어 지구를 위협하는 외계인의 음모까지 드러나기 시작하는데      짱구의 엉덩이에 숨은 외계인  덩덩이 와 가족들의 스펙터클한 대모험이 펼쳐진다 ,animation
8,하늘에서 음식이 내린다면,먹을 거라고는 정어리 밖에 없는 작은 도시  꿀꺽퐁당  섬을 위해 허당 과학자  플린트 는 물을 음식으로 바꾸는  슈퍼음식복제기 를 발명한다  하지만 실험도중 기계는 하늘로 날아가고  모든 것이 실패로 돌아갔다고 생각한 순간 마을에는 맛있는  햄버거 비 가 내리기 시작한다  하늘로 올라간  슈퍼음식복제기 가 작동을 시작한 것  그 때부터 섬에는 핫도그  와플  치킨  아이스크림 등 맛있는 음식들이 매일매일 내리고 사람들은 달콤한 행복에 빠진다  하지만 점점 많은 음식들을 요구하는 사람들과 섬을 관광지로 개발하려는 탐욕스러운  시장 의 욕심으로 인해 기계는 점차 멋대로 작동하기 시작한다  그 결과 집채만한 팬케이크와 사람만한 핫도그 비가 내리는 등 점점 거대해지는 음식들로 인해 도시는 초유의 재난 상황을 맞게 된다   플린트 는 이 사태를 해결하기 위해 음식 기상캐스터  샘   옛날엔 얼짱 모델  베이비 브렌트   베프 원숭이  스티브  와 함께 기계를 파괴하기 위해 하늘로 향하는데 ,animation
9,해수의 아이,기다리던 방학 첫날부터 친구와 다퉈 핸드볼팀에서 제외된  루카   속상한 마음을 달래려 어린 시절 추억이 깃든 수족관으로 향한 루카는 그곳에서 신비한 바다소년  우미 와  소라 를 만난다    소중한 약속은 말로 할 수 없어  루카는 바다 속 듀공 무리에서 자란 두 소년과 누구도 본 적 없는 바다의 축제를 찾아 나서고  빛나는 바다생물들이 함께한 그 길에서 소년  소녀만의 비밀이 생기는데  그렇게 영원  잊을 수 없는 길고 긴 여름이 시작되었다 ,animation
10,슈렉 2, 옛날 옛날   겁나먼 왕국 의 왕과 왕비에게 어여쁜 딸이 태어났습니다  온나라 백성들이 모두 기뻐했습니다  그러나 해가 지자마자  공주는 무시무시한 마법에 걸리게 되었고  그런 일이 매일 밤마다 계속되었습니다  그들은 요정 대모에게 간절  도움을 요청했고  요정은 그들로 하여금 공주를 높은 탑에 가두도록 하였습니다  꽃미남 챠밍 왕자의 키스를 기다리면서 말입니다  바로 그가 목숨을 걸고 며칠 밤낮을 걸쳐  혹한과 뜨거운 사막을 헤치고 용이 지키고 있는 성으로 향하는 위험한 여행을 기꺼이 떠난 인물인 것입니다  왜냐하면 그는 이 나라에서 최고로 용맹할 뿐더러  얼굴까지 잘 생겼으니까  그의 키스로 무서운 저주를 푸는 것은 바로 그의 숙명인 것입니다  홀로 가장 높은 탑의 가장 높은 방으로 올라가 방으로 들어가서 잠자고 있는 공주의 모습이 비치고 있는 비단 커튼을 젖 면 바로 그녀가      피오나 공주는 어딨소  신혼여행 중이야  신혼여행  누구랑   꿈결 같은 허니문에서 돌아온 슈렉과 피오나  이 행복한 녹색 커플은  겁나먼  왕국의 왕과 왕비인 피오나의 부모님으로부터 초청장을 받는다  드디어 도착한 왕국에는 모든 시민들이 기대에 부풀어 그들을 기다리고 있는데   떨리는 맘으로 슈렉이 모습을 드러내는 순간  멋진 왕자를 기대했던 모든 이들은 기절초풍  초록색이 되어버린 공주는 말할 것도 없이 말이다  발칵 뒤집   겁나먼  왕국  이제 이 충격적인 사건을 해결하기 위해 만만치 않은 강적들이 속속 등장한다  업계  위의 괴물 전문 킬러  장화 신은 고양이   퍼펙트   한 외모의 왕자  프린스 챠밍   신비한  을 가진 요정 대모까지  성가신 건 질색인 슈렉에게 터져버린 대형 사고  또 다시 의도하지 않은 사건에 휘말린 슈렉 패밀리 앞에 상상할 수 없는 예측불허의 모험들이 펼쳐지는데  ,animation
11,랭고,당신들이 아무렇게나 생각하는 그런 영웅이 아냐   예측을 불허하는 대단한 놈이 왔다  광대한 모하비 사막에 툭 떨어진 정체 모를 카멜레온 랭고  적응하려면 수백만 년이 걸린다는 모하비 사막에서 살아남기 위해 고군분투하던 랭고는 아주 우연한 계기로 사막의 무법자 매를 죽이게 된다  얼떨결에 마을의 영웅이 되어버린 랭고는 황무지 빌리지의 보안관을 맡게 되는데    위험이 도사리는 거대한 사막  쫓고 쫓기는 추격  예측 불허한 사건들 속에서 랭고의 운명은 과연 어떻게 펼쳐질까 ,animation
12,극장판 짱구는 못말려 4기 - 핸더랜드의 대모험,우주를 돌아다니며 나쁜 짓을 하는 악당들이 드디어 지구까지 손에 넣으려고 한다  그들은 핸더랜드라는 놀이공원을 본거지로 삼아  본격적으로 지구 공략에 나선다  우연  핸더랜드에 놀러간 짱구는 토페마에게 악당들의 음모를 듣게 된다  토페마는 짱구에게  을 합쳐 악당들을 물리치자고 하지만  짱구는 겁을 먹고 주저한다  하지만 악당들은 이미 짱구가  굉장해 엄청나 트럼프 를 가지고 있다는 사실을 알고 짱구를 찾아온다  엄마  아빠까지 휘말리면서 짱구는 어쩔 수 없이 악의 무리에 대항해서 싸우게 되는데   ,animation
13,NULL,NULL,animation
14,틴에이지 크라켄 루비,평범함 뒤에 숨겨진 능력을 가진 반전캐 크라켄  루비 와 검은 속마음을 숨긴 사기캐 빌런 인어  첼시 의 대결을 그린 드림웍스 제작진의 썸머 오션 어드벤처 ,animation
15,소중한 날의 꿈,달리기에서만은 한 번도 져 본적 없던 이랑은 계주에서 처음으로 상대에게 추월당하자 지지 않기 위해 일부러 넘어진다  그 후  이랑은 육상부 선생님의 끈질긴 설득에도 불구하고 지는 것이 두려워 달리기를 하지 않게 된다  어느 날 이랑은 레코드 가게에서 서울에서 온 전학생 수민을 만나 친구가 된다  수민은 얼굴도 예쁘고 어른스러워서 남학생들에게 인기가 많다  이랑은 항상 자신감 넘치는 수민을 보며 잘하는 것 하나 없는 스스로에 대해 고민하기 시작한다  어느 날 학교에서 철수라는 남학생이 비행실험을 하다 추락해 다치는 소동이 일어나고 이랑은 철수에게 호기심을 갖게 된다  그러던 중 읍내에 고장 난 라디오 수리를 맡기러 간 이랑은 그 전파사에서 삼촌 대신 수리를 하고 있는 철수를 만난다  두 사람은 비행실험에 대해 이야기를 나누며 가까워진다  철수는 비행과 우주탐사에 대한 꿈을 이야기하고 이랑은 열정적으로 노력하는 철수를 보며 설렌다  한편  꿈과 재능이 넘치는 수민과 철수를 만나며 이랑은 자신의 미래에 대해 더욱 고민하게 되는데   ,animation
16,고양이의 보은,  살 평범한 여고생  하루   매일 매일이 따분하기만 하고 즐거운 일이 하나도 없다  그날은 늦잠 자서 학교도 지각하고  친구들 앞에서 창피까지 당하고 정말 우울한 날이었다  그런데 집에 가는 길에 우연  트럭에 치일 뻔한 고양이를 구해주었는데 그 고양이가 몸을 툴툴 털고 일어나 고맙다고 인사를 하는게 아닌가  그 순간부터 그녀의 일상은 이상한 일로 변화가 생겼다   하루 가 구해준 고양이가 고양이 왕국의  룬  왕자라는 것이다  그 날밤  하루 의 집에 찾아온 고양이 떼는 자신들의 왕자를 구해준 보답으로  하루 를  룬 왕자와 결혼해달라는 요청과 함께 앞으로는 행복한 일들만 일어날 것이라는 이상한 말을 남긴 채 사라졌다  다음 날부터  하루 는 고양이들이 적극적인 감사인사에 휩싸여 정신없이 보내게 된다  그러던 중 이상한 목소리에 이끌려 고양이 왕국으로 초대되었다  늘 깜짝 놀랄 만한 일을 기대해왔던  하루 에게 진짜 신기한 일이 생긴 것이다  고양이 떼에 끌려 들어간 고양이 왕국은 고민도 없고 바쁜 일도 없고 즐거운 일만 가득한 천국 같은 곳이었다  맛있는 것 실컷 먹고 매일 열리는 파티에 싫은 것은 모두 잊어버릴 수 있는 새로운 세계에서  하루 는 갑자기 고양이가 되어도 좋겠다는 생각에 빠진다  고양이 왕국의 남작  바룬 처럼 멋진 신사의 호의도 받고 뚱땡이  무타 의 재롱도 볼 수 있어 좋았다  그런데 고양이 왕국의 대왕이  하루 를 며느리 감으로 생각하고  룬  왕자와 결혼시키겠다고 하자 고민에 빠진다  고양이 세계에서 대한 호기심도 잠시  평생 고양이로 사는 것은 끔찍한 일이 아닌가  과연  하루 는 인간의 세계로 다시 돌아갈 수 있을까 ,animation
17,슈렉 2, 옛날 옛날   겁나먼 왕국 의 왕과 왕비에게 어여쁜 딸이 태어났습니다  온나라 백성들이 모두 기뻐했습니다  그러나 해가 지자마자  공주는 무시무시한 마법에 걸리게 되었고  그런 일이 매일 밤마다 계속되었습니다  그들은 요정 대모에게 간절  도움을 요청했고  요정은 그들로 하여금 공주를 높은 탑에 가두도록 하였습니다  꽃미남 챠밍 왕자의 키스를 기다리면서 말입니다  바로 그가 목숨을 걸고 며칠 밤낮을 걸쳐  혹한과 뜨거운 사막을 헤치고 용이 지키고 있는 성으로 향하는 위험한 여행을 기꺼이 떠난 인물인 것입니다  왜냐하면 그는 이 나라에서 최고로 용맹할 뿐더러  얼굴까지 잘 생겼으니까  그의 키스로 무서운 저주를 푸는 것은 바로 그의 숙명인 것입니다  홀로 가장 높은 탑의 가장 높은 방으로 올라가 방으로 들어가서 잠자고 있는 공주의 모습이 비치고 있는 비단 커튼을 젖 면 바로 그녀가      피오나 공주는 어딨소  신혼여행 중이야  신혼여행  누구랑   꿈결 같은 허니문에서 돌아온 슈렉과 피오나  이 행복한 녹색 커플은  겁나먼  왕국의 왕과 왕비인 피오나의 부모님으로부터 초청장을 받는다  드디어 도착한 왕국에는 모든 시민들이 기대에 부풀어 그들을 기다리고 있는데   떨리는 맘으로 슈렉이 모습을 드러내는 순간  멋진 왕자를 기대했던 모든 이들은 기절초풍  초록색이 되어버린 공주는 말할 것도 없이 말이다  발칵 뒤집   겁나먼  왕국  이제 이 충격적인 사건을 해결하기 위해 만만치 않은 강적들이 속속 등장한다  업계  위의 괴물 전문 킬러  장화 신은 고양이   퍼펙트   한 외모의 왕자  프린스 챠밍   신비한  을 가진 요정 대모까지  성가신 건 질색인 슈렉에게 터져버린 대형 사고  또 다시 의도하지 않은 사건에 휘말린 슈렉 패밀리 앞에 상상할 수 없는 예측불허의 모험들이 펼쳐지는데  ,animation
18,바다 탐험대 옥토넛 시즌4 : 더 파이널,    독화살개구리                     아마존 강으로 조수해일이 밀려가자 바나클과 대원들은 위험에 빠진 동물들을 구조하기 위해 아마존으로 향한다  주위를 살피던 일행은 독화살 개구리 로버트 로버트를 만나게 되고 물고기들이 나무 위로 올라갔음을 알게 되는데       하마              야행성 동물 관찰을 위해 아프리카 강으로 떠난 셸링턴  하지만 갑자기 울린 경보에 바나클  콰지  페이소는 급  셸링턴을 구조하기 위해 떠나지만 강에서 만난 하마들 때문에 곤혹을 치르는데       코코넛 도둑                      코코넛 크랩 섬으로 휴가를 떠난 콰지는 코코넛이 계속 사라지자 도둑을 잡기 위해 동분서주하고  도둑이 던진 코코넛에 맞아 콰지가 쓰러지자 클라렌스는 비상 버튼을 눌러 옥토경보를 울리는데       뱀상어                   샌디의 등에 샌디 캠을 달아준 트윅은 카메라를 통해 샌디가 뱀상어의 공격을 받는다는 걸 알게 되자 급  탐험선을 타고 바다로 나간다  샌디와 트윅을 구하기 위해 뒤따라간 바나클과 대원들은 어린 뱀상어 톰이 너무 이것저것을 먹어 치워 탈이 난 걸 알게 되는데        아기 바다거북                    해변에 카메라를 설치하고 아기 거북들의 부화를 지켜보던 옥토넛은 거대한 파도가 해변을 덮치려 하자 급  알들을 꺼내 다른 해변으로 옮긴다  그러자 이번엔 갓 부화한 아기 거북들을 노리고 갈매기 떼가 날아드는데 ,animation
19,베오울프,신과 인간  괴물과 영웅이 공존하는 암흑의 시대  호르트가르 성 사람들은 밤마다 용사들을 잔인하게 살인하고  납치해가는 정체불명의 괴물로 인해 고통 받고 있다  이때 젊은 용사 하나가 바다를 건너 그들을 구하기 위해 도착한다  그는 인간들을 구원할 영웅의 운명을 타고난 전사 베오울프  그가 맞서야 하는 괴물은 인간 세계를 장악하려는 마녀와 온 세상을 지배하기 위해 절대악과 손잡은 왕 사이에서 태어난 괴물 그렌델이었다  이제 인간을 위해 그들에 맞서 전설의 황금보검을 손에 쥔 태초의 영웅 베오울프  그에게는 인류의 운명이 걸려 있고 그가 가는 길 앞에는 거대한 시련이 예정되어 있는데 ,animation
20,닌자터틀: 뮤턴트 대소동,뉴욕의 하수구로 스며든 미스터리한 녹색 액체   우즈 로 인해 아기 거북이 네 마리와 청년 쥐 스플린터는 사람과 비슷한 모습의 돌연변이가 된다    년 후    대 청소년이 된 레오나르도  미켈란젤로  라파엘  도나텔로는 하수구에 숨어 사는 생활에서 벗어나 인간 세상에서 평범한 삶을 살고 싶어하고 우연  만난 학생 기자 에이프릴과 함께 도시를 위협하는  슈퍼플라이 와 그 일당을 물리치면 뉴욕의  어로가 되어 당당  세상에 나갈 수 있을 거라는 꿈을 꾸는데  인간들을 모두 돌연변이로 만들겠다는  슈퍼플라이 의 음모로 위험에 빠진 뉴욕  틴에이저  어로로 다시 태어난  닌자터틀  형제들의 스트릿 액션 어드벤처가 펼쳐진다 ,animation
21,레고 무비2,시스타 행성의 지멋대로 여왕의 지시로 듀플로 외계인들이 레고 마을을 침공한다  어마무시 장군이 친구들을 납치하자 에밋은 우주로의 여행을 떠나는데  에밋과 친구들의 대모험  이번엔 우주다  준비됐나요 ,animation
22,닌자터틀: 뮤턴트 대소동,뉴욕의 하수구로 스며든 미스터리한 녹색 액체   우즈 로 인해 아기 거북이 네 마리와 청년 쥐 스플린터는 사람과 비슷한 모습의 돌연변이가 된다    년 후    대 청소년이 된 레오나르도  미켈란젤로  라파엘  도나텔로는 하수구에 숨어 사는 생활에서 벗어나 인간 세상에서 평범한 삶을 살고 싶어하고 우연  만난 학생 기자 에이프릴과 함께 도시를 위협하는  슈퍼플라이 와 그 일당을 물리치면 뉴욕의  어로가 되어 당당  세상에 나갈 수 있을 거라는 꿈을 꾸는데  인간들을 모두 돌연변이로 만들겠다는  슈퍼플라이 의 음모로 위험에 빠진 뉴욕  틴에이저  어로로 다시 태어난  닌자터틀  형제들의 스트릿 액션 어드벤처가 펼쳐진다 ,animation
23,핑크퐁 시네마 콘서트 2: 원더스타 콘서트 대작전,핑크퐁과 호기  원더스타 친구들이  을 합쳐 특별한 콘서트를 준비했어요  별빛봉 들고  원더스타를 함께 응원해볼까요   핑크퐁의 크리스마스 댄     파티로 초대합니다 ,animation
24,세계 제일의 첫사랑 - 프러포즈 편,마루카와 서점의 제작부 사원과 영업부 사원의 결혼식에 초대받은 에메랄드 편집부 직원들은 신부의 부탁을 받고 뒤풀이에 참석한다  손님으로 참석한 자리지만 하객의 대부분이 업계 관계자들이다 보니 편집부원들은 그들을 챙기느라 피곤함을 느낀다  뒤풀이 장소에서 타카노 마사무네가 손가락을 베인 걸 보고 걱정이 된 오노데라 리츠는 늘 갖고 다니던 반창고를 붙여 준다  그러자 마사무네는 리츠의 약지에도 반창고를 감으며 의미심장한 말을 던지는데   ,animation
25,몬스터 호텔 2,몬스터 호텔 주인  드락 의 딸     살 열혈맘  마비스 와 철부지 아빠  조니  사이에서 사랑스런 손자  데니스 가 태어나고  마침내 몬스터와 인간 세상에도 평화가 찾아온다  그런데 혼혈 뱀파이어 데니스에게서 카리스마는 커녕 몬스터와 닮은 구석이라고는 하나도 찾아볼 수가 없다     마음이 조급해진 드락은 데니스를 인간이 아닌 뱀파이어로 키우기 위해  프랭크    머레이    웨인    그리핀    블라비 까지 절친 몬스터들을 불러모아  특급 몬스터 트레이닝 을 시작하게 되는데   몬스터와 인간 사이  데니스의 정체를 둘러싼 특급 어드벤처가 시작된다 ,animation
26,다이노 타임,말썽꾸러기 삼총사 어니  맥스  줄리아는맥스 아버지의 비밀 작업실에서 알 모양의 타임캡슐을 건드려  억년 전 공룡세계에 도착하게 된다  하필 그들이 도착한 곳은 무시무시한 티라노사우루스  타이라 의 둥지 속   타이라 는 말썽꾸러기 삼총사를 아기 공룡으로 착각하고  타이라 의 알을 노리는 알 도둑 공룡들은 타임캡슐을 훔치려 하는데     다이노 패밀리와 함께 짜릿한 공룡시대로의 환상적인 모험이 시작된다 ,animation
27,유령 신부,지루한 일상에 비해 활기가 넘치는 지하세계  인간들에 비해 더욱 생동감 넘치는 유령들의 축제 등 감독 특유의 기이하고 몽환적인 상상의 세계가 놀랄 만큼 흥미롭게 펼쳐진다  여기에 팀 버튼의 영원한 단짝 조니 뎁을 비롯해 헬레나 본햄 카터  에밀리 왓슨  알버트 피니  크리스토퍼 리 등 연기파 배우들의 목소리 출연이 작품에 생기를 불어 넣는다  특   배우들과 꼭 닮은 모습의 캐릭터들은  유령신부 가 즐거운 또 하나의 이유이다  결혼이 두려운 소심한 신랑 빅터 조니 뎁 가 겪는 환상적인 이야기  결혼식을 하루 앞둔 빅터는 예행연습에서 계속 실수를 하자 밖으로 뛰쳐나간다  숲 속에서 홀로 연습하던 도중  땅 위로 튀어나온 손가락 뼈에 반지를 끼웠다가 유령신부 헬레나 본햄 카터 의 오해로 지하세계에 끌려가게 되는 색다른 경험을 하게 되는 것이다 ,animation
