,title,synopsis,category
20,무서운 영화 4,패러디의 끝은 어디인가  박스오피스를 화려하게 장식했던 작품 중에서도 명장면 명대사만 골라 기발한 아이디어를 첨가해 탄생한 무서운 영화가 벌써  회를 맞았다  이번에는  소우    그루지    브로크백 마운틴    우주전쟁    빌리지 등을 패러디해 유쾌 상쾌 통쾌한 해학을 선사한다  전편의 가슴 아픈 과거를 간직한 채  가정에서 환자를 돌보는 간병인이 된  신디 캠벨 은 크레인 운전기사로 일하는  톰 라이언 에게 첫눈에 반한다  급작스런 외계군단의 침공으로 도시가 아수라장이 된 가운데  억울하게 죽어 지구를 떠돈다는 한 꼬마 아이의 영혼으로부터 침공을 막을 수 있는 방법을 알게 된 신디는 우연  만난 옛친구  브렌다와 함께 외딴 마을에 숨어든다  트라이포드가 지구인의 목을 조여오면서  미국 대통령은 비밀병기를 소개하며 반격을 약속하지만    을  언 으로 읽으며 무식함을 만천하에 공개하는 실수를 저지르고 만다  신디는 베일에 싸인 마을에서 꼬마의 영혼을 달래고 외계인의 침공을 중단시킬 실마리를 찾게 되는데   ,comedy
21,NULL,NULL,comedy
22,박물관이 살아있다 2,깜짝 놀랄 밤의 세계를 경험한 야간 경비원 래리  전시물은 물론 아크멘라의 석판마저 워싱턴의 스미소니언으로 옮겨졌다는 소식을 듣고 서둘러 워싱턴으로 향한다  역시나 어둠이 내린 박물관에는 이미 모든 것들이 살아 움직이며 요란하고 시끌벅적한 세계를 만들어 놓는다  현란한 랩퍼로 변신한 큐피드  몸매 자랑에 여념 없는 로뎅의 조각상  그리고  열쇠만 보면 달려들던 원숭이 덱스터에게 최초의 우주 비행 원숭이 에이블이  환장 의 짝꿍으로 가세하면서 래리는 박물관의 거대한 위용과 각양각색의 깨어난 전시물들로 혼란스럽다  여기에 석판을 노리는 수상쩍은 이집트 파라오 카문라는 알카포네  나폴레옹  폭군 이반까지 끌어들여 음모를 꾸미는데   ,comedy
23,몬스터 호텔,몬스터들의 유일한 천국  인간출입금지 몬스터 호텔  딸바보 드라큐라는 딸 마비스의    번째 생일을 맞아 프랑켄슈타인  늑대인간  미이라  투명인간 등 몬스터 친구들을 모두 초대한다  그 런 데  초대받지 않은 인간소년 조니가 나타나고  몬스터들은 멘붕 상태에 빠진다  과연  몬스터들은 신나는 파티를 즐길 수 있을까 ,comedy
24,강철중: 공공의 적 1-1,강동서 강력반 꼴통 형사 강철중 설경구    년이 지난 지금도 여전  사건 현장을 누비고 다니지만   년 차 형사생활에 남은 거라곤 달랑 전세 집 한 칸  형사라는 직업 때문에 은행에서 전세금 대출받는 것도 여의치 않다  잘해야 본전 잘 못하면 사망 혹은 병신이 될 수도 있는 빡센 형사생활에 넌더리가 난 그는 급기야 사표를 제출한다  하지만 그때 한 고등학교에서 터진 살인사건 때문에 그의 사표 수리는 미뤄지고 이번 사건만 해결하면 퇴직금을 주겠다는 반장의 회유에 말려들어 귀찮은 사건 현장으로 돌아간다  도무지 해결의 기미가 보이지 않던 살인사건은 죽은 학생의 지문이 얼마 전 강동서 관할에서 일어난 도축장 살인사건 현장에서 발견된 칼에 남겨진 지문과 같다는 사실이 밝혀지면서 새로운 국면을 맡는다  강철중은 죽은 피해 학생과 어울려 다녔다는 친구  명을 만나 단서를 찾기 시작한다  아이들이 얼마 전  거성 이란 회사에 취업했다는 사실을 알아낸 강철중은 이 사건이  거성 그룹 과 관계 있다는 것을 감지하고  거성 그룹 의 회장인  이원술  정재영 의 뒤를 쫓기 시작한다  한편  자신의 사업체마다 나타가서 훼방을 놓는 강철중 때문에 심기가 불편해진 이원술 역시 조용  반격을 준비 하는 데 ,comedy
25,익스트림 페스티벌,개최 일주일 전 갑자기 정종 문화제에서 연산군 문화제로 바뀐 망진의 지역 축제  스타트업 대표  혜수 는 축제를 무사  진행시키기 위해 고군분투한다  그런데  무늬만 이사  상민 은 퇴사한 직원  래오 를 알바로 데려오고  축제 당일 현지에서 뽑은 인턴  은채 는 과하게 열정적이다  설상가상   축제의 막이 오르기 직전 객석은 텅 비고  초대가수는 펑크 나고  지역 극단은 보이콧을 선언하는데  맘대로 되는 게 하나도 없는 이 죽일 놈의 축제 그래도 축제는 계속돼야 한다  반드시 ,comedy
26,롱 샷,전직 기자 지금은 백수인  프레드 플라스키  세스 로건 는   년 만에 첫사랑 베이비시터  샬롯 필드  샤를리즈 테론 와 재회한다   그런데 그녀가   미 최연소 국무 장관이자 세계에서 가장 영향력 있는 여성 중 한 명인  샬롯 이 바로 베이비시터 그녀라는 것은 믿기지 않지만 실화이다   인생에 공통점이라고는  도 없는 두 사람  대선 후보로 출마를 준비 중인  샬롯 은 모두의 예상을 깨고 자신의 선거 캠페인 연설문 작가로  프레드 를 고용한다  어디로 튈지 모르는  프레드  때문에 선거 캠페인은 연일 비상인 가운데  뜻밖에 그의 스파크는  샬롯 과의 로맨스로 튀어 버리는데     사고 치는데 천부적인 재능이 있는 남자  머리부터 발끝까지 완벽한 여자  이 조합 실화 ,comedy
27,NULL,NULL,comedy
28,롤러코스터,안전한 운행  친절한 서비스  환영합니다  바비 항공입니다  영화  육두문자맨 으로 일약 한류스타가 된 마준규 정경호   비행공포증  편집증  결벽증까지 갖출 건 다 갖춘 마준규는 일본 활동 중 터진 여자 아이돌과의 스캔들로 급하게 한국행 비행기에 오른다   이 비행기 어딘가 수상하다  어딘가 오버스러워 보이는 승무원들과 파파라치보다 무서운 사상 초유의 탑승객들  이륙하는 순간부터 언빌리버블한 상황들의 연속 속 기상 악화로 비행기는 두 번이나 착륙에 실패하고  설상가상으로 연료가 다 떨어져 가는 와중에 일생일대의 위기를 맞게 되는데    그는 과연 살아서 활주로에 무사 안착 할 수 있을 것인가 ,comedy
29,피치 퍼펙트,인형 같은 외모와 환상적인 하모니   얼핏 보기엔 모든 것을 다 갖춘 듯 하지만 식상한 레파토리 구성으로 매번 탈락의  쓴맛을 봐야 했던 여성 아카펠라 그룹 벨라스    새로운 캠퍼스 생활이 시작되고  이번 만은 절대 우승 트로피를 놓칠 수 없다고 다짐한 벨라스는  우승을 향한 야심 찬 계획을 세운다  그것은 바로 새로운 멤버 영입     절대권력 리더 오브리와 청아한 고음의 클로이를 필두로 록시크 베카  폭풍 성대 팻 에이미   카리스마 랩퍼 신시아  섹시 담당 스테이시  미친 존재감 릴리 까지 치열한     오디션을 통해  드디어 새로운 멤버를 영입한다     우여곡절 끝에 새로운 음악과 파워풀한 안무로 재 탄생된 벨라스   탄탄대로일 것 같았던 그녀들 앞에 지난해 우승자이자  매력만점 훈남들의 총집합  트러블 메이커가 나타나 앞길을 가로 막는데     환상의 보이스도 아찔한 로맨스도 포기할 수 없는 벨라스   과연 그녀들은 우승 트로피와 달콤한 사랑까지 모두 쟁취 할 수 있을까  ,comedy
