,title,synopsis,category
0,메멘토(리마스터링),전직이 보험 수사관이었던 레너드에게 기억이란 없다  자신의 아내가 강간당하고 살해되던 날의 충격으로 기억을   분 이상 지속시키지 못하는 단기 기억상실증 환자가 되었던 것이다  때문에 그가 마지막으로 기억하고 있는 것은 자신의 이름이 레너드 셸비 라는 것과 아내가 강간당하고 살해당했다는 것  그리고 범인은 존   라는 것이 전부이다  중요한 단서까지도 쉽게 잊고 마는 레너드는 자신의 가정을 파탄 낸 범인을 찾기 위한 방법으로 메모와 문신을 사용하게 된다  즉  묵고 있는 호텔  갔던 장소  만나는 사람과 그에 대한 정보를 폴라로이드 사진으로 남기고  항상 메모를 해두며  심지어 자신의 몸에 문신을 하며 기억을 더듬는 것이다  하지만 시간이 지남에 따라 자신의 기억마저 변조되고 있음을 스스로도 알지 못한다  그의 곁에는  나탈리 라는 웨이트리스와  테디 라는 직업을 알 수 없는 남자가 주위를 맴돌고 있다  그들은 레너드를 잘 알고 있는 듯 하지만 레너드에게 그들은 언제나 새로운 인물이다  그도 그럴 것이 레너드는 그들을 만났다는 것을 늘 잊고 만다   마약 조직의 오해를 받으면서까지 정보를 제공하는 나탈리는 테디가 범인임을 암시하는 단서를 보여주고  테디는 절대 나탈리의 말을 믿지 말라는 조언을 한다  과연 누구의 말이 진실인가 ,horror
1,나인스 라이프,자신의 죽음에 얽  비밀을 숨긴 채 또다시  번째 죽음에서 살아난 소년   완벽하게 아름다운 엄마  살해 용의자로 지목된 후 사라져버린 아빠   지금까지 당신이 알고 있는 모든 것이 진실이 아니라면 ,horror
2,NULL,NULL,horror
3,레드 라이딩 후드,빨간모자야  사랑에 빠지지마  옛날 어느 외딴 마을에 빨간모자를 쓴 발레리라는 아름다운 소녀가 살고 있었어요  마을의 외톨이 피터와 사랑에 빠진 발레리는 부잣집 아들 헨리와 결혼하라는 부모님을 피해 마을을 떠나기로 결심했지요  하지만 붉은 달이 뜬 그날 밤  어둠의 숲에 사는 늑대에게 언니가 죽임을 당하고 말았어요  분노한 마을 사람들은 솔로몬 신부에게 도움을 청했지만  신부는 마을 사람들 속에 늑대가 인간의 모습을 하고 숨어 있다고 말했어요  달이 뜰 때마다 하나  둘  죽어가는 사람들이 늘어가고  우연  발레리는 자신과 관계된 누군가가 늑대 인간이 아닐까 생각했어요  그리고 모든 비밀을 풀기 위해 스스로 제물이 되기로 결심하고  달이 뜨는 밤 홀로 산으로 향하게 되었답니다  그리고 발레리 앞에 나타난 늑대인간은 바로 ,horror
4,NULL,NULL,horror
5,아바타: 물의 길(세트 : 아바타 1~2편), 아바타  물의 길 은 판도라 행성에서  제이크 설리 와  네이티리 가 이룬 가족이 겪게 되는 무자비한 위협과 살아남기 위해 떠나야 하는 긴 여정과 전투  그리고 견뎌내야 할 상처에 대한 이야기를 그렸다  월드와이드 역대 흥행 순위  위를 기록한 전편  아바타 에 이어 제임스 카메론 감독이   년만에 선보이는 영화로  샘 워싱턴  조 샐다나  시고니 위버  스티븐 랭  케이트 윈슬렛이 출연하고 존 랜도가 프로듀싱을 맡았다 ,horror
6,볼코노고프 대위 탈출하다,스탈린 공포정치 시대  소련 러시아 을 저격하다  역사상 가장 끔찍한 비밀경찰 조직    볼코노고프 대위 희망 없는 세상  영혼을 구하기 위한 대탈출  숨막 는 서스펜스 스릴러   차 세계대전 직전 스탈린 공포정치 시대  수십만 명의 인명을 앗아간 역사상 가장 끔찍한 비밀경찰 조직     의 볼코노고프 대위는 조직원들에게 행해지는 심문을 이상하게 여긴다  곧 자신의 차례가 다가오는 것을 감지한 그는 비밀문서를 들고 탈출을 감행한다  동료들에게 쫓기는 신세가 된 볼코노고프 대위는 자신에게도 영혼이 있다는 것을 깨닫게 되면서  자신이 저지른 충격적인 만행을 뉘우치고 피해자들의 유가족을 찾아 용서를 구하는 여정을 시작한다  하지만 용서를 구하기 위한 여정은 쉽지 않고      의 추격은 점점 더 숨통을 조여온다 ,horror
7,시실리 2km,수 백억   에 이르는 조직의 다이아몬드를 들고 튄 석태 권오중   는 교통사고로 아름답고 평화로운 시실리에 불시착하게 된다  마을 사람들의 환대에 마음을 뺏긴 석태는 시실리에서 하룻밤을 묵게 된다  그런데 그만  다이아몬드를 확인하려 들어간 화장실에서 어이없이 낙상해 질식사하게 될 위기에 처한 석태를 본 주민들은 석태가 죽었다고만 생각하고 살인 누명을 쓸까 두려워 석태를 어딘가에 묻기로 결의한다  한편  석태의 배신에 지구를 뒤져서라도 석태와 다이아몬드를 사수하고야 말겠다는 일념으로 석태를 쫒던 양이  임창정   는 휴대폰 위치추적으로 겨우겨우 시실리까지는 당도하게 된다  자꾸만 부인하는 마을 주민들과 음산한 동네 분위기에 그곳을 떠날까 했던 양이는 현장에서 석태의 키티 양말 한 짝을 발견하고 석태가 이곳에 있음을 확신하게 된다  다이아몬드의 정체를 알아버린 마을 사람들은 석태를 더더욱 숨기려고만 하고  석태가 있음을 확신하게 된 양이는 아예 시실리에 주저앉는다  쫒고 숨기는 가운데 낫  호미  도끼로 무장한 농기구 액션까지 선보이며 점점 본성을 드러내는 마을 주민들에게 엄청난 과거가 있음을 양이가 알게 되면서 귀신보다 더 무서운 마을 주민들과 서울 싸나이들의 한 판 전쟁은 이제 시작이다 ,horror
8,라이프,인류 역사상 가장 위대한 발견을 한  인의 우주인 화성에서 발견한 생명체의 등장에 지구 전체가 들뜨지만  생명체가 움직이기 시작하자 위대한 발견은 곧 가장 위험한 존재가 된다  순식간에 인류를 위협하는 지능과 능력을 지닌 존재로 진화한 생명체   억 인류를 구하기 위해  인의 우주인은 결국 목숨을 건 선택의 기로에 놓이게 된다 ,horror
9,NULL,NULL,horror
10,NULL,NULL,horror
11,NULL,NULL,horror
12,위트니스,아미시 교도인 미망인 레이첼 켈리 맥길리스 과  살의 아들 사무엘 루카스 하스 은 필라델피아 기차역에서 우연  살인현장을 목격한다  사건을 맡은 형사 존 해리슨 포드 은 살인 용의자가 신망이 두터운 고참 동료경찰 맥피이며  그를 비롯한 자신의 상관이 마약 거래에 깊이 연루되어있다는 것을 알게 된다  존과 레이첼 모자는 그들의 추적을 피해 아미시 마을로 숨어든다  중세적인 공동체 삶을 살아가는 이곳에서 존과 레이첼은 애틋한 사랑에 빠지는데   ,horror
13,기도의 막이 내릴 때,비슷한 시기에 교살당한 두 시신이 발견된다  지역 형사 카가 쿄이치로 아베  로시 는 물론 경시청까지 나서지만 실마리가 풀리지 않던 중  카가는 성공한 연극 연출가 아사이  로미 마츠시마 나나코 와의 우연한 만남을 계기로 사건의 배후에   년 전 자신의 어머니가 얽혀 있음을 알게 되는데   마침내 최후의 진실이 밝혀진다,horror
14,NULL,NULL,horror
15,제인의 말로,베이비 제인 허드슨은 어린 시절 보드빌 쇼의 유명한 스타였지만 성장한 후에는 배우로서 재능을 인정받지 못한다  대배우로 성공한 언니 블랜치의 그늘 아래서 술과 향락으로 매일을 보내고 있을 뿐이다  그러던 어느 날 술 취한 제인과 블랜치가 함께 자동차에 타고 있다 사고가 난다  블랜치는 다리를 다쳐 반신불수가 되고  제인은 불만과 질시 속에서도 어쩔 수 없이 언니를 돌보며 살게 된다  세월이 흐른 후  블랜치는 알콜중독으로 편집증 상태가 된 제인을 병원으로 보내려 하는데  이 사실을 안 제인은 온갖 수단으로 블랜치를 학대한다  제인은 헌신적인 가정부 엘비라를 우발적으로 죽이게 되자 어찌할 바를 모르고 혼란에 빠진다 ,horror
16,메카닉: 리크루트,과거를 청산하고 평화로운 일상을 보내던  비숍  제이슨 스타뎀  어느 날 의문의 세력에 의해 여자친구  지나  제시카 알바 가 납치당하고  그들로부터 도저  불가능한  개의 암살 미션을 의뢰 받는다   하지만 모든 거래가 그들의 뜻대로 될 것이라 생각하면 틀렸다  그들도 올 여름도 끝장내러 그가 온다 ,horror
17,엑소시즘 오브 에밀리 로즈,모두가 잠이 든 새벽 시  갑자기 가위에 눌린 듯 잠에서 깬 에밀리 로즈의 침대 시트가 천천  바닥으로 내려가고 그녀는 몸은 비틀리며 큰 고통을 겪는다  이후 알 수 없는 환영은 강의실과  대학 교정에서까지 에밀리가 가는 곳마다 점점 더 자주 나타나 그녀를 괴롭 다  결국 육체적 정신적 고통이 극에 달한 에밀리 로즈는 자신이 다니던 성당의 무어 신부에게 도움을 청하고 무어 신부는 한번도 해본적 없는 엑소시즘을 행해주지만  에밀리는 그만 사망하게 된다  그 결과 신부는 의사의 약물 치료를 간과하게 해 소녀를 사망에 이르게 했다는 이유로 기소된다  무어 신부는 자신의 변호사에게 악마는 존재한다고 말하고 악마의 실체를 믿지않는 검사는 신부가 미신에 빠졌다고 몰아세운다  법정증언과 그리고 실제사건이 교차되며 공포는 더욱 극대화되고 특  빙의가 시작되자 알 수 없는 괴성을 지르던 에밀리가 유리창을 깨고 건물 아래로 떨어지는 장면과 바닥에 누워 있다가 남자친구에게 악마의 목소리를 내는 장면 등은 이제껏 어느 공포영화에서 볼 수 없는 섬뜩함을 전해준다 ,horror
18,프리미엄 러쉬,뉴욕의 자전거 배달원이 우연  큰 돈이 얽  물건을 배달하게 되면서 벌어지는 사건을 그린 영화,horror
19,NULL,NULL,horror
20,스트리머,산 사람은 붉게 귀신은 파랗게  모든 것이 생중계 된다   한   가 남긴 기괴한 영상의 진위를 밝 겠다며 한 폐건물로 모인  명의 스트리머들  각자 라이브 방송을 진행하며 건물을 살펴보던 그들의 섬뜩하고 소름 끼치는 현장은 그야말로 리얼하게 생중계 되는데 ,horror
21,능력소녀,어떤 교실  전교  등으로 부러움을 한 몸에 받는  능력소녀  공미나와 반에서 존재감마저 없는  무능력소녀  맹주리  어느 날 갑자기  미나의 눈꺼풀이 감기지 않고 주리에겐 몰랐던 능력이 찾아오는데  이들 십대 소녀들에게 펼쳐지는 의외의 일들은 모두를 경악케 한다    제  회 서울독립영화제 ,horror
22,NULL,NULL,horror
23,이스케이프 룸,악령에 홀린 살인마에 의해 갇 게 된 친구 네 명이 탈출을 위해 사투를 벌이는 내용의 공포 영화,horror
24,NULL,NULL,horror
25,NULL,NULL,horror
26,나를 찾아줘, 년 전 실종된 아들을 봤다는 연락을 받은  정연  이영애   숱하게 반복되던 거짓 제보와 달리 생김새부터 흉터까지 똑같은 아이를 봤다는 낯선 이의 이야기에  정연 은 지체 없이 홀로 낯선 곳으로 향한다   하지만 자신의 등장을 경계하는 듯한 경찰  홍경장  유재명 과 비슷한 아이를 본 적도 없다는 마을 사람들  그들이 뭔가 숨기고 있음을 직감한  정연 은 포기하지 않고 진실을 찾기 시작하는데    년 전 사라진 아이 그리고 낯선 사람들 모두가 숨기고 있다,horror
27,NULL,NULL,horror
28,에어 포스 원,미국 대통령인 제임스 마샬                           해리슨 포드 분 은 러시아의 고관들이 운집한 대형 룸에서 파시스트 독재자인 라덱 장군이 최근 카자흐스탄에서 저지른 인권을 유린하는 폭거는 더이상 용납하지 않을 것이라는 열정적인 연설을 한다  아울러 마샬은 정치적 독재를 겨냥한 총체적 전쟁의 포성을 알리는 조치로 라덱 장군을 체포하기 위해 전개한 러시아와 미국의 합동 작전의 성과를 치하한다  이 연설이 끝난 후 마샬은 아내                 웬디 크로슨 분 와 딸                 리슬 매튜스 분 과 함께 워싱턴으로 돌아가기 위해 대통령 전용기   에어 포스 원 에 오른다  그러나 이 비행기는 러시아의 저널리스트로 위장한 발레라         게리 올드만 분 가 이끄는 테러리스트들에 의해 공중 납치를 당하게 된다  이들의 목적은 억류 중인 독재자 라덱 장군을 석방하려는 것  그러나 라덱 장군이 석방될 경우 수백  수천 명이 더 죽임을 당하게 된다는 것을 아는 백악관의 부통령                                 글렌 클로즈 분 은 속수무책의 상황에 빠지고 미국의 막강한 군사력도 난감한 상황에 봉착하게 된다  이들 테러리스트의 만행을 저지시키는 임무는 전적으로 단 한 사람  미국 대통령 제임스 마샬의 어깨에 달려 있다  테러리즘과는 추호의 타협도 용납하지 않겠다는 그의 용기와 확신은 대통령 전용기 안에 그의 가족이 함께 억류되어 있는 상황에서 시험대에 오르게 되는데 ,horror
29,바바둑,남편을 교통사고로 잃고 어린 아들과  겹게 살아가는 여인 아멜리아  그녀는 어느 날 남편의 창고에서 발견한 그림책  바바둑 을 아들에게 읽어준다  하지만 이는 단순한 동화책이 아닌 악령 바바둑의 저주가 담긴 금서임이 드러나고  그녀는 바바둑과 죽음을 넘나드는 처절한 사투를 시작한다  아멜리아는 아들을 지켜낼 수 있을까  온몸을 조용  휘감는 두려움과 날카로운 청각적 공포는 강력한 전율을 선사한다    제  회 부천국제판타스틱영화제 ,horror
