,title,synopsis,category
0,스페셜 포스 : 블랙 마운틴,평화롭던 어느 날 시리아 국경에 무장 테러단체     가 등장하게 된다  테러조직의 만행에 시민의 안전과 국경을 수비하기 위해 최고의 특공대 메텔레르가 작전에 투입되지만  미국의 정치적 간섭과 고립된 산악지역에 특공대원들은 위기에 처한다  한편 노인부터 어린아이까지 무자비하게 사살하는     의 모습에 특공대원들은 분노하고 지원 요청도 통하지 않는 극한의 상황에서 최후의 전투를 준비하게 되는데   ,action
1,피스메이커,러시아의 외진 탄광촌에서 불가사의 한 폭발이 대지를 흔들어 놓는다  핵폭탄을 철거하기 위해 러시아 부대가 기차로 운반하던 핵무기가 갑자기 반대편에서 달려오던 기차와 정면 충돌하여 폭발한 것이었다  이 핵폭발 사건은 국제적인 사건으로 번져 전세계가 긴장하게 된다  점멸된 기차를 둘러싼 조사는 핵무기가 어느 조직에 의한 탈취 사건과 연루된 것으로 밝혀진다  백악관 자문위원인 핵물리학자 줄리아 켈리              니콜 키드먼 분 는 졸지에 백악관의 핵무기 단속반의 총책임자로 파견되고  즉시 그녀를 돕기 위해 미육군 특수 정보국 소속의 토마스 드보 대령               조지 크루니 이 파견된다  원리 원칙을 추구하는 켈리 박사와 현실적인 드보 대령은 성격과 업무 스타일은 갈등을 이룰 겨를도 없이 한 팀이 되어 핵무기 회수를 위해 동유럽 태러 단체들을 하나씩 찾아낸다  그러나 동부 유럽에서 이란으로 넘어가기 전 이란 국경 앞에서 탄두는 실체를 감춘다  곧 추종자들에 의해 탄두를 손에 넣은 외교관 듀산은 미국 뉴욕에 잠입  자유의 도시 뉴욕을 파괴시킬 목적으로 핵폭탄을 배낭에 짊어진 채 유엔 본부를 향해 달린다  켈리 박사와 드보 대령은 그를 멈추기 위해 교통 지옥 속의 뉴욕을 샅샅이 뒤지며 긴박한 추격전을 펼친 끝에 마침내 핵폭발을 막는다 ,action
2,주토피아(패키지상품 : 더빙판 추가증정),누구나 살고 싶은 도시  위  주토피아 연쇄 실종 사건 발생   미치도록 잡고 싶었다    교양 있고 세련된 라이프 스타일을 주도하는 도시 주토피아  이 곳을 단숨에 혼란에 빠트린 연쇄 실종사건이 발생한다  주토피아 최초의 토끼 경찰관 주디 홉스는   시간 안에 사건 해결을 지시 받자 뻔뻔한 사기꾼 여우 닉 와일드에게 협동 수사를 제안하는데   스릴 넘치는 추격전의 신세계가 열린다 ,action
3,해리 포터와 불의 잔(4편),요즘 들어 매일 꾸는 악몽 때문에 이마의 상처에 더욱 통증을 느끼는 해리 다니엘 래드클리프 는 친구 론 루퍼트 그린트 과 헤르미온느 엠마 왓슨 와 함께 퀴디치 월드컵에 참가해 악몽에서 벗어날 수 있게 돼 마냥 기쁘다  그러나 퀴디치 캠프장 근방 하늘에 불길한 기운이 나타난다  바로 마왕 볼드모트의 상징인  어둠의 표식 이 나타난 것  볼드모트가   년 전에 자취를 감춘 뒤  감  모습을 드러내지 못했던 그의 추종자 데스 이터             들이 그 표식을 불러낸 것이다  두려움으로 가득 찬 해리는 안전한 호그와트 마법학교로 돌아가고 싶어한다  덤블도어 교장 마이클 갬본 경 이라면 자신을 지켜줄 수 있을 것이기에     그러나 올해는 예년과 상황이 좀 다르다  덤블도어 교장은 유럽의 세 개 명문 마법학교의 결속을 다지기 위해 그간 중단됐던 호그와트에서  트리위저드 대회 를 개최키로 했음을 발표한다  트리위저드 대회는 마법사들 세계에서 가장 흥미진진하고 위험한 마법경연대회  마법의 최고 명문  개 학교에서 선발된 챔피언 한 명씩 출전해  트리위저드 컵을 놓고 목숨을 건 경합을 벌이는 것이다  호그와트 학생들은 대회 참가를 위해 방문한 우아한 프랑스의 보바통 마법아카데미 여학생들과 강인한 분위기의 불가리아 덤스트랭 학교 남학생들이 연회장을 가득 메우자  경탄을 금치 못한다  장내가 정리되고 마법부 직원인 바티 크라우치 로저 로이드 팩 와 덤블도어 교장의 주재 하에 마법의  불의 잔 이 각 학교 출전자를 선발하는 의식이 열린다  현란한 불꽃의 축제 속에 불의 잔은 마침내 세 학생의 이름을 호명한다  덤스트랭 학교의 퀴디치 경기 슈퍼스타인 빅터 크룸 스타니슬라브 이아네브스키 과 보바통 마법아카데미의 플뢰르 델라쿠르 클레멘스 포에시   그리고 호그와트의 팔방미인이자 최고 인기남 케드릭 디고리 로버트 패틴슨 이 그들  그러나 세 명의 이름이 다 호명된 후  뜻밖에도 불의 잔은 또 한 명의 이름을 내뱉는다  그 이름은 바로  해리포터   그러나 해리는 시합 출전자의 나이 제한인   세보다 세 살이나 어린   세  게다가 불의 잔 속에 자신의 이름을 넣은 적이 없다며 출전 의사가 없음을 밝 지만 불의 잔의 단호한 뜻에 따라  어쩔 수 없이 출전하게 된다  이 일로 인해 해리포터에겐 의혹과 시기의 시선이 집중되고  추문 폭로기사 전문기자 리타 스키터 미란다 리쳐드슨 는 해리에 대한 모함성 기사를 써서 이를 더욱 부채질한다  해리의 절친한 친구인 론마저도 해리가 유명해지고 싶어서 불의 잔을 조작해 자신의 이름을 호명하게 했다고 믿기 시작한다  해리를 위험에 처하게 하기 위해 누군가 해리의 이름을 불의 잔에 넣은 것으로 생각한 덤블도어 교장은 신임  어둠의 마법 방어술  교수  매드아이 무디  브랜든 글리슨 에게 해리포터를 잘 지킬 것을 지시한다  해리는 트리위저드 대회의 세가지 과제에 대비한 마법 훈련에 돌입한다  그 과제란 불 뿜는 용 피하기  거대한 호수 깊이 잠수하기  살아있는 미로를 빠져 나오기 등  그러나 그보다 해리에게 더  든 숙제는 크리스마스 무도회인          에 함께 참석할 파트너를 구하는 문제다  해리에겐 용이나 인어  그라인딜로우와 싸우는 편이 사랑스러운 여학생 초 챙 케이티 렁 에게 크리스마스 무도회의 파트너가 돼달라고 부탁하는 것보다 훨씬 쉬운 일이다  한편 론은 헤르미온느에 대한 자신의 감정이 예전과 다르다는 걸 미처 깨닫지 못하고    그러던 중 호그와트 교정에서 누군가 살해되면서 상황은 급변한다  볼드모트의 악몽으로 두려움에 휩싸인 해리는 덤블도어를 찾아가지만 그 역시도 뚜렷한 해답을 제시하지 못한다  경기가 진행되고  해리와 다른 출전자들이 마지막 과제를 풀기 위해 안간 을 쓰고 있을 때 무언가가 계속 이들을 주시한다  승리가 목전에 다가온 그 순간  이제까지의 모든 진실이 밝혀지고 해리포터에게는 진정한 악과의 피할 수 없는 대결이 기다리고 있는데    ,action
4,슈퍼 마리오 브라더스,따단 딴 따단 딴 전 세계를 열광시킬 올 타임 슈퍼 어드벤처의 등장  뉴욕의 평범한 배관공 형제  마리오 와  루이지 는 배수관 고장으로 위기에 빠진 도시를 구하려다 미스터리한 초록색 파이프 안으로 빨려 들어가게 된다  파이프를 통해 새로운 세상으로 차원 이동하게 된 형제  형  마리오 는 뛰어난 리더십을 지닌  피치 가 통치하는 버섯왕국에 도착하지만 동생  루이지 는 빌런  쿠파 가 있는 다크랜드로 떨어지며 납치를 당하고  마리오 는 동생을 구하기 위해  피치 와  키노피오 의 도움을 받아  쿠파 에 맞서기로 결심한다  그러나 슈퍼스타로 세상을 지배하려는 그의 강력한   앞에 이들은 예기치 못한 위험에 빠지게 되는데     동생을 구하기 위해  세상을 지키기 위해   슈퍼 마리오 로 레벨업 하기 위한  마리오 의 스펙터클한 스테이지가 시작된다 ,action
5,나 홀로 집에,크리스마스 시즌의 시카고  말썽꾸러기라 집안 가족들로부터 욕을 듣고 따돌림 당하는 케빈은 늘 자신은 혼자 살거라면서 가족들이 모두 없어졌으면 좋겠다고 생각한다  자기의 치즈 피자를 먹은 형과 싸워 소동을 일으키자 엄마는 케빈을  층 다락방으로 올려보낸다  케빈의 가족들과 케빈의 집에 온 손님들은 다음 날에 크리스마스 연휴를 이용해 프랑스의 친척 집으로 떠날 계획이었다   그날 밤  바람이 세차게 불어 전화선과 전기선이 끊긴다  케빈의 가족들은 늦잠을 자게 되어 비행기 시간을 맞추기 위해 허둥대다가 그만  층 다락방에서 잠이 든 케빈을 두고 떠난다  잠에서 깬 케빈은 혼자 남은 것을 알고 하느님이 자신의 소원을 들어주었다고 기뻐한다  비행기를 타고 가던 케빈의 어머니는 무엇인가 빠뜨린 기분에 고민하다가 케빈을 두고 왔음에 놀란다  하지만 전화선이 불통이라  어쩔 수 없다가 프랑스에 도착한 식구들은 목적지로 가고 엄마는 케빈이 걱정이 되어 집으로 돌아갈 비행기표를 사기 위해 안간 을 쓰지만 연말연휴라 좌석이 없었다   혼자 집에 남은 케빈은 형과 누나 방을 구경하면서 즐거워한다  그리고 노래를 부르고 트리도 만들면서 자축한다  그런데 빈집털이  인조 도둑이 케빈의 집을 호시탐탐 노리고 있다는 것을 알게 되는데   ,action
6,어벤져스: 엔드게임(패키지: 자막판+더빙판+코멘터리+부가영상),인피니티 워 이후 절반만 살아남은 지구 마지막 희망이 된 어벤져스 먼저 떠난 그들을 위해 모든 것을 걸었다   위대한 어벤져스 운명을 바꿀 최후의 전쟁이 펼쳐진다 ,action
7,헝거게임 : 판엠의 불꽃,세상을 변화시킬 거대한 혁명의 불꽃이 타오른다    개의 구역으로 이루어진 독재국가  판엠 이 체재를 유지하기 위해 만든 생존 전쟁  헝거게임   일년에 한번 각 구역에서 추첨을 통해 두 명을 선발  총   명이 생존을 겨루게 되는 것   헝거게임 의 추첨식에서  캣니스 는 어린 여동생의 이름이 호명되자 동생을 대신해 참가를 자청하며 주목을 받는다  과거 자신을 위기에서 구해줬던  피타  역시 선발되어 미묘한 감정에 휩싸인다   캣니스 는 금지구역에서 함께 사냥을 했던  게일 에게 가족을 부탁하며 생존을 겨루게 될 판엠의 수도  캐피톨 로 향하는데 ,action
8,분노의 질주: 더 얼티메이트,도미닉 빈 디젤 은 자신과 가장 가까웠던 형제 제이콥 존 시나 이 사이퍼 샤를리즈 테론 와 연합해 전 세계를 위기로 빠트릴 위험천만한 계획을 세운다는 사실을 알게 되고  이를 막기 위해 다시 한 번 패밀리들을 소환한다   가장 가까운 자가 한순간  가장 위험한 적이 된 상황 도미닉과 패밀리들은 이에 반격할 놀라운 컴백과 작전을 세우고 지상도  상공도  국경도 경계가 없는 불가능한 대결이 시작되는데 ,action
9,탐정 당인: 차이나타운 살인사건,경찰학교에 보기좋게 떨어진  진풍  류호연 은 할머니의 성화에 먼 친척뻘인  당인 이 있는 태국으로 일주일간  링 여행을 간다  자칭 태국의 명탐정  타칭 허풍쟁이  당인  왕바오창 은 완벽한 관광을 약속하지만 때마침 차이나타운의 금괴 절도범 살해 용의자로 지명수배 당한다   승진기회를 노리는 두 경찰  후앙  진혁 과  타이  샤오양 에게 쫓기게 되자  진풍 은 어쩔 수 없이  당인 의 누명을 벗기기 위해 추리 작전을 시작한다  추리 소설 마니아로서 확실한 증거로 사건을 해결하려는  진풍 과 달리 말보다 행동이 먼저인  당인 은 진범을 찾아갈수록 사건의 충격적인 실체를 알게 되는데   ,action
10,미션 임파서블: 폴아웃,도난당한 핵무기를 되찾아 오는 위험천만한 작전 중  에단 헌트 톰 크루즈 는 임무를 포기하고  팀원의 목숨을 구하는 선택을 한다  이제  핵무기는 문명을 무너뜨리려는 사악한 테러조직의 손에 넘어갔다  세계를 멸망시킬 핵 재앙을 막기 위해 세계 최강 스파이기관     의 에단 헌트와 정예 요원들 사이먼 페크  빙 라메스  레베카 퍼거슨 은 숙명의 라이벌  중앙정보국    의 상급 요원 헨리 카빌 과 불편한 동맹을 맺어야만 한다  이보다 더 불가능한 미션은 없었다  역대 최대 규모  최강 액션을 기대하라 ,action
11,NULL,NULL,action
12,범죄도시2,가리봉동 소탕작전 후  년 뒤  금천서 강력반은 베트남으로 도주한 용의자를 인도받아 오라는 미션을 받는다   괴물형사  마석도  마동석 와  전일만  최귀화  반장은 현지 용의자에게서 수상함을 느끼고  그의 뒤에 무자비한 악행을 벌이는  강해상  손석구 이 있음을 알게 된다    마석도 와 금천서 강력반은 한국과 베트남을 오가며 역대급 범죄를 저지르는  강해상 을 본격적으로 쫓기 시작하는데     나쁜 놈들 잡는 데 국경 없다  통쾌하고 화끈한 범죄 소탕 작전이 다시 펼쳐진다 ,action
13,트랜스포머: 비스트의 서막,전 우주의 행성을 집어삼키는 절대자   유니크론 의 부하  스커지 는  테러콘 들을 이끌고 지구에 당도한다  그에 맞서기 위해 지구에 정체를 숨기고 있던 트랜스포머  오토봇  군단이 모습을 드러내고 또 다른 트랜스포머 진영인  맥시멀 과  을 합친다  옵티머스 프라임이 이끄는  오토봇 과 옵티머스 프라이멀을 중심으로 한  맥시멀   모두의 운명을 건 그들의 압도적 전투가 시작된다 ,action
14,인셉션,드림머신이라는 기계로 타인의 꿈과 접속해 생각을 빼낼 수 있는 미래사회  돔 코브  레오나르도 디카프리오 는 생각을 지키는 특수보안요원이면서 또한 최고의 실력으로 생각을 훔치는 도둑이다  우연한 사고로 국제적인 수배자가 된 그는 기업간의 전쟁 덕에 모든 것을 되찾을 수 있는 기회를 얻게 된다  하지만 임무는 머릿속의 정보를 훔쳐내는 것이 아니라  반대로 머릿속에 정보를 입력시켜야 하는 것  그는  인셉션 이라 불리는 이 작전을 성공시키기 위해 최강의 팀을 조직한다  불가능에 가까운 게임  하지만 반드시 이겨야만 한다 ,action
15,에이펙스,상류층 부자들은 현실과 가상이 뒤섞인 에이펙스 섬에 모여 거액의 돈을 지불하고 인간 사냥을 즐긴다  그때 무기징역을 받고 평생 감옥에 갇혀 살아야 했던 멀론이 그들의 사냥감으로 선택되는데   명의 사냥꾼들은 멀론의 노쇠한 외모를 보고 그의 실력을 믿지 않는다  전직 경찰로 웬만한 특수 요원보다 죽을 고비를 더 많이 넘겼던 멀론  완전무장한 사냥꾼들로부터 살아남기 위해 완벽한 생존 전략을 세워야 하는데 ,action
16,NULL,NULL,action
17,해리 포터와 불사조 기사단(5편),길고도 지루한 여름 날 호그와트 마법학교 다섯 번째 해를 기다리고 있는 해리포터 다니엘 래드클리프   이모부 더즐리 식구들과 참고 사는 것도 지겨운데다 친구 론 루퍼트 그린트 과 헤르미온느 엠마 왓슨 에게서는 편지 한 통 오지 않는다  그러던 중 예상치 못했던 편지 한 장이 도착한다  그것은 해리가 학교 밖인 리틀 위닝에서 얄미운 사촌 두들리  즉 머글 앞에서 디멘터들의 공격을 막는 마법을 사용했기 때문에 호그와트 마법학교에서 퇴학 당하게 되었다는 소식이었다  앞이 캄캄한 해리  갑자기 어둠의 마법사 오러들이 나타나 해리를 불사조 기사단의 비밀 장소로 데리고 간다  시리우스 게리 올드만 를 위시한 불사조 기사단을 만난 해리는 과거  부모님들의 활약상을 알게 되어  을 얻고  자신을 퇴학시키기 위해 마법부 장관 코넬리우스 퍼지 로버트 하디 가 법정에 세우지만 덤블도어 교장 마이클 갬볼 경 의 중재 덕분에 무죄 판결까지 받는다  하지만 예언자 일보는 볼드모트 랄프 파인즈 가 돌아왔다는 해리의 말이 새빨간 거짓말이라며 비난하고 학생들 역시 해리를 의심하며 따돌린다  게다가 자신이 가장  들어 할 때 도움을 주던 덤블도어 교장까지도 이유 없이 해리를 멀리하고   한편  덤블도어도 못마땅한데 해리의 퇴학마저 무산이 되자 마법부 장관은  어둠의 마법방어술  과목에 돌로레스 엄브릿지 이멜다 스털톤 를 교수로 임명한다  하지만 엄브짓지의 마법방어술 수업은 학생들이 어둠의  으로부터 스스로를 지켜내기는커녕 오 려 곤경에 빠지게 한다  이에 헤르미온느와 론은 해리의 능력을 믿고 자칭  덤블도어의 군대 라고 명명한 비밀단체를 조직한다  해리는 어둠의 마법에 맞서 스스로를 지켜낼 수 있는 방법을 학생들에게 가르쳐주며 앞으로 닥칠 격전에 대비시킨다  그러나 밤마다 불길한 사건을 예견하는 악몽에 시달리는 해리  이제 볼드모트와의 대결이 머지 않았음을 느끼게 된다  시리우스가 공격 당하는 악몽을 꾼 해리는 덤블도어 군대와 함께 마법부 미스터리 부서 예언의 방으로 향한다  그리고 이어 나타난 죽음을 먹는 자들   빛의 마법과 어둠의 마법간의 불꽃 튀는 대결 해리포터와 불사조 기사단  호그와트의 운명이 그들에게 달렸다 ,action
18,NULL,NULL,action
19,알라딘(패키지: 자막판+더빙판+싱어롱+부가영상),머나먼 사막 속 신비의 아그라바 왕국의 시대  좀도둑  알라딘 은 마법사  자파 의 의뢰로 마법 램프를 찾아 나섰다가 주인에게 세 가지 소원을 들어주는 지니를 만나게 되고  자스민 공주의 마음을 얻으려다 생각도 못했던 모험에 휘말리게 되는데 ,action
20,플래시,시공간이 붕괴된 세계  차원이 다른  어로가 온다  빛보다 빠른 스피드  물체 투과  전기 방출  자체 회복  천재적인 두뇌까지 갓벽한 능력을 자랑하지만 존재감은 제로  저스티스 리그에서 궂은일을 도맡아 하는  어로  플래시   어느 날 자신에게 빛보다 빠른 속도로 달리면 시공간 이동 능력이 있음을 알게 된 그는  브루스 웨인 의 만류를 무시한 채 끔찍한 상처로 얼룩진 과거를 바꾸기 위해 시간을 역행한다  의도치 않은 장소에 불시착한  플래시 는 멀티버스 세상 속 또 다른 자신과 맞닥뜨리고 메타 휴먼이 흔적도 없이 사라지고 모든 것이 뒤엉킨 세상과 마주하게 된다   플래시 는 자신이 알던 모습과 전혀 달라진 나이 들고 은퇴한  배트맨 과 크립톤 행성에서 온  슈퍼걸 의 도움으로 외계의 침공으로부터 시간과 차원이 붕괴된 지구를 구하려 나서는데 ,action
21,던전 앤 드래곤: 도적들의 명예,한때는 명예로운 기사였지만   어떤 사건  이후  홀가    사이먼    포지 와 함께 도적질을 하게 된  에드긴    소피나 의 제안으로  부활의 서판 을 얻기 위해  코린의 성 에 잠입하지만  포지 와  소피나 의 배신으로 실패하고 감옥에 갇 다  기발한 방법으로 탈옥에 성공한  에드긴 과  홀가 는 소중한 사람들과 다시 만나고   부활의 서판 도 되찾기 위해 자신만의 팀을 꾸리기 시작하는데  옛 동료인 소질 없는 소서러  사이먼 과 새롭게 합류한 변신 천재 드루이드  도릭   재미 빼고 다 가진 팔라딘  젠크 까지 어딘가    부족한 오합지졸로 가득한 이 팀  과연 무사  모험을 끝마칠 수 있을까   가디언즈 오브 갤럭시  어벤져스  에이지 오브 울트론  제작진이 선보이는 매력만점 롤플레잉 액션 어드벤처 무비가 온다 ,action
22,우크라이나 항전,러시아의 계속되는 허위 정보 공작에도 우크라이나 군인과 청년들은 최후의 방어선과 다름없는 도네츠크 국제공항의 터미널들을 지켜내는 데 성공한다   기쁨도 잠시  러시아군이 공항을 초토화시키고자 로켓 공격을 자행할 거라는 첩보가 전달된다  하지만 굉장  혼란스러운 분위기임에도 그 누구도 공항을 떠나지 않았고  하나로 똘똘 뭉친 이들은 최후의 결전을 준비하는데 ,action
23,해리 포터와 혼혈 왕자(6편),어둠의 세력이 더욱 강력해져 머글 세계와 호그와트까지 위협해온다  위험한 기운을 감지한 덤블도어 교수는 다가올 전투에 대비하기 위해 해리 포터와 함께 대장정의 길을 나선다  볼드모트를 물리칠 수 있는 유일한 단서이자 그의 영혼을 나누어 놓은  개의 호크룩스를 파괴하는 미션을 수행해야만 하는 것  또한 덤블도어 교수는 호크룩스를 찾는 기억여행에 결정적 도움을 줄 슬러그혼 교수를 호그와트로 초청한다  한편 학교에서는 계속된 수업과 함께 로맨스의 기운도 무르익는다  해리는 자신도 모르게 지니에게 점점 끌리게 되고  새로운 여자 친구가 생긴 론에게 헤르미온느는 묘한 질투심을 느끼는데    남겨진 결전을 위한 최후의 미션  볼드모트와 해리 포터에 얽  치명적인 비밀  선택된 자만이 통과할 수 있는 대단원을 향한 본격적인 대결이 시작된다 ,action
24,스파이더맨: 어크로스 더 유니버스,스파이더맨    스파이더맨   여러 성장통을 겪으며 새로운 스파이더맨이 된  마일스 모랄레스   그 앞에 다른 평행세계의 스파이더우먼  그웬 이 다시 나타난다  모든 차원의 멀티버스 속 스파이더맨들을 만나게 되지만  질서에 대한 신념이 부딪 며 예상치 못한 균열이 생기는데  상상 그 이상을 넘어서는 멀티버스의 세계가 열린다 ,action
25,스페셜 포스 : 블러드 마운틴,이슬람 무장 테러단체   에 의해 납치된 터키 기자  세이다   그녀는 이라크 분쟁 지역 주민들을 인터뷰하다 납치되어 참수당할 위기에 처한다   세이다 를 구출하기 위해 터키 정부는 비밀 수색 및 구조를 전담하는 특수부대를 파견하고  특수 부대장  베이셀 은  명의 팀원들을 이끌고 이라크로 향하는데   ,action
26,알래스카 대지진,알래스카에 크리스마스 이브가 찾아왔지만 행복한 휴일에 심상치 않은 재난이 발생한다  러시아 북극해에서 거대한 빙하가 붕괴하고 그것이 주변 지역에 강한 지진을 발생시킨 것  군 소속 지질학자 마이클 웹스터는 가족들과 산에 크리스마스트리를 구하러 갔다가 눈사태와 동토 층이 갈라지는 이상 현상으로 오도 가도 못하고 갇 고 만다  단순한 지진이 아니라 지하의 메탄가스가 폭발하는 심각한 재난임을 알게 된 대령은 마이클 가족을 구하고 대도시 파괴를 막기 위해 고분분투 한다  위대한 자연의 횡포 앞에서 끈질긴 생존 본능으로 맞서는 인간의 처절한 사투가 시작되는데   ,action
27,NULL,NULL,action
28,라자루스,범죄와 빈곤으로 황폐해진 암흑 도시  파라다이스 시티   이 도시를 장악하는 거대 조직이 시민 영웅  레이 라자루스 를 자신의 조직으로 영입하려 하자 레이는 그 제안을 거절하고  그 결과 처참  살해된다  하지만 정체 불명의 비밀 조직이  레이 에게 초인적인 능력을 부여하면서  그는 다시 살아나게 된다  한편 거대 조직을 움직이는 큰 손  포엣   조직의 수장  테스 의 명령 하에 마약 공장을 세워 돈을 벌어 들이고 무고한 시민들을 죽이기 시작한다  이 사실을 안  레이 는 거대 조직의 어둠으로부터 도시를 해방시키고 동료들과 시민들에 대한 복수를 하기 위해 악의 거대 조직에 맞서 싸운다 ,action
