,title,synopsis,category
0,NULL,NULL,action
1,NULL,NULL,action
2,라쇼몽,전란이 난무하는 헤이안 시대  억수같은 폭우가 쏟아지는  라생문 의 처마 밑에서 나뭇꾼과 스님이  모르겠어  아무래도 모르겠어  라며 심각한 표정으로 생각에 잠겨 있다  잠시 비를 피하러 그곳에 들른 한 남자가 그 소리를 듣고 궁금해 한다  이들은 이 남자를 상대로 최근에 그 마을에 있었던 기묘한 사건을 들려준다  사건이 벌어진 배경은 녹음이 우거진 숲속  사무라이 타케 로 모리 마사유키 가 말을 타고 자신의 아내 마사코 교 마치꼬 와 함께 오전의 숲속 길을 지나가고 있었다  그늘 속에서 낮잠을 자던 산적 타조마루 미후네 도시로 는 슬쩍 마사코의 예쁜 얼굴을 보고는 그녀를 차지할 속셈으로 그들 앞에 나타난다  속임수를 써서 타케 로를 포박하고  타조마루는 마사코를 겁탈한다  오후에 그 숲속에 들어선 나뭇꾼은 사무라이 타케 로의 가슴에 칼이 꽂혀있는 것을 발견하고 관청에 신고한다  곧 타조마루는 체포되고  행방이 묘연했던 마사코도 불려와 관청에서 심문이 벌어진다  문제는 겉보기에는 명백한 듯한 이 사건이 당사자들의 진술을 통해 다양한 진실을 들려준다는 점이다  즉 무엇이 진실인지 알 수 없는 상황에 이른다  먼저 산적 타조마루는 자신이 속임수를 썼고  마사코를 겁탈한 것은 사실이지만  사무라이와는 정당한 결투 끝에 죽인 것이라고 떠벌린다  하지만 마사코의 진술은 그의 것과 다르다  자신이 겁탈당한 후  남편을 보니 싸늘하기 그지없는 눈초리였다고 한다  자신의 잘못이 아님에도 자신을 경멸하는 눈초리에 제정신이 나간 그녀는 혼란 속에서 남편을 죽였다고 진술한다  하지만 무당의  을 빌어 강신한 죽은 사무라이 타케 로는 또다른 진술을 털어놓는다  자신의 아내가 자신을 배신했지만  오 려 산적 타조마루가 자신을 옹호해줬다는 것이다  그리고 그는 스스로 자결했다는 것이다  이처럼 엇갈리는 진술 속에는 각자의 입장과 이해관계가 담겨있다  좀처럼 실체적 진실에 접근할 수 없는 이때  실은 그 현장을 목격한 이가 있었으니 그가 바로 나뭇꾼이다  그는 마사코가 싸우기 싫어하는 두 남자를 부추겨서 결투를 붙여놓고 도망쳤고  남은 두 남자는 비겁하고 용렬하기 짝이 없는 개싸움을 벌였다는 것이다 ,action
3,NULL,NULL,action
4,반지의 제왕: 두 개의 탑_(확장판)(확장판 FHD), 명의 반지원정대는 사우론의 사악한 세력에 맞서 반지를 지켜냈지만 반지 원정대는 뿔뿔이 흩어지게 된다  호빗족으로 절대반지에 유일한 내성을 보이는  프로도 는 일행과 떨어져  샘 과 함께 불의 산으로 모험을 감행하지만 새로운 위협을 맞이하고 사루만의 우르쿠하이 군대에게 잡혀간  메리 와  피핀 은 엔트 족의 영역에서  트리비어드 라는 엔트 족에게 구출 받게 된다  한편  메리 와  피핀 을 구하기 위해 우루쿠하이 군대를 추격하던  아라곤 과  레골라스    김리 는 유령 숲에서 백색의 마법사로 부활한 마법사  간달프 를 만나게 되고 악의 군주  사우론 이 암흑세계의 두 개의 탑  오르상크 와  바랏두르 를 통합하여 점점 그 세력을 넓혀가고 있다는 사실을 듣게 된다  이에  아라곤 과 나머지 원정대는 중간계의 선한 무리의 통합을 이뤄  사우론 의 강력한 세력을 견제해야하는 큰 임무를 맡게 된다  하지만 동맹관계가 깨져  곤도르  왕국과  로한 왕국으로 나뉜 인간 종족의 통합은 쉽지 않고 게다가  로한 의 왕마저  사루만 에게 동화되는데   결국  사우론 은 서서  중간계를 거대한 전쟁의 소용돌이로 몰고 가고  아라곤  또한 인간과 엘프  난쟁이족  그리고 엔트족 등을 통합하여 이에 맞설 준비를 한다  결코 피할 수 없는 거대한 전쟁이 시작된 것이다 ,action
5,슬럼독 밀리어네어, 자말 말릭은 퀴즈쇼에서 상금  억원이 걸려있는 최종 단계에 왔다  어떻게 가능했을까     속임수로      운이 좋아서      천재라서      영화 속 얘기니깐                     년  뭄베이  빈민가 출신의   살 고아 자말은 거액의 상금이 걸려있는  누가 백만장자가 되고 싶은가 라는 최고 인기 퀴즈쇼에 참가한다  처음 모두에게 무시당하던 자말은 예상을 깨고 최종 라운드에 오르게 되고  정규 교육도 제대로 받지 못한 그의 부정행위를 의심한 경찰은 자말을 사기죄로 체포한다  하지만  결국 자말이 살아온 모든 순간이 정답을 맞출 수 있는 실마리였다는 것과  그가 퀴즈쇼에 출연한 진짜 목적이 밝혀지게 되는데 ,action
6,크로우즈 제로,품성제로  초특급 사고뭉치 불량 학생들이 모두 모인 악명 높은 스즈란 고등학교  무수한 파벌과 새로운 강자들의 등장으로 정상을 차지하려는 세력 다툼은 잠시도 그치질 않고  지금까지 스즈란 고교를 완전 평정한  인자는 아무도 없었다  현재 스즈란 고교의 최강 세력은  학년 세리자와 타마오 야마다 타카유키   막강한 싸움꾼에다 의협심도 강해 엄청난 수하를 거느린 세리자와에게도 스즈란 완전 제패는 만만하지가 않다  어느 날 도저  불가능하다는 스즈란 고교 완전 제패를 꿈꾸며 겁없는 전학생 타키야 겐지 오구리,action
7,다크 나이트,이 도시에 정의는 죽었다  범죄와 부정부패를 제거하여 고담시를 지키려는 배트맨 크리스찬 베일   그는 짐 고든 형사 게리 올드만 와 패기 넘치는 고담시 지방 검사 하비 덴트 아론 에크하트 와 함께 도시를 범죄 조직으로부터 영원  구원하고자 한다  배트맨을 죽여라  세 명의 의기투합으로 위기에 처한 악당들이 모인 자리에 보라색 양복을 입고 얼굴에 짙게 화장을 한 괴이한 존재가 나타나  배트맨을 죽이자 는 사상 초유의 제안을 한다  그는 바로 어떠한 룰도  목적도 없는 사상 최악의 악당 미치광이 살인광대  조커   스 레저   마침내 최강의 적을 만나다  배트맨을 죽이고 고담시를 끝장내버리기 위한 조커의 광기 어린 행각에 도시는 혼란에 빠진다  조커는 배트맨이 가면을 벗고 정체를 밝 지 않으면 멈추지 않겠다며 점점 배트맨을 조여온다  한편  배트맨은 낮엔 기업의 회장으로  밤에는 가면을 쓴 배트맨으로 밤과 낮의 정체가 다른 자신과 달리 법을 통해 도시를 구원하는 하비 덴트야말로 진정한 영웅이 아닐까 생각하게 된다  밤의 기사  그 전설의 서막이 열린다  조커를 막기 위해 직접 나서 영원  존재를 감춘 밤의 기사가 될 것인가  하비 덴트에게 모든 걸 맡기고 이제 가면을 벗고 이중 생활의 막을 내릴 것인가  갈림길에 선 그는 행동에 나서야만 하는데  사상 최강  운명을 건 대결은 이제부터 시작이다 ,action
8,어벤져스: 에이지 오브 울트론(패키지상품 : 더빙판 + 부가영상 추가증정),쉴드의 숙적  드라는 연구를 통해 새로운 능력자 막시모프 남매를 탄생시키고   드라의 기지를 공격하는 도중 토니 스타크는 완다 막시모프의 초능력으로 인해 자신이 가장 두려워하는 미래를 보게 된다  이에  뉴욕전쟁  때와 같은 사태가 벌어지지 않도록 스타크는 배너 박사와 함께 지구를 지킬 최강의 인공지능 울트론을 탄생시키게 되지만  울트론은 예상과 다르게 지배를 벗어나 폭주하기 시작하는데   ,action
9,NULL,NULL,action
10,해리 포터와 혼혈 왕자(6편),어둠의 세력이 더욱 강력해져 머글 세계와 호그와트까지 위협해온다  위험한 기운을 감지한 덤블도어 교수는 다가올 전투에 대비하기 위해 해리 포터와 함께 대장정의 길을 나선다  볼드모트를 물리칠 수 있는 유일한 단서이자 그의 영혼을 나누어 놓은  개의 호크룩스를 파괴하는 미션을 수행해야만 하는 것  또한 덤블도어 교수는 호크룩스를 찾는 기억여행에 결정적 도움을 줄 슬러그혼 교수를 호그와트로 초청한다  한편 학교에서는 계속된 수업과 함께 로맨스의 기운도 무르익는다  해리는 자신도 모르게 지니에게 점점 끌리게 되고  새로운 여자 친구가 생긴 론에게 헤르미온느는 묘한 질투심을 느끼는데    남겨진 결전을 위한 최후의 미션  볼드모트와 해리 포터에 얽  치명적인 비밀  선택된 자만이 통과할 수 있는 대단원을 향한 본격적인 대결이 시작된다 ,action
11,플라이트 93,무역센터  펜타곤에 연쇄 충돌한  대의 민항기  세계를 발칵 뒤집은      테러사건  그러나 그날  납치된 비행기는 총  대였다    따뜻하고 평온한 분위기가 감도는 뉴저지 공항  새로운 국장의 취임으로 화기애애한 분위기의 미국연방항공국  민항기들을 인도하고 진로를 체크하느라 바쁜 아침을 보내고 있는 관제센터  편안한 하루의 시작을 알리듯 고요한  월   일 오전  그러나 갑작스레 항로를 이탈하기 시작한 민항기로 평온에 금이 가기 시작한다  보스턴에서    로 향하는 아메리칸 항공       편이 예고 없이 항로를 이탈하고  관제센터가 교신을 시도하지만 아무런 응답이 없다  그 순간 들려온 이국적인 말투의 짧은 교신   우리는 비행기들을 납치했다   다급해진 관제센터는 테러집단에게 납치된  비행기들 을 찾아야만 한다    영공에 떠있는 민항기는 총     대  군과 항공국은 납치된 것으로 추정되는 민항기들을 찾기 시작한다  뉴욕 근처에서 갑자기 레이더망에서 사라진       편  그 시각     에서는 뉴욕의 상징인 세계무역센터에 비행기가 충돌했다는 충격적인 뉴스가 보도된다  세계무역센터에서 불길과 연기가 치솟고 있는 가운데 또 다른 민항기가 재차 충돌하고  이어 국방부 펜타곤에도 민항기가 추락한다  미국 전역은 아수라장으로 변하고  뉴욕은 극도의 공포로 마비된다  같은 시각  뉴저지에서 샌프란시스코를 향하고 있는  유나이티드   편의 승객들은 지상에서 무슨 일이 일어났는지도 모른 채 평온한 비행을 하고 있다  하지만 승객으로 위장한 테러집단들이 행동을 개시  비행기를 장악하자 공포에 휩싸이고  가족들에게 마지막 목소리를 전하며 눈물을 흘리던 승객들은 오직 살기 위해 테러집단에 맞설 준비를 시작하는데     월   일  네번째 비행기에서는 과연 무슨 일이 벌어졌던 것인가  충격과 아픔으로 가득한 숨겨진 그 날의 비극이 재현된다   유나이티드   의 공중납치만이 목표에 이루지 못하고 오전   시  분에 펜실바니아의 생크빌 근처에 추락했다  생존자는 없었다  군 사령부는 추락 후  분까지 유나이티드   이 공중납치 된 걸 몰랐고  가장 가까운 전투기는    마일 떨어져 있었다  오전   시   분에 대통령은 공중납치 비행기에 대한 교전 허가를 내렸다  우발적인 격추를 피하고자  군 사령부는 출격 중인 조종사들에게 명령을 전달하지 않았다  오후   시  분에 미국내 모든 국내 항공기가 착륙을 당했다  전례 없는 군 전파교신 속에 미국 영공은 추후 통지가 있을 때까지 봉쇄되었다      년  월   일 생명을 잃은 모든 사람들을 추모하며  ,action
12,반지의 제왕: 왕의 귀환_(확장판)(확장판 FHD),절대반지의 영원한 파괴를 위해   프로도 와 그의 친구들  엘프족  레골라스   난쟁이족  김리   두 명의 인간전사  아라곤 과  보로미르   그리고 마법사  간달프    등   명으로 이뤄진  반지원정대 가  불의 산 을 향하게 되고  그들은  사우론 의 사악한 세력에 맞서려 한다  그러나 이들은 다시 뿔뿔이 흩어지게 되고  암흑세계의 두 개의 탑을 통합하여 그 세력을 확장하고 있는  사우론 은 서서  중간대륙을 거대한 전쟁의 소용돌이로 몰아가며  로한왕국 을 향해 진격을 시작한다  이에  아라곤 은 자유종족들을 통합하여  사우론 에게 정면 대항하게 되는데       사우론 의 군대는 인간 종족을 멸망시키기 위해  마지막으로 곤도르 왕국의 수도인  미나스 티리스 를 공격한다  과거의 위대함은 사라진 채 그 명맥만을 유지해오던 곤도르 왕국은 이제 그 어느 때보다도 왕이 절실하다  하지만   아라곤 이 왕위를 계승하여 자신의 운명을 마주 할 수 있을 것인가  전투에 앞서   간달프 는 필사적으로 흩어진 곤도르의 병력을 수습하고   세오덴 은 로한의 전사들을 규합한다  용기와 충성심에 불타 있기는 하지만  인간의 군대는 곤도르로 빽빽이 몰려드는 적들에게 적수가 되지 못한다  승리의 순간에도 희생이 따르고  많은 이들을 잃어가면서도  원정대는  사우론 의 주의를 딴 곳으로 돌려  프로도 가 임무를 달성할 수 있게 돕는다는 하나의 목표 아래  그들 생애 가장 큰 전투를 치러 나간다  한편   프로도 는 위험한 적의 땅을 가로질러 가면서  반지가 끊임없이 그의 의지와 인간성을 시험하자 점점 더  샘 과  골룸 에게 의지하게 되는데 ,action
13,NULL,NULL,action
14,아일라,    년 한국전쟁에 파병된  슐레이만 은 칠흑 같은 어둠 속 홀로 남겨진  살 소녀를 발견한다  전쟁과 부모를 잃은 충격 속에 말을 잃은 소녀   슐레이만 은 소녀에게 터키어로  달 이라는 뜻의  아일라 라는 이름을 지어주고 함께 부대로 향한다  서로에게 무엇과도 바꿀 수 없는 가장 소중한 존재가 된 두 사람  그러나 행복도 잠시   슐레이만 은 종전과 함께 고국으로 돌아가라는 명령을 받게 되고   아일라 를 끝까지 지켜내기 위해 모두의 반대 속에 자신의 선택을 감행하게 되는데   전 세계를 감동시킨 위대한 이야기가 찾아온다 ,action
15,아이언맨 3(자막판), 어벤져스  뉴욕 사건의 트라우마로 인해 영웅으로서의 삶에 회의를 느끼는 토니 스타크 로버트 다우니 주니어    그가 혼란을 겪는 사이 최악의 테러리스트 만다린 벤 킹슬리 을 내세운 익스트리미스 집단    이 스타크 저택에 공격을 퍼붓는다  이 공격으로 그에게 남은 건 망가진 수트 한벌 뿐   모든 것을 잃어버린 그는 다시 테러의 위험으로부터 세계와 사랑하는 여인 기네스 팰트로 를 지켜내야 하는 동시에 머릿속을 떠나지 않던 한가지 물음의 해답도 찾아야만 한다   과연 그가 아이언맨인가  수트가 아이언맨인가 ,action
16,캐리비안의 해적 - 블랙 펄의 저주,매력 넘치는 해적 캡틴 잭 스패로우 죠니 뎁 분 에게 수정처럼 맑고 투명한 카리브 해는 어드벤처와 미스터리로 가득찬 세계이다  그는 현재 해적 생활을 그만두고 한적한 삶을 살고 있다  그런 그의 인생이 사악한 해적 캡틴 바르보사 제프리 러쉬 분 에 의해 위기를 맞는다  캡틴 바르보사가 잭 스패로우의 해적선  블랙펄              을 훔친 다음  포트 로열            을 공격하여 총독 조나단 프라이스 분 의 아름다운 딸 엘리자베스 스완 카이라 나이틀리 분 을 납치해 갔기 때문이다  평민 신분이지만 엘리자베스와 어린 시절 친구인 윌 터너 올란도 블룸 분 는 잭 스패로우와 손을 잡고 영국 함대 중에서도 가장 빠른 배인        인터셉터              호를 지휘하여 엘리자베스도 구하고 블랙펄 호도 되찾으려는 작전에 돌입한다  그러나 두 사람과 그들의 보잘 것 없는 부하들은 엘리자베스의 약혼자이자 호방한 제독인 노링턴 잭 데이븐포트 과 그가 지휘하는        돈트리스            호의 추격을 받게 된다  한편 캡틴 바르보사가 약탈한  저주받은  보물들로 인해 그 자신은 물론 부하들을 영원  죽을 수 없도록 저주를 받는다  그들 해적들은 월광을 받으면 살아있는 해골로 변해버린다  그들에게 내려진 저주는 그들이 훔친 보물을 하나도 빠짐없이 원래 있던 그대로 되돌려놓아야만 풀릴 수 있다  그런 사실을 모르는 노링톤 제독과 그의 군대  캡틴 잭 스패로우와 윌 터너는 인터셉터 호와 돈트리스 호를 타고 바르보사를 비롯한 초자연적 신비를 가진 해적들과 대적하기 위해 이슬라 데무에르타 죽음의 섬                 로 달려간다  과연 캡틴 잭 스패로우는 바르보사에게 복수하고 블랙펄 호를 되찾을 수 있을까  바르보사와 그의 부하들로 하여금 영원  해골로 살도록 만든 무시무시한 저주는 풀릴 수 있을 것인가  총독의 딸 엘리자베스를 구조하려고 떠난 대원들을 뒤쫓는 영국 해군은 먼저 엘리자베스를 구하겠다는 목적을 달성할 수 있을 것인가  주인공 영웅들은 초자연적 해골인간 해적들을 무찌르려면 과연 어떻게 상대해야 하는 것일까 ,action
17,디지몬 어드벤처 라스트 에볼루션 : 인연,디지몬 어드벤처   주년 기념 극장판   우리들의 끈끈한  인연 을 보여주자    대학생 타이치와 다른  선택받은 아이들 은 모두 각자의 자리에서 저마다의 삶을 살아가고 있다  그러던 어느 날  전 세계의  선택받은 아이들 에게 의문의 사건이 일어나기 시작한다  에오스몬이라 불리는 디지몬에 그 원인이 있음을 알게 된 타이치 일동은 에오스몬을 제압하려 하지만 이내 아구몬을 비롯한 디지몬들의 진화에 문제가 발생하는데  세상의 이변에서 다시 한 번 친구들을 구할 수 있을까 ,action
18,라이온 킹 (2019)(자막+더빙+부가영상+싱어롱 자막/더빙+코멘터리 제공),어린 사자  심바 는 프라이드 랜드의 왕인 아버지  무파사 를 야심과 욕망이 가득한 삼촌  스카 의 음모로 잃고 왕국에서도 쫓겨난다   기억해라  네가 누군지   아버지의 죽음에 대한 죄책감에 시달리던  심바 는 의욕 충만한 친구들  품바 와  티몬 의 도움으로 희망을 되찾는다  어느 날 우연  옛 친구  날라 를 만난  심바 는 과거를 마주할 용기를 얻고  진정한 자신의 모습을 찾아 위대하고도 험난한 도전을 떠나게 되는데 ,action
19,NULL,NULL,action
20,"해리 포터와 죽음의 성물 - 2부(7-2편, 자막판)",모든 것을 끝낼 최후의 전투  판타지의 아름다운 역사가 드디어 마침표를 찍는다   덤블도어 교장이 남긴  죽음의 성물 의 단서를 쫓던 해리 포터는 볼드모트가 그토록 찾아 다닌 절대적인  을 가진 지팡이의 비밀을 통해 드디어 마지막 퍼즐을 완성한다  볼드모트의 영혼이 담긴 다섯 번째  호크룩스 를 찾기 위해 마법학교 호그와트로 돌아온 해리와 친구들은 그들을 잡으려는 보안마법에 걸려 위기를 맞지만 덤블도어의 동생인 에버포스의 도움으로 벗어난다  그리고 그에게서 덤블도어와 어둠의 마법사 그린델왈드에 관한 놀라운 과거에 대해 알게 된다  한편  볼드모트는 해리에 의해 호크룩스들이 파괴되었음을 느끼고 호그와트로 향한다  해리를 주축으로 한 불사조 기사단과 죽음을 먹는 자들 간의 마법전투가 벌어지고 여기에 거대거미 아크로맨투라와 거인족 등 마법 생물들이 볼드모트 편으로 가세하면서 호그와트는 거대한 전쟁터로 변한다  전쟁의 틈에서 해리는 덤블도어를 죽인 스네이프의 엄청난 비밀과 볼드모트를 죽일 마지막 호크룩스에 대한 단서를 알게 되는데   ,action
21,매드맥스: 분노의 도로,핵전쟁으로 멸망한   세기  얼마 남지 않은 물과 기름을 차지한 독재자 임모탄 조가 살아남은 인류를 지배한다  한편  아내와 딸을 잃고 살아남기 위해 사막을 떠돌던 맥스 톰 하디 는 임모탄의 부하들에게 납치되어 노예로 끌려가고  폭정에 반발한 사령관 퓨리오사 샤를리즈 테론 는 인류 생존의 열쇠를 쥔 임모탄의 여인들을 탈취해 분노의 도로로 폭주한다  이에 임모탄의 전사들과 신인류 눅스 니콜라스 홀트 는 맥스를 이끌고 퓨리오사의 뒤를 쫓는데    끝내주는 날  끝내주는 액션이 폭렬한다 ,action
22,보리밭을 흔드는 바람,    년 아일랜드  젊은 의사 데이미언은 런던의 병원에 일자리를 얻지만  아일랜드인에 대한 영국 군대의 횡포를 목격하고 형 테디와 연인 시네이드 그리고 친구들과 함께 아일랜드의 독립운동에 뛰어든다  그리고 마침내 영국과 평화조약을 맺게 된 아일랜드  그러나 일부 지역 자치만 허용한다는 영국의 발표에 데이미언은 형 테디와 심한 대립 관계에 놓이게 되고 연인 시네이드와의 애정 관계마저 이상이 생기는데  조국의 자유를 위해 형과 사랑하는 연인과의 위기를 맞게 된 데이미언의 엇갈린 운명과 선택이 시작되는데 ,action
23,스파이,현장 요원들의 임무 수행을 돕는    의 내근 요원 수잔 쿠퍼 멜리사 맥카시   외모  임무 수행 등 완벽한 최고의 요원 브래들리 파인 주드 로 의 파트너로 임무를 수행을 하던 중  핵무기 밀거래를 추진하는 마피아들에게     현장 요원들의 신분이 모두 노출되는 사건이 발생한다  마피아들이 모르는 내근 요원 수잔은    의 최대 위기를 극복하고 핵무기의 밀거래를 막기 위해 현장에 투입된다  그러나  그녀를 못 믿는  자칭  최고의 요원 릭 포드 제이슨 스타뎀 가 그녀와 별개로 임무를 수행하면서 그녀의 미션은 위기에 직면하게 되는데 ,action
24,"해리 포터와 죽음의 성물 - 1부(7-1편, 자막판)",덤블도어 교장의 죽음 이후  마법부는 죽음을 먹는 자들에게 점령당하고 호그와트는 위기에 빠진다  이에 해리와 론  헤르미온느는 볼드모트를 물리칠 수 있는 유일한 단서이자 그의 영혼이 담긴  성물  호크룩스를 찾기 위한 위험한 여정에 나선다  그러나 영혼이 연결되어 있는 볼드모트와 해리  볼드모트를 파괴하면 해리의 목숨 또한 위태로워질지 모른다  죽느냐 죽이느냐  이제 그 마지막 대결은 극한을 향해 치닫는데 ,action
