,title,synopsis,category
0,바이센테니얼 맨,    년 뉴저지  리처드는 가족을 깜짝 놀라게 해줄 선물로 가전제품을 구입한다  설거지  청소  요리  정원손질 등 모든 집안 일을 하나로 해결할 수 있는 첨단 가전제품  게다가 아이들과 함께 놀아줄 장난감으로도 쓰일 수 있는 기적 같은 가전제품은 바로 가사로봇  값비싼 선물을 받은 가족들의 표정은 놀라움 반  낯설음 반  로봇 앤드류        의 애칭 는 리처드를 주인님으로  자아도취에 빠진 그의 아내를 마님으로 부르며 공손하고 부지런한 가사 로봇의 소임을 다한다  그러나 기계답지 않은 이상한 질문들을 던져 때론 가족들을 곤란하게  또 때론 요절복통하게 만드는 등 점차 그의 요상스런 모습이 드러나기 시작하는데  문제의 발단은 조립과정 중의 사소한 실수에서 비롯됐다  리처드에게 배달될 로봇        를 만들던 엔지니어가 샌드위치를 먹다가 마요네즈 한 방울을 로봇의 복잡한 회로 위에다 떨어뜨린 것이다  이로 인해 로봇의 신경계에 엄청난 사건이 생겨났다  바로 로봇에게는  있을 수도 없고 있어서도 안되는  지능과 호기심을 지니게 된 것  어느 날 앤드류가 만든 나무 조각상을 보고 로봇의 인간적 재능을 발견한 리처드는 그를 마치 친아들처럼 여기게 된다  그리고 로봇 제조회사에서 그를 불량품으로 간주  연구용으로 분해하기 위해 리처드에게 끊임없이 반환을 요구하지만 오 려 앤드류를 보호할 뿐만 아니라 계좌를 만들어 앤드류가 작품을 팔아 얻는 수익을 적립할 수 있게 해준다  시간이 흘러  어린 소녀에서 아름다운 여인으로 성장한 작은 아가씨  그런데 점차 인간의 감정을 어렴풋이 이해하기 시작한 앤드류의 강철 심장에도 수줍은 설레임이 찾아온다  그러나 미처 깨닫기도 전에 작은 아가씨는 훌쩍 결혼을 해버리고  아버지처럼 아껴주던 리처드가 숨을 거둔 후 앤드류는 자신을 이해해줄 자신과 같은 불량로봇을 찾아 기나긴 여행에 오른다  수십 년 후  천신만고의 모험 끝에 집으로 돌아오지만 이제는 할머니가 되어버린 작은 아가씨  그러나 그녀를 쏙 빼다박은 듯한 손녀 포샤를 만나자마자 그는 이제 거부할 수 없는 사랑의 열병을 앓는다  인간이 되고 싶은 간절한 소망으로 수술실에 눕는 앤드류  인공피부를 입 고 ,sf_fantasy
1,늑대소년,요양 차 가족들과 한적한 마을로 이사 간 소녀는 어둠 속에 몸을 숨긴 의문의 늑대소년을 발견한다  야생의 눈빛으로 사람 같지 않은 행동을 보이는 소년에게 왠지 마음이 쓰이는 소녀는 먹을 것을 보고 기다리는 법  옷 입는 법  글을 읽고 쓰는 법 등 소년에게 세상에서 살아가는 방법들을 하나씩 가르쳐준다  태어나 처음으로 자신을 향해 손을 내밀어준 소녀에게 애틋한 감정이 싹트는 소년  그러던 어느 날 예기치 못한 위기 속에 소년의 숨겨져 있던 위험한 본성이 드러나고  소년은 순식간에 마을 사람들에게 두려움과 공포의 대상이 되어버리는데  ,sf_fantasy
2,유체이탈자, 누가 진짜 나인지 모르겠어요  교통사고 현장에서 눈을 뜬 한 남자  거울에 비친 낯선 얼굴과 이름  자신이 누구인지 기억이 나지 않는다    또 바뀌었어  낮에도 바뀌더니 밤에도 또  잠시 후  또 다른 사람의 몸에서 깨어난 남자  그는   시간마다 몸이 바뀐다는 사실을 깨닫게 되고  자신을 둘러싼 사람들 사이의 연결고리를 찾기 시작한다  그가   시간마다 몸이 바뀌었던 사람들  가는 곳마다 나타나는 의문의 여자까지  그리고  이들이 쫓고 있는 국가정보요원  강이안     이제 알게 됐어  내가 뭘 해야 되는지  모두가 혈안이 되어 쫓고 있는  강이안 이 바로 자신임을 직감한 남자  자신을 찾기 위한 사투를 시작하는데   진짜 나를 찾기 위한 본능적 액션이 시작된다 ,sf_fantasy
3,슈렉 포에버,슈렉이 아름다운 공주 피오나와 겁나먼 왕국을 구해낸 이후  그들도 오래오래 행복하게 살았   더라면 참 좋았을텐데  과연 슈렉에게도 모두가 바라던 해피엔딩이 올까  한 가정의 평범한 아빠와 남편으로 반복되는 일상에 따분함을 느끼던 슈렉은 마을 사람들에게 겁을 주고  진흙 목욕도 실컷 하던 자유로웠던 시절을 꿈꾸게 된다   단 하루라도 자유로워진다면 죽어도 한이 없겠어 라며  단 하루의 일탈을 꿈꾸던 슈렉은  겁나먼 세상 을 차지하려는 악당 럼펠의 그럴싸한 계략에 속아넘어가  완전 딴판 겁나먼 세상 에 떨어지고 만다  완전 딴판으로 바뀌어버린 세상에서 절친 동키는 슈렉을 미친 괴물 취급하며 줄행랑 치고  단 하나의 사랑 피오나는 하이킥을 날리고  장화신은 고양이는 더 이상 장화를 신지 않는  라인의 고양이가 되어 있다  친구들과 왕국  그리고 하나뿐인 진실한 사랑을 되찾기 위한 슈렉의 마지막 이야기가 시작된다 ,sf_fantasy
4,NULL,NULL,sf_fantasy
5,엑스맨 탄생: 울버린,어린 시절 눈앞에서 아버지를 잃은 상처  그리고 사랑하는 연인까지 지켜내지 못했던 과거의 기억은 울버린 휴 잭맨 분 을 더욱 강하게 만든다  울버린을 포함해 스트라이커 대령의 지휘하에 전세계에서 선발된 강력한 돌연변이들이 스페셜 팀을 구성하고  울버린은 인간이 참아낼 수 있는 고통의 한계치를 넘는 지옥 같은 프로젝트를 통해  웨폰   로 다시 태어난다  이제 울버린은 복수를 위해 스페셜 팀을 탈퇴하지만  에이전트 제로 다니엘 헤니 분 가 울버린을 추격하는데 ,sf_fantasy
6,맨 인 블랙 3,알 수 없는 사건으로 현실이 뒤바뀌고 외계인의 공격으로 위험에 빠진 지구  게다가     소속 베테랑 요원  케이 토미 리 존스  는 하룻밤 사이에 감쪽같이 사라진다  모든 것을 원래대로 되돌릴 수 있는 사건의 열쇠를 쥐고 있는 유일한 사람은  케이 뿐인데   사라진 파트너를 찾고 그동안 감춰졌던 우주의 비밀을 캐내기 위해  제이 윌 스미스  요원은 과거로 위험한 시간여행을 떠나게 되고  그 곳에서 심하게 젊은     케이 조쉬 브롤린  와 마주하게 된다   이제 이 둘은   시간 안에 우주의 비밀을 풀고 현재로 돌아와야만 하는     사상 최고의 미션에 도전하게 되는데 ,sf_fantasy
7,이퀄스,당신도 느껴지나요   모든 감정이 통제되고  사랑만이 유일한 범죄가 된 감정통제구역  어느 날 동료의 죽음을 목격한 사일러스 니콜라스 홀트 는 현장에서 니아 크리스틴 스튜어트 의 미묘한 표정 변화를 보고 그녀가 감정보균자임을 알게 된다   이 감정을 기억해  니아를 관찰하던 사일러스는 생전 처음으로 낯선 감정을 느끼고 감정 억제 치료를 받지만  니아를 향한 마음은 점점 커져만 간다  처음으로 사랑이란 감정을 느끼게 된 사일러스와 니아는 서로의 마음을 확인하고 사랑을 나누지만 뜻하지 않은 위기에 처한다  결국 두 사람은 사랑을 지키기 위한 탈출을 결심하는데   통제할 수 없는 사랑이 시작된다 ,sf_fantasy
8,하늘의 푸르름을 아는 사람이여,산으로 둘러 싸인 시골 마을  그곳엔 꿈을 위해 쉼 없이 달려가는 자매  아오이    아카네  그리고  신노 가 있었다    신노 는 함께 도쿄 상경을 약속했던  아카네 를 찾아갔지만   아카네 는 혼자 남을 동생  아오이 로 인해 꿈을 접는다     년 후  고등학생이 된  아오이 는 언니에 대한 죄책감과 자신의 꿈 사이에서 방황하고 두 사람의 관계는 점점 멀어져 간다   그러던 어느 날  두 사람 앞에 다시는 만날 수 없을 것 같았던  그 가 전혀 다른 모습의 두 사람이 되어 동시에 나타나게 되는데    어째서 내게 다시 찾아온 거야    과거와 현재를 잇는  신비로운 두 번째 첫사랑이 시작된다 ,sf_fantasy
9,NULL,NULL,sf_fantasy
10,스타 트렉: 더 비기닝,우주를 항해하던 거대 함선     켈빈호 앞에 정체불명의 함선이 나타나 켈빈호를 공격하고  이 과정에서 켈빈호는 함장을 잃게 된다  목숨을 잃은 함장을 대신해 켈빈호를 이끌게 된  커크 는 자신의 목숨을 희생해    명의 선원들을 구해낸다  켈빈호에 비극이 닥친 긴박한 혼돈의 그날 태어난  커크 의 아들  제임스 커크   지도자의 운명을 안고 태어났으나  자신의 갈 길을 깨닫지 못한 채 방황하던 젊은 청년 커크는 파이크 함장의 조언을 듣고 스타플릿에 입대하여 아버지의 뒤를 잇는다  아버지를 따라 스타플릿의 대원이 되기 위해 스타플릿 아카데미에서 훈련을 받는  커크   그는 거기서 자신과는 정반대로 냉철하고 이성적인 벌칸족  스팍 을 만나게 되고  끊임없는 부딪  속에서 두 라이벌  커크 와  스팍 은 경쟁을 계속하게 된다  그러는 도중에 벌칸으로 부터 구조요청 신호가 오고  스타플릿 아카데미의 학생들은 각자 배정받은 함선에 승선하여 벌칸으로 향한다  벌칸으로 향하는 도중  커크는 아버지가 겪었던 일과 같은 현상이 일어난 것을 보고  생각한 것 보다 위험한 상황임을 눈치채고  엔터프라이즈호는 인류를 위해서 일어나지도 않은 일에 대한  복수 를 하겠다는 네로와 맞써 싸우게 되는데   ,sf_fantasy
11,스티브 지소와의 해저 생활,스티브 지소는 해양학자 겸 다큐멘터리 영화감독이다  지금까지  편의 해양 다큐멘터리를 만들었으며  마지막  편을 찍던 도중 지금껏 한번도 보지 못했던 괴물 상어에게 절친한 동료를 잃었다  그러나  이 중요한 장면은 그가 카메라를 놓치는 바람에 덩달아 놓치고 말았다  스티브는 이 괴물 상어의 몸에 표범무늬가 있었다며 이를 표범상어라 이름짓고  앞으로 제작할  편에서는 그 상어를 찾아내 친구의 복수를 하고야 말겠다고 다짐한다  하지만  그의 말을 믿어주는 이는 아무도 없다  예전에는 꽤 괜찮았던 시절이 있었다  사람들의 관심도 많았고  언론도 호의적이었다  하지만  이제는 아무도 그의 영화에 돈을 대려고 하지 않는다  이 때 네드 플린턴이라는 청년이 등장한다  얼마전 암으로 사망한 그의 어머니 말에 따르면 스티브 지소가 네드의 생물학적 아버지라고 한다  스티브 지소는 생전 처음 본 청년이 자신의 아들이란 사실에 얼떨떨하지만 그는 네드에게 지소 팀에 합류할 것을 권한다  그리고  네드가 유산을 다큐멘터리에 투자한 덕분에 자금 모집은 수월하게 해결되고  마침내 제 편을 위한 항해가 시작되는데  ,sf_fantasy
12,"어쩌다 공주, 닭냥이 왕자를 부탁해!",어쩌다 공주가 된 필  닭냥이가 된 왕자님을 구해야 한다  왕좌를 노리는 마법사 트리스탄을 막기 위해 필은 엉망진창 원정대를 이끌고 마법의 저주가 걸린 숲으로 모험을 떠나는데     어쩌다 시작된 필 공주와 일곱 기사들의 대환장 판타지 어드벤처 ,sf_fantasy
13,비바리움,함께 살 곳을 찾던  톰 과  젬마  중개인으로부터  욘더 라는 독특한 마을의  호 집을 소개받는다   똑같은 모양의 주택들이 즐비한 곳에서 알 수 없는 기묘함에 사로잡  순간  중개인은 사라져 버린다   어떤 방향으로 향해도 집 앞에 다다르는 이곳에서 우리의 선택은 없다  오직 살아갈 뿐    가장 완벽한 안식처가 되어줄 거에요  영원  ,sf_fantasy
14,백 투 더 퓨쳐 3,    년에 남겨진 마티는 박사가     년으로 갔음을 알게 된다  그의 흔적을 찾아보니 드로리안은 폐광 속에 숨겨져 있었다  그러나 그가 비프 토마스    윌슨 분 의 선조인 매드독 태넌 토마스    윌슨 분 의 총에 맞아 죽었다고 쓰여진 비석을 발견하고는  박사를 구출하기 위해 위험한 시간 여행을 감행한다      년의 서부에 도착한 마티는 드로리안의 고장으로  맥플라이 가문의 선조인 세이머스 마이클    폭스 분 와 매기 리 톰슨 분  부부의 도움을 받게 되고 박사도 만난다  고장 난 드로리안으로 시간 여행에 필요한 속도를 얻기위해서 기관차를 이용하려는 위험한 계획이 세워지지만  박사는 여교사인 클라라 매리 스틴버겐 분 와 사랑에 빠져서 그 시대에 남고 싶어하고 원래 박사가 당하게 되어있던 매드독 태넌과의 결투를 마티가 떠맡게되는 사건이 발생한다  마티는 기지를 발휘해 매드독과의 결투에서 이기고  기관차는 질주하기 시작한다  박사는 자기를 쫓아온 클라라와 남기로 결심을 하고  마티는 그들과 작별 인사를 한 후 무사      년으로 돌아온다  드로리안은 완전  파괴되고  인간적으로 성숙해진 마티 앞에 새로운 타임머신을 가지고 박사가 다시 나타난다  그리고 말한다   미래는 백지야  자네가 직접 만드는 것이라네  멋진 인생을  ,sf_fantasy
15,NULL,NULL,sf_fantasy
16,토탈 리콜,평범한 일상을 보내던  더글라스 퀘이드 콜린 파렐  는 매일 아침 의미를 알수 없는 악몽에서 깨어나며 괴로워한다  그러던 어느날  완벽한 기억을 심어서 고객이 원하는 환상을 현실로 바꿔준다는  리콜사 를 방문해 자신의 꿈을 체험해 보기로 한다  하지만 기억을 심는 과정에서 의문의 사고가 일어나고 그는 정신을 차릴 틈도 없이 전세계의 운명이 걸린 거대한 음모 속에 휘말리게 된다  졸지에 스파이로 몰리게 된 퀘이드  거대한 세력을 상대로 숨막 는 추격전이 시작되고  심지어 사랑하는 아내  로리 케이트 베킨세일  마저 자신을 죽이려 한다  한편  갑자기 자신 앞에 나타난 의문의 여인  멜리나 제시카 비엘  는 그에게 적에 맞서 싸우자 제안하고  현실과 심어진 기억의 경계에서 퀘이드는 점점 더 혼란스러워하는데 ,sf_fantasy
17,임신한 나무와 도깨비, 마침내 죽음이 찾아왔다   한 번 들어오면 빼도 박도 못하고 죽어야 나갈 수 있는 곳  뺏벌   그곳엔 누구보다 죽음을 많이 본 여자  인순이 있다   저승사자들은 뺏벌의 유령들을 데려가기 위한 이야기를 만들어내고 인순은 그들에게 맞서기 위해 자신만의 이야기를 펼치기 시작한다 ,sf_fantasy
18,NULL,NULL,sf_fantasy
19,배틀타임트랩: 초시공간여행,고고학 교수  하퍼 는  청춘의 샘 을 조사하던 중  중요한 단서가 되는 동굴을 발견한다  더 자세한 연구를 위해 홀로 동굴에 들어간  하퍼   한편  그의 제자들은 위험하니까 따라오지 말라는 말을 무시한 채 그의 뒤를 쫓아간다  그런데 동굴에 있어야 할  하퍼 는 온 데 간 데 찾을 수가 없고  설상가상으로 일행 중 한 명이 다치는 사고까지 발생한다  무언가 잘못됐음을 느낀 제자들은 뒤늦게 밖으로 나가려고 하지만  동굴 안과 밖의 시간은 전혀 다르게 흘러가고 있는데 ,sf_fantasy
20,나미야 잡화점의 기적: 또 하나의 이야기,어느 날 몸을 피해 잡화점에 숨어 들어온  인조 좀도둑은 우연  우체통을 통해 편지를 받게 된다  장난스레 편지에 답장을 하던 이들은 그 편지가 과거에서 보낸 편지라는 사실을 알게 되는데  첫 번째 편지  가수의 꿈을 이루기 위해 도시로 나갔지만 가수로서 재능이 보이지 않아 고민하는  시골 뮤지션 이 보내는 편지 두 번째 편지  마이클 잭슨 같은 스타를 꿈꾸지만 아버지의 사업 실패와 순간의 실수 때문에 가족과 헤어져 보육원에서 자라난  하오보 가 보내는 편지 세 번째 편지  가족을 부양하기 위해 큰돈을 벌고 싶은  길 잃은 강아지 가 보내는 편지 아무에게도 말하지 못했던 모두의 고민이 모여드는  나미야 잡화점  하룻밤 동안 펼쳐지는 가슴 따뜻한 이야기가 당신을 찾아갑니다 ,sf_fantasy
21,거꾸로 된 파테마,멀지 않은 미래  끝없이 이어진 터널로 가득한 지하세계에 살고 있는  파테마 는 족장의 딸이자 호기심 많은   살 소녀이다  보지 못했던 세계를 경험하고 싶은  파테마 는 어느 날 접근금지지역을 탐사하던 중 공중에 떠다니는 작은 물체들과 이상한 빛으로 가득 차 있는 공간을 발견한다  그 곳을 살피던  파테마 는 천정에 서 있는 누군가에 놀라 터널 아래로 떨어지면서 중력이 반대로 되어 있는 또 다른 지상세계로 나오게 된다   파테마 는 지상세계에 살고 있던 소년  에이지 와 마주치게 되고  묘한 공감을 느끼면서 곧 친해진다  한편   에이지 가 살고 있는 지상세계를 독재하고 있는  이자무라 의 일당은 지하세계에서 온  파테마 를 쫓고   파테마 와  에이지 는 그를 피해 달아나던 중 두 개의 세계에 얽  놀라운 비밀과 맞닥뜨리게 되는데 ,sf_fantasy
22,NULL,NULL,sf_fantasy
23,짱구는 못말려 12기 - 폭풍을 부르는 석양의 떡잎마을 방범대,술래잡기를 하던 짱구와 친구들은 낡은 극장으로 들어간다  그런데 짱구가 화장실에 간 사이에 친구들은 모두 사라지고 집에도 가지 않았다고 한다  짱구는 가족들과 친구들을 찾으러 극장에 갔다가 영화 속으로 빨려 들어간다  그 안에서 사라진 친구들을 만났지만 친구들은 이미 예전 기억을 잃어버린 상태다  시간이 멈추고 기억이 사라지는 곳  저스티스 시티  이 이상한 공간에서 빠져 나가려면 악당 저스티스를 물리쳐야 하는데    짱구와 친구들은 과연 저스티스를 물리치고 다시 이 세계로 돌아올 수 있을까 ,sf_fantasy
24,베놈(부가영상 제공),진실을 위해서라면 몸을 사리지 않는 정의로운 열혈 기자  에디 브록  거대 기업 라이프 파운데이션의 뒤를 쫓던 그는 이들의 사무실에 잠입했다가 실험실에서 외계 생물체  심비오트 의 기습 공격을 받게 된다    심비오트 와 공생하게 된  에디 브록 은 마침내 한층 강력한  베놈 으로 거듭나고  악한 존재만을 상대하려는  에디 브록 의 의지와 달리  베놈 은 난폭한  을 주체하지 못하는데    지배할 것인가  지배당할 것인가,sf_fantasy
25,미스터 캣,연간 수입  조  북미 최고층 빌딩의 건물주  예쁜 아내와 귀여운 딸까지 모든 걸 가진 억만장자      톰 브랜드    가족보다 일이 우선인 워커홀릭  톰 은 막내딸  레베카 의 생일선물로 고양이를 사주기 위해 펫샵으로 향하게 되고  심상치 않은 분위기 속 묘한 인상을 풍기는 가게 주인을 만난다   그런데  어느 순간 가게 주인의 수상한 주문과 함께 순식간에 암흑 속에 갇   톰  가까스로 정신을 차린 그의 입에서 나온 첫 마디는  야옹      대 략 냥 감  지금 내가    됐냥  사고뭉치 고양이  복실이 의 고군분투가 시작된다 ,sf_fantasy
26,내니 맥피 2 - 유모와 마법소동,말썽꾸러기 세 남매 뒤치다꺼리하랴  도시에서 놀러 온 조카들 돌보랴  농장 지키랴  할 일이 산더미인  미세스 그린  메기 질렌할  앞에 내니 맥피가 등장한다  평범한 유모인 줄 알았는데 알고보니 놀라운 마법사인 그녀  내니 맥피가 지팡이만 한 번 내리치면 다투던 아이들은 싸움을 멈추고  사촌과 침대를 나눠 쓰지 않으려는 아이도 코끼리와 한 침대에서 자게 된다  내니맥피의 다섯 가지 교육을 받으며 달라진 아이들은 위기의 농장을 지키기 위해 일생 일대의 환상모험을 시작하게 되는데 ,sf_fantasy
27,지구가 끝장 나는 날,왕년에 고향 마을을 주름잡던 게리와 올리버  피터  스티븐  앤디    여년 후 다시 만난 다섯 친구들은 하룻밤에   개의 술집을 순례하는 여정에 나선다  황당하게도 외계인들이 온 동네를 접수한 위기의 상황에서 그들은 이 무모한 도전에 성공할 수 있을까 ,sf_fantasy
28,수퍼맨 리턴즈, 수명이 다 된 크립톤          행성의 한 과학자가 자신의 아들을 우주선에 태워 지구로 보냈다  소년은 어느 친절한 농부 부부에 의해 성장해 지구를 지키는 위대한 수호자 수퍼맨이 되지만    천문학자들이 고향 행성을 발견했단 소식을 듣자 수퍼맨은 사라지게 된다    칼  내 아들아  인간의 손에서 컸지만 너는 그들과 다르다  인간은 위대해지길 꿈꾸며 잠재력이 있다  인도해 줄 빛이 있다면  바로 그 선한 인간들을 위해 널 보낸다    내 하나뿐인 아들을    조엘 오래 전 사라져버린 크립톤 행성에서 태어나 캔자스의 한 농장에서 성장한 수퍼맨 브랜든 루스   소년 칼은 클라크 켄트라는 새 이름으로 평범하게 성장했지만 남다른 점이 있다  보통 사람들이 상상 속에서나 해볼 수 있는 초능력의 소유자  평소에는 얌전하고 눈에 띄지 않는 클라크 켄트로 일상을 보내다가 전 세계가 그를 필요로 할 때면 영웅으로 몰래 변신하는 이중 생활을 해야 하는 수퍼맨이다  세계를 구원하던 그 수퍼맨이 갑작스레 자취를 감춘 지  년이란 시간이 흘렀다  그가 사라진 후 도시에서는 범죄가 기승을 부리고  자신의 욕망을 충족시키기 위한 수단으로 수퍼맨의 비밀을 이용하려는 렉스 루터 케빈 스페이시 가 감옥에서 풀려난다  한편  데일리 플래닛 신문사의 간판 기자이자 수퍼맨의 연인인 로이스 레인 케이트 보스워스 은 수퍼맨이 말 없이 사라진 후 새로운 인생을 살고 있다  심지어  우리는 왜 더 이상 수퍼맨을 필요로 하지 않는가  란 제목의 에세이로 퓰리처상까지 수상했다  그리고 혼자 다섯 살의 아들을 키우다 편집장 조카와 약혼까지 한 상태  그렇게 세상은 영웅을 잊어가고 있었다  그 동안 자신의 정체성을 찾기 위해 방황하던 수퍼맨은 결국 자신의 유일한 가족  양부모님이 있는 곳이자 사랑하는 로이스가 있는 곳  완벽하지는 않지만 선한 사람들이 있는 지구가 자신이 진정 있어야 할 곳이라는 것을 깨닫고 지구로 돌아온다  떠나간 사랑의 마음도 되찾아야 하고  자신의 부재를 틈 타 기승을 부리던 악당들도 소탕해야 하는 수퍼맨  수퍼맨이 돌아오자마자 렉스의 사악한 계획이 실행되려고 하는 지금  인류는 그 어느 때보다 더 절실하게 수퍼맨을 필요로 하고 있다 ,sf_fantasy
29,아더와 미니모이: 제1탄 비밀 원정대의 출정,초미니 세상에서 만나는 미니모이 원정대 보물을 찾아 떠나는 신나는 모험이 시작된다  뤽 베송 감독의 판타지 어드벤처 시리즈 쉿  뭔가 있다  호기심 많은   살 소년 아더 프레디 하이모어 는 사랑하는 할머니 미아 패로우  집이 며칠 뒤면 부동산개발업자에게 넘어갈 위기에 처한 것을 알게 된다  실종된 할아버지가 비밀의 세계에 보물을 숨겨놓았다는 주술서를 발견한 아더는     일에 한 번 열리는 마법의 문을 통과해 미니모이 왕국으로 모험을 떠난다  미니모이 국왕 로버트 드 니로 의 딸인 까칠 공주 셀레니아 마돈나 와 개구쟁이 발명가 왕자 베타 지미 펄론 를 만난 아더는 이블  으로 불리는 악당 말타자르 데이빗 보위 의 위협으로부터 왕국을 지키려는 이들과 함께 비밀원정대를 결성하고 어둠의 도시로 향하는데 ,sf_fantasy
