,title,synopsis,category
25,아이언맨 2,세계 최강의 무기업체를 이끄는    이자  타고난 매력으로 셀러브리티 못지않은 화려한 삶을 살아가던 토니 스타크  기자회견을 통해 자신이 아이언맨이라고 정체를 밝  이후  정부로부터 아이언맨 수트를 국가에 귀속시키라는 압박을 받지만 이를 거부한 채 더욱 화려하고 주목 받는 나날을 보낸다  스타크 인더스트리의 운영권까지 수석 비서였던  페퍼포츠 에게 일임하고 슈퍼 어로로서의 인기를 만끽하며 지내던 토니 스타크  하지만 그 시각  아이언맨의 수트 기술을  스타크  가문에 빼앗긴 후 쓸쓸  돌아가신 아버지의 복수를 다짐해 온  위플래시 는 수트의 원천 기술 개발에 성공  치명적인 무기를 들고 직접 토니 스타크를 찾아 나선다      모나코 그랑프리에서 직접 경주용 차에 올라선 토니 스타크 앞에 나타난 위플래시  무차별적으로 전기 채찍을 휘두르는 그의 공격에 무방비 상태였던 토니 스타크는 생명의 위협을 느끼지만  새롭게 개발한 휴대용 수트      를 이용하여 간신  위험에서 벗어난다  그리고 자신과 자신의 아버지에 대해 강한 적대감을 드러내는 그에게서 심상치 않은 위기를 직감한다  한편  이 과정을 모두 지켜본 토니 스타크의 라이벌이자 무기업자인  저스틴 해머 는 아이언맨에 필적할 만한 위플래시의 위력을 간파하고 그를 몰래 감옥에서 탈출시켜 자신과 손 잡을 것을 제안한다  위플래시를 만난 이후 좀처럼 충격에서 헤어나오지 못하던 토니 스타크는 감옥에 갇혀 있는 줄 알았던 위플래시가 저스틴 해머와 함께 있음을 알게 되고  역대 수트들을 뛰어넘는 최강의 위력을 지닌       개발에 박차를 가한다  그 사이  저스틴 해머는 새로운 군무기 발표 쇼케이스를 개최하고  그 곳에서 위플래시는 모두를 놀라게 할 작전 실행에 나서는데     줄거리    자신이 아이언맨이라고 정체를 밝  뒤 할리우드 스타 못지 않은 인기를 누리던 토니 스타크  스타크 인더스트리의 운영권을 수석 비서였던 페퍼포츠에게 일임하고 즐거운 나날을 보내던 그에게 생애 최고의 위기가 찾아온다   스타크  가문에 대한 적대감으로 가득 찬  위플래시 가 아이언맨 수트의 원천 기술인 아크 원자로 개발에 성공한 것      그랑프리에 출전하여 무방비 상태에 있던 토니 스타크에게 위협적인 공격을 가하는 위플래쉬  이에 토니 스타크는 새로 개발한 업그레이드 수트를 이용  겨우 위기를 모면한다  하지만 이 사건을 계기로 위플래시는 토니 스타크의 라이벌  저스틴 해머 와 손을 잡고 아이언맨을 공격하기 시작하고  이에 토니 스타크는 오랜 동료 제임스 로드를 위한 새로운 하이테크 수트를 제작   워 머신 으로 거듭난 그와 함께 강력해진 적들과의 본격적 대결에 나서는데  ,action
26,인디아나 존스 - 최후의 성전,    년 유타주  어려서부터 정의감과 모험심이 가득 찬  인디              리버 피닉스 분 는   세 보이스카웃 시절     년   도굴꾼이   세기경에 제작된  코로나도           십자가 를 훔치는 것을 보고 그것을 막으려 하나 아버지 헨리 박사                        숀 코넬리 분 의 무관심으로 결국 실패하고 만다  하지만 훗날 사용하게 될 그의 트레이드 마크인 중절모와 채찍을 얻게 된다  세월이 흘러 고고학자로 성장한 인디                해리슨 포드 분 는 온갖 수난을 겪으면서  레이더스 의 성궤 모험으로부터  년 후인     년 포르투칼 해안                  의 풍랑이 요란한 어느 배 위에서 다시 그 십자가를 찾아내는 집념을 보인다  십자가를 되찾은 박사는 자신이 재직 중인 바네트 대학으로 돌아오는데 몇 달만을 비워뒀던 대학 연구실엔 오래 전에 도착한 소포가 있었다  소포 중에는 아버지의 일기장이었다  고고학에 관심이 많은 학생들을 피해 겨우 창문으로 빠져나온 존슨 박사는 윌터 도노반                 줄리안 글로버 분 이라는 사람을 만난다  도노반은 자신이 앙카라 북쪽에서 발견한 반쪽짜리 신의 석판의 탁본을 보여주며 헨리 박사의 일기장을 참고로 나머지 반쪽 석판과 예수가 최후의 만찬 때 사용했다는 술잔  성배             를 찾아 달라고 부탁하는데   ,action
27,메가로돈 2,더 거대해진 메가로돈    더 강력해진 제이슨 스타뎀 지구 역사상 가장 거대한 최상위 포식자  메가로돈 과 목숨 건 사투 끝에 살아남은 다이버  조나스 는 해양 연구소의 팀원들과 함께 심해 탐사에 나서던 중 예기치 못한 사고로 해저       에 고립되고 만다  상상 초월의 위험이 도사린 그곳에서 그들이 마주하게 된 것은 더욱 거대해진  메가로돈  무리  그들 앞에 또다시 모습을 드러낸 메가로돈을 비롯해 거대한 촉수로 모든 것을 휘감는 대왕 문어  메가 옥토퍼스 와 육지와 바다를 넘나드는 육식 공룡  스내퍼 까지  더 다양하고 강력해진 고대 생물들의 무자비한 공격이 쏟아지는 가운데 강철 다이버  조나스 는 사람들을 구하기 위해 다시 한번 맨몸으로  메가로돈 과의 맞대결에 나서는데  올여름 무더위를 집어삼킬 짜릿한 대결이 시작된다 ,action
28,뮬란(패키지상품 : 더빙판 추가증정),파씨 가문의 외동딸 뮬란        밍나 웬 목소리 분   레아 살롱가 노래 분 은 자기 주장이 워낙 강해 선을 볼때마다 퇴짜를 맞는 시대를 앞선 여성이다  한편  훈족이 국경을 침략하자 뮬란의 연로한 아버지 파 조우  오순택 목소리 분 도 징집 명령을 받게되고  뮬란은 심각한 고심에 빠지게 된다  아버지의 충성심이 워낙 강해서 뮬란의 만류를 뿌리쳤고  아버지를 대신 하려해도 여자는 절대로 참전할 수 없기 때문이다  고민에 고민을 거듭하던 뮬란은 남장을 하고 전장에 참가하기로 비장한 결심을 한다  한편   파 시 가문의 조상들이 유령으로 환생하여 대책회의를 하게 되고  결국 천방지축 수호신 무슈 에디 머피 목소리 분 가 뮬란을 따라 나서게 된다  뮬란은 의지가 워낙 강한 여성이라 점점 한 사람의 병사로 성장하게 된다  한편  여자라는 사실이 들통나지 않기 위해 살얼음판 같은 나날을 보내면서도  뮬란은 자신도 모르게 용맹한 중대장 샹      왕 목소리 분   도니 오스몬드 노래 분 에게 사랑을 품게 된다  용감하게 머리를 자르고 남장을 했지만 여자의 마음은 버릴 수 없었던 것일까  그러던 중  뮬란이 속한 부대가 눈덮인 설원을 통과할 무렵  천여명이 넘는 훈족의 군대에게 추격을 당하게 되고  뮬란이 눈사태를 일으켜 훈족의 군사들을 무찌르는 기지를 발휘한다  그러나  부상당한 뮬란은 치료를 받다가 여자인 사실이 밝혀져 군령을 어긴 죄로 위기에 처하지만  중대장 샹의 도움으로 목숨을 구한다  한편  물러간 줄 알았던 훈족의 군사들은 다시 황궁으로 쳐들어와 황제까지 협박하고 나라는 다시 위기에 처하게 된다  이때 아름다운 영웅 뮬란이 다시 한번 용맹을 발휘하여 황제와 나라를 구하게 되고  황제는 수많은 백성 앞에서 뮬란을 영웅으로 대접하는데 ,action
29,캡틴 아메리카: 시빌 워(패키지상품 : 더빙판 및 부가영상증정),어벤져스    어벤져스 분열은 시작되었다   어벤져스와 관련된 사고로 부수적인 피해가 일어나자 정부는 어벤져스를 관리하고 감독하는 시스템인 일명  슈퍼 어로 등록제 를 내놓는다  어벤져스 내부는 정부의 입장을 지지하는 찬성파 팀 아이언맨 와 이전처럼 정부의 개입 없이 자유롭게 인류를 보호해야 한다는 반대파 팀 캡틴 로 나뉘어 대립하기 시작하는데   ,action
