,title,synopsis,category
22,박물관이 살아있다!,엉뚱한 사업 아이템으로 하는 일 마다 늘 실패만 하는 래리 델리 벤 스틸러 분   그를 더 이상 견뎌내지 못한 부인이 곁을 떠나자 래리는 하나 밖에 없는 아들에게만큼은 떳떳한 아버지가 되기 위해 직장을 찾아 나선다  별 볼일 없는 그에게 온 유일한 기회는  모든 사람들이 기피하는 자연사 박물관 야간 경비원  아무것도 내보내지 말라 는 선배 경비원의 기이한 충고를 들은 근무 첫 날 밤  래리는 박물관의 전시물들이 살아 움직이는 놀라운 광경을 목격한다  박물관 전시품들은 매일 밤 제멋대로 움직이며 래리를 괴롭 다  마야인들  로마의 글래디에이터들  카우보이들이 살아나 그들끼리의 전쟁을 벌이기 시작하고  네안데르탈인은 자신의 디스플레이 케이스를 불태우고  가장 포악한 공룡 티라노사우루스는 래리를 못 잡아 먹어 안달이다  이런 대혼란 속에서 래리가 상담할 상대는 왁스 모형인 루즈벨트 대통령 로빈 윌리엄스 분 뿐  아들을 위해 어떤 역경 속에서도 박물관을 무사  보호해야만 하는 래리는 첫 날 선배들에게 들었던 충고가 잊혀지지 않는다  과연 이 박물관에는 무슨 비밀이 있는 것일까 ,sf_fantasy
23,폴라 익스프레스,눈 오는 크리스마스 이브  한 소년이 잠에서 깨어 뭔가를 기다리고 있다  그것은 바로 산타의 썰매소리    과연 내가 그 소리를 들을 수 있을까   자정을  분 남겨둔 시각  갑자기 들리는 굉음에 소년은 화들짝 놀라 유리창의 성에를 닦고 밖을 내다보니 눈 앞에서 펼쳐진 건 너무나 놀라운 광경  검은색 기차가 거친 엔진소리를 내뿜으며 그의 집 앞에 멈춰서는 것이 아닌가  소년은 잠옷 차림에 슬리퍼를 신고 뛰어나간다  기차의 차장은 소년을 기다리고 있었다는 듯 말을 건넨다   탈 거니    어디로 가는 거죠   소년이 묻자 차장은 대답한다   물론 북극으로 가는 거지  이건 북극행 특급열차 폴라 익스프레스야   소년은 폴라 익스프레스를 타고 기나긴 여행길에 오른다  그리고 그 여행길에서 소년은 인생의 놀라운 신비를 발견하면서 차츰 자아를 찾게 되는데 ,sf_fantasy
24,늑대아이,평범한 여대생  하나 는 강의실에서 우연  만나게 된  그 에게 반하게 되고  곧 사랑에 빠지게 된다  하지만  그 는 평범한 사람이 아닌 늑대인간이었다  너희가 늑대아이라는 것은 모두에게 비밀이야  늑대인간과의 동화 같은 사랑 후에 남은 것은 두 아이뿐    눈 내리는 날에 태어난 누이  유키   비 내리는 날 태어난 동생  아메   두 아이에게는 커다란 비밀이 있는데    바로 흥분   하면 귀가 쫑긋  꼬리가 쏘옥  나오는 늑대아이라는 것  남들과 조금 다른 육아  남들과 살짝 다른 고민  신비로운 운명을 살아가는 남매와 특별한 두 아이를 키우는 엄마의 이야기가 시작됩니다 ,sf_fantasy
25,시간 여행자의 아내,시간 여행의 운명을 지닌 남자  헨리  혼자가 익숙해진 어느 날 아침 햇살처럼 빛나는 그녀  클레어 를 만난다  어릴 적 우연  시간 여행자를 만난 여자  클레어  그와의 만남을 기다려온 어느 날 과거를 기억하지 못하는  헨리 를 만난다  과거에도 현재에도 미래에도 당신이 있는 시간으로 돌아갈게,sf_fantasy
26,온워드: 단 하루의 기적(패키지상품 : 더빙판+부가영상+코멘터리 추가증정),마법이 사라진 세상에 살고 있는 취향과 성격 모두 정반대의 두 형제인 철든 동생  이안  톰 홀랜드 과 의욕충만 형  발리  크리스 프랫     이안 은 태어나서 얼굴도 본 적 없는 아빠를 그리워하던 중  서프라이즈 생일 선물로 아빠의 마법 지팡이를 받게 된다  그러나 실수로  아빠의 반쪽만 소환시키는 위기가 발생하는데    주어진 시간은 단 하루  두 형제는 완벽한 모습의 아빠를 찾기 위해 모험을 떠나고 마법으로 절벽을 건너고  까마귀 봉우리의  트를 따라 관문을 통과하지만 서로 다른 성격으로 인해  사사건건 부딪 게 되고  위험이 발생하는데  과연 이들은 무사  기적을 이룰 수 있을까   기적을 향한 출발  지금 당신을 만나러 갑니다 ,sf_fantasy
27,장화신은 고양이,슈렉이 뜨기 전에 내가 있었다  슈렉 뺨쳤던 장화신은 고양이의 귀환  한때는 알아주는 영웅이었지만 지금은 지명 수배자 신세인  장화신은 고양이   명예 회복의 순간만을 꿈꾸던 그에게 악명 높은 부부 악당  잭   질 과  마법의 콩 에 대한 소문이 들려온다  황금알의 비밀을 지닌 열쇠로  악당의 손에 넘어가면 세상을 위험에 빠트린다는 마법의 콩  장화신은 고양이는 잭   질로부터 마법의 콩을 빼앗기로 결심한다  하지만 마법의 콩을 손에 넣으려는 순간  갑자기 나타난 희대의 도둑  말랑손 키티  때문에 계획은 실패로 돌아간다  게다가 말랑손 키티가 어릴 적 단짝에서 지금은 둘도 없는 원수가 된  험티 덤티 와 한통속임을 알게 된 장화신은 고양이는 깊은 고민에 빠진다  그러나 마법의 콩을 혼자 훔치는 것은 절대 불가능하다는 사실을 깨달은 장화신은 고양이  결국 말랑손 키티  험티 덤티와 손을 잡고 위험천만한 모험을 시작하는데   짜릿한 인생역전을 꿈꾸는  장화신은 고양이 와 친구들의 예측불허 모험이 시작된다 ,sf_fantasy
28,브레이킹 던 part2,르네즈미를 잉태하면서 죽음의 순간까지 닿았던 벨라는 그녀를 살리기 위한 에드워드의 노력으로 마침내 뱀파이어로 다시 태어나고  제이콥이 자신의 딸 르네즈미에게  각인 되었다는 사실을 알고 충격에 빠진다  한편 르네즈미를 뱀파이어에게 위험한  불멸의 아이 라고 판단한  볼투리 가는 그녀를 제거하기 위해 군대를 모으기 시작한다  신이 허락하지 않은 인간과 뱀파이어의 사랑이 불러 온 위험천만한 전운이  컬렌 가를 감돌고 벨라와 르네즈미를 지키기 위해 전세계에 흩어져 있는 뱀파이어들을 모은 에드워드는 볼투리의 군대와 최후의 전쟁을 시작하는데    전세계가 열광하는 매혹적인 판타지 대서사의 화려한 피날레가 마침내 시작된다 ,sf_fantasy
29,"굿 다이노(패키지상품 : 더빙판 추가증정, 코멘터리+부가영상 제공)",외모  성향 뭐 하나 닮은 것이 없는 알로와 스팟 우연한 사고로 엮이게 되면서 알로의 가족을 찾아 함께 모험을 떠나게 된다   한 치 앞을 알 수 없는 여정 속 자연이 선사하는 엄청난 시련과 위대함을 맞닥뜨리게 되는데    과연 알로는 가족을 찾을 수 있을까   괜찮아  내가 안아줄게 ,sf_fantasy
