,title,synopsis,category
0,프렌치 디스패치,  세기 초 프랑스에 위치한 오래된 가상의 도시 블라제 다양한 사건의 희로애락을 담아내는 미국 매거진  프렌치 디스패치   어느 날  갑작스러운 편집장의 죽음으로 최정예 저널리스트들이 한자리에 모이고 마지막 발행본에 실을  개의 특종에 대한 이야기를 시작하는데    당신을 매료시킬 마지막 기사가 지금 공개된다 ,comedy
1,캐리비안의 해적 - 블랙 펄의 저주,매력 넘치는 해적 캡틴 잭 스패로우 죠니 뎁 분 에게 수정처럼 맑고 투명한 카리브 해는 어드벤처와 미스터리로 가득찬 세계이다  그는 현재 해적 생활을 그만두고 한적한 삶을 살고 있다  그런 그의 인생이 사악한 해적 캡틴 바르보사 제프리 러쉬 분 에 의해 위기를 맞는다  캡틴 바르보사가 잭 스패로우의 해적선  블랙펄              을 훔친 다음  포트 로열            을 공격하여 총독 조나단 프라이스 분 의 아름다운 딸 엘리자베스 스완 카이라 나이틀리 분 을 납치해 갔기 때문이다  평민 신분이지만 엘리자베스와 어린 시절 친구인 윌 터너 올란도 블룸 분 는 잭 스패로우와 손을 잡고 영국 함대 중에서도 가장 빠른 배인        인터셉터              호를 지휘하여 엘리자베스도 구하고 블랙펄 호도 되찾으려는 작전에 돌입한다  그러나 두 사람과 그들의 보잘 것 없는 부하들은 엘리자베스의 약혼자이자 호방한 제독인 노링턴 잭 데이븐포트 과 그가 지휘하는        돈트리스            호의 추격을 받게 된다  한편 캡틴 바르보사가 약탈한  저주받은  보물들로 인해 그 자신은 물론 부하들을 영원  죽을 수 없도록 저주를 받는다  그들 해적들은 월광을 받으면 살아있는 해골로 변해버린다  그들에게 내려진 저주는 그들이 훔친 보물을 하나도 빠짐없이 원래 있던 그대로 되돌려놓아야만 풀릴 수 있다  그런 사실을 모르는 노링톤 제독과 그의 군대  캡틴 잭 스패로우와 윌 터너는 인터셉터 호와 돈트리스 호를 타고 바르보사를 비롯한 초자연적 신비를 가진 해적들과 대적하기 위해 이슬라 데무에르타 죽음의 섬                 로 달려간다  과연 캡틴 잭 스패로우는 바르보사에게 복수하고 블랙펄 호를 되찾을 수 있을까  바르보사와 그의 부하들로 하여금 영원  해골로 살도록 만든 무시무시한 저주는 풀릴 수 있을 것인가  총독의 딸 엘리자베스를 구조하려고 떠난 대원들을 뒤쫓는 영국 해군은 먼저 엘리자베스를 구하겠다는 목적을 달성할 수 있을 것인가  주인공 영웅들은 초자연적 해골인간 해적들을 무찌르려면 과연 어떻게 상대해야 하는 것일까 ,comedy
2,족구왕,이름  홍만섭  나이    세  신분  식품영양학과 복학생  학점       토익 점수  받아본 적 없음  스타일  여자가 싫어하는 스타일  여자 친구  있어본 적 없음  다시 읽어봐도 답 안 나오는 스펙의 주인공 만섭  지금 당장 공무원 시험에 뛰어들어도 모자랄 판에 캠퍼스 퀸 안나에게 첫눈에 반하질 않나  총장과의 대화 시간에 족구장을 만들어달라고 하질 않나 아주 그냥  족구 하는 소리 만 하고 있다  그런데 의외로 퀸카 안나가 요즘 남자애들 같지 않은 만섭의 천연기념물급 매력에 관심을 보이고  만섭은 급기야 안나의  썸남 인  전직 국대 축구선수 인 강민을 족구 한판으로 무릎 꿇리기에 이른다  이 사건으로 만섭은  그저 그런 복학생 에서 순식간에 캠퍼스의  슈퍼 복학생  어로 가 되고  취업준비장 같이 지루하던 캠퍼스는 족구 열풍에 휩싸인다  학생들의 열화와 같은 관심 속에서 드디어 시작된 캠퍼스 족구대회  누가 봐도 허술해 보이는 외인구단 만섭 팀은 복수심에 불타는 강민이 속한 최강 해병대팀을 이기고 사랑과 족구 모두를 쟁취할 수 있을까   단 한편의 특급 코미디  사랑과 족구를 그대에게 바친다 ,comedy
3,스파이,현장 요원들의 임무 수행을 돕는    의 내근 요원 수잔 쿠퍼 멜리사 맥카시   외모  임무 수행 등 완벽한 최고의 요원 브래들리 파인 주드 로 의 파트너로 임무를 수행을 하던 중  핵무기 밀거래를 추진하는 마피아들에게     현장 요원들의 신분이 모두 노출되는 사건이 발생한다  마피아들이 모르는 내근 요원 수잔은    의 최대 위기를 극복하고 핵무기의 밀거래를 막기 위해 현장에 투입된다  그러나  그녀를 못 믿는  자칭  최고의 요원 릭 포드 제이슨 스타뎀 가 그녀와 별개로 임무를 수행하면서 그녀의 미션은 위기에 직면하게 되는데 ,comedy
4,빅 피쉬,윌은 아버지 앨버트 피니 의 병세가 위독하다는 전갈을 받고 고향으로 돌아온다  평생 모험을 즐겼던 허풍쟁이 아버지는  내가 왕년에  로 시작되는 모험담을 늘어놓는다  젊은 에드워드 블룸 이완 맥그리거 은 태어나자마자 온 병원을 헤집고 다녔고  원인불명  성장병 으로 남보다 빨리 컸으며 만능 스포츠맨에  발명왕이자 해결사였다  마을에서 가장 유명인사가 된 에드워드는 더 큰 세상을 만나기 위해 여행을 시작했고  대책없이 큰 거인  늑대인간 서커스 단장  샴 쌍둥이 자매  괴짜시인 등 특별한    친구들을 사귀면서 영웅적인 모험과 로맨스를 경험했다는데  하지만 지금의 에드워드는 병상의 초라한 노인일 뿐  마지막이 될 지 모르는 아버지 곁에서 진짜 아버지의 모습이 궁금해진 윌은 창고 깊숙한 곳에서 아버지의 거짓말 속에 등장하는 증거를 하나 찾아내고  이제  에드워드 블룸의 거짓과 진실 을 가려내기 위한 추적을 시작한다 ,comedy
5,뮬란(패키지상품 : 더빙판 추가증정),파씨 가문의 외동딸 뮬란        밍나 웬 목소리 분   레아 살롱가 노래 분 은 자기 주장이 워낙 강해 선을 볼때마다 퇴짜를 맞는 시대를 앞선 여성이다  한편  훈족이 국경을 침략하자 뮬란의 연로한 아버지 파 조우  오순택 목소리 분 도 징집 명령을 받게되고  뮬란은 심각한 고심에 빠지게 된다  아버지의 충성심이 워낙 강해서 뮬란의 만류를 뿌리쳤고  아버지를 대신 하려해도 여자는 절대로 참전할 수 없기 때문이다  고민에 고민을 거듭하던 뮬란은 남장을 하고 전장에 참가하기로 비장한 결심을 한다  한편   파 시 가문의 조상들이 유령으로 환생하여 대책회의를 하게 되고  결국 천방지축 수호신 무슈 에디 머피 목소리 분 가 뮬란을 따라 나서게 된다  뮬란은 의지가 워낙 강한 여성이라 점점 한 사람의 병사로 성장하게 된다  한편  여자라는 사실이 들통나지 않기 위해 살얼음판 같은 나날을 보내면서도  뮬란은 자신도 모르게 용맹한 중대장 샹      왕 목소리 분   도니 오스몬드 노래 분 에게 사랑을 품게 된다  용감하게 머리를 자르고 남장을 했지만 여자의 마음은 버릴 수 없었던 것일까  그러던 중  뮬란이 속한 부대가 눈덮인 설원을 통과할 무렵  천여명이 넘는 훈족의 군대에게 추격을 당하게 되고  뮬란이 눈사태를 일으켜 훈족의 군사들을 무찌르는 기지를 발휘한다  그러나  부상당한 뮬란은 치료를 받다가 여자인 사실이 밝혀져 군령을 어긴 죄로 위기에 처하지만  중대장 샹의 도움으로 목숨을 구한다  한편  물러간 줄 알았던 훈족의 군사들은 다시 황궁으로 쳐들어와 황제까지 협박하고 나라는 다시 위기에 처하게 된다  이때 아름다운 영웅 뮬란이 다시 한번 용맹을 발휘하여 황제와 나라를 구하게 되고  황제는 수많은 백성 앞에서 뮬란을 영웅으로 대접하는데 ,comedy
6,지옥의 화원,압도적 격투 능력만 있다면 최강의 여직원으로 칭송 받는 대양아치의 시대  왕년의 양아치  폭주족들이 최강 자리를 놓고 사내 파벌을 형성하며 군웅할거하고 있는 혼란 속에서 지극  평범한 회사 생활을 보내던 나오코는 새로 입사한 란과 우연한 계기로 친해지게 된다  그러나 뛰어난 싸움 실력을 지닌 란이 사내 서열을 평정한 후 전국 양아치들의 표적이 되고 나오코 역시 주먹 세계의 거대한 소용돌이에 휘말리고 마는데   회사원은 언제나 싸우고 싶다  심장을 뜨겁게 할 오피스 코믹 액션의 등장 ,comedy
7,7번방의 선물,최악의 흉악범들이 모인 교도소  번방에 이상한 놈이 들어왔다  그는 바로  살 지능의 딸바보  용구   평생 죄만 짓고 살아온  번방 패밀리들에게 떨어진 미션은 바로  용구  딸  예승 이를 외부인 절대 출입금지인 교도소에 반 입 하 는 것      년 새해  웃음과 감동 가득한 사상초유의 합동작전이 시작된다 ,comedy
8,브리짓 존스의 일기,어김없이 홀로 새해를 맞은 서른두 살  브리짓  그런 그녀에게 운명처럼 찾아온 정반대의 두 매력남   내 여자에게만 다정한 스윗남  마크 와 사랑에 직진하는  다니엘  사이에서 그녀의 다이어리는 행복한 상상으로 채워지는데    브리짓 존스의 일기  첫 페이지가 시작됩니다 ,comedy
9,마틸다,태어날 때부터 남달리 깜찍하고 총명한 소녀 마틸다에게는 너무나 안 어울리는 가족이 있다  중고차 매매업을 하는 아버지는 사기꾼에 가깝고  어머니는 돈에만 관심 있는 허영으로 똘똘 뭉친 여자다  이들은 마틸다의 천재성을 발견하기는커녕 그녀에게 바보 같은   를 억지로 보게 하고 읽고 있는 책마저 빼앗아 던져버린다  마틸다는 네살때부터 도서관을 찾아가 그곳에 있는 책을 닥치는대로 읽기 시작한다  그녀는 책 속의 주인공과 벗하며 꽃이 만발하고 나무가 우거진 예쁜 집에서 그네를 타며 사는 꿈을 꾼다   살이 되던 해 마틸다를 성가시다고 느낀 그녀의 아버지는 딸을 이상한 학교에 입학시킨다  이 학교는 한마디로 공포 분위기  왕년의 올림픽 투포환 선수였던 트런치불 교장은 아이들을 어둡고 좁은 방에 가두는가 하면  공처럼 집어 던진다  그러나 세상에는 밝은 면도 있는 법  착하고 아이들을 진심으로 사랑하는 마틸다의 담임 선생님 미스 허니와 친구들 덕분에 마틸다는 학교 생활이 즐겁기만 하다  어려운 수학 문제를 척척 푸는가 하면 가끔 초능력을 발휘해 교장을 골탕먹이기도 한다  한편 허니는 불행한 과거가 있는데 그것은 바로 교장인 트런치불이 자신의 이모이고 그녀가 허니 아버지의 모든 재산과 학교마저 다 빼앗아 버린 것  이제 마틸다는 친구들과 함께 아이들을 귀찮고 쓸모 없는 존재로 취급하는 트런치불 교장 쫓아내기 작전을 편다  먼저 마틸다가 초능력을 발휘해 그녀를 혼내주고 친구들이 모두  을 합쳐 총공격 한다  악명 높은 트런치불 교장은 떠나고 학교는 드디어 제 주인을 찾는다  이제 마틸다도 진정한 가족을 찾을 때  마틸다는 죄를 짓고 급하게 떠나는 한심한 부모로부터 입양 허락을 받아 낸다  마틸다가 꿈꾸던  꽃과 나무가 우거지고 뜰에 그네가 있는 집에서 미스 허니와 행복한 가정을 만든다 ,comedy
10,조조 래빗(부가영상 제공),제 차 세계대전 말기  엄마  로지  스칼렛 요한슨 와 단둘이 살고 있는   살 소년  조조  로만 그리핀 데이비스   원하던 독일 소년단에 입단하지만 겁쟁이 토끼라 놀림 받을 뿐이다  상심한  조조 에게 상상 속 친구   틀러  타이카 와이티티 는 유일한 위안이 된다    조조 는 어느 날 우연  집에 몰래 숨어 있던 미스터리한 소녀  엘사  토마신 맥켄지 를 발견하게 된다  세상에서 가장 위험한 인물이 왜 여기에    당신을 웃긴 만큼 따뜻하게 안아줄 이야기가 펼쳐진다 ,comedy
11,어바웃 타임,모태솔로 팀 돔놀 글리슨 은 성인이 된 날  아버지 빌 나이 로부터 놀랄만한 가문의 비밀을 듣게 된다   바로 시간을 되돌릴 수 있는 능력이 있다는 것   그것이 비록  틀러를 죽이거나 여신과 뜨거운 사랑을 할 수 는 없지만   여자친구는 만들어 줄 순 있으리      꿈을 위해 런던으로 간 팀은 우연  만난 사랑스러운 여인 메리에게 첫눈에 반하게 된다   그녀의 사랑을 얻기 위해 자신의 특별한 능력을 마음껏 발휘하는 팀   어설픈 대시  어색한 웃음은 리와인드  뜨거웠던 밤은 더욱 뜨겁게 리플레이   꿈에 그리던 그녀와 매일매일 최고의 순간을 보낸다     하지만 그와 그녀의 사랑이 완벽해 질수록 팀을 둘러싼 주변 상황들은 미묘하게 엇갈리고   예상치 못한 사건들이 여기저기 나타나기 시작하는데     어떠한 순간을 다시 살게 된다면  과연 완벽한 사랑을 이룰 수 있을까 ,comedy
12,찰리와 초콜릿 공장,전 세계 누구에게나 사랑 받는 세계 최고의 초콜릿 공장인  윌리 웡카 초콜릿 공장   매일 엄청난 양의 초콜릿을 생산해 세계 각국으로 운반하고 있지만 그 누구도 공장을 드나 드는 사람을 본 적이 없는 비밀의 공간이다  공장보다 더 신비로운 수수께끼는 초콜릿 공장의 공장장인 윌리 웡카 조니 뎁 라는 인물  들리는 소문에 의하면 웡카는 몇 년 동안 공장 밖으로 나가본 적도 없다고 한다  그가 어떤 사람이고  왜 초콜릿 만드는 일에 모든 것을 걸고 있는지 모두들 궁금해 할 뿐이다  어느 날  윌리 웡카가  개의 웡카 초콜릿에 감춰진 행운의  황금티켓 을 찾은 어린이 다섯 명에게 자신의 공장을 공개하고 그 모든 제작과정의 비밀을 보여주겠다는 선언을 한다  이제 전 세계 어린이들은 황금티켓을 찾기 위한 노력을 시작한다  엄마  아빠  할머니  할아버지들과 함께 초콜릿 공장 바로 옆  다 쓰러져 갈듯한 작은 오두막집에서 살고 있는 찰리 프레디 하이모어  역시 초콜릿 공장에 가고 싶은 건 마찬가지  찰리는 매일 밤 잠들기 전 공장 안이 어떻게 생겼을 지를 상상하며 잠이 들곤 했다  하지만 찰리는  년에 단 한번  자신의 생일에 딱 한 개의 웡카 초콜릿을 먹을 수 있기 때문에 당첨될 확률은 거의 희박했다  한편  세계 각국에서 행운의 당첨자들이 속속 나타나기 시작했다  첫 번째 당첨자는 독일의 먹보 소년 아우구스투스  언제나 초콜릿을 입에 달고 사는 소년이다  두 번째 행운은 뭐든지 원하는 건 손에 넣어야 직성이 풀리는 부잣집 딸 버루카에게  세 번째는 껌 씹기 대회 챔피언인 바이올렛에게 돌아간다  네 번째 주인공인 마이크는 자신이 얼마나 똑똑한지를 세상에 과시하기 위해 도전에 응해 목적을 달성한 집념의 소유자다  그리고 마지막   눈 쌓인 거리에서 우연  돈을 주워 웡카 초콜릿을 산 찰리가 다섯 번째 황금 티켓을 발견한 주인공이 되었다   웡카의 초콜릿 공장에 들어간 찰리는 눈앞에 펼쳐지는 놀라운 광경들에 입을 다물지 못한다  한쪽엔 초콜릿 폭포가 흐르고 그 옆에선 쾌활한 움파 룸파 족들이 거대한 초콜릿 과자 산에 삽질을 하거나  용머리 모양을 한 설탕 보트를 타고 초콜릿 강을 건너간다  초콜릿 강가에는 꽈배기 사탕이 열리는 나무와 민트 설탕 풀이 자라고 있고 덤불 속에선 머쉬멜로우 체리크림이 익어간다  한편  찰리를 제외한 다른 네 명은 웡카의 놀라운 발명품들에는 관심도 없고 한결같이 욕심과 이기심  승부욕과 과시욕에 눈이 멀어 자꾸만 문제를 일으키는데   ,comedy
13,아이 필 프리티,뛰어난 패션센스에 매력적인 성격이지만 통통한 몸매가 불만인  르네  하아   예뻐지기만 하면 뭐든 다 할 수 있을 것만 같다  하늘에 온 마음을 담아 간절  소원을 빌지만 당연  달라지는 건   도 없고   오늘도 헬스클럽에서 스피닝에 열중하는  르네   집중  또 집중  난 할 수 있다  예뻐질 수 있다      그러나 과도한 열정은 오 려 독이 되는 법  미친 듯이 페달을 밟다가 헬스 클럽 바닥에 내동댕이쳐져 머리를 부딪 고   지끈지끈한 머리  창피해서 빨개진 얼굴로 겨우 일어났는데 뭔가 이상하다  헐  거울 속의 내가  좀 예쁘다    드디어 소원성취한  르네 의 참을 수 없는 웃음이 터진다 ,comedy
14,브루스 올마이티,브루스는 뉴욕  버펄로 지방 방송국의 뉴스 리포터  재미있고 소박한 이웃들 얘기를 단골로 맡아 재미있는 입담으로 사람들을 즐겁게 해주지만 정작 자신은 자신에게 주어지는 별 볼일 없는 취재거리가 늘 불만이다  곧 은퇴할 앵커의 후임이나  적어도 극적인 사건의 현장을 전하는 게 그의 꿈  자신의 모습에 대해 하나부터 열까지 모두 불만인 그는 쉴새 없이 신에게 불만을 쏟아놓는다  유아원을 운영하는 브루스의 여자친구 그레이스 제니퍼 애니스톤 는 반대로  자신의 삶에 만족하고  늘 툴툴거리기만 하는 브루스를 변함없이 받아주고 사랑한다  브루스의 꿈이 월터 크론카이트 같은 대 앵커가 되는 것이라면  그레이스는 매일매일 작은 일로 세상에 도움을 주려는 소박하고 따뜻한 마음을 가지고 있다  그러던 어느 날 브루스에게 기회가 찾아온다  나이아가라 폭포의 유명한                    안개 속의 처녀  호의   주년 기념일 취재를 맡게 된 것  하지만 방송 직전  브루스는 공석으로 알고 있던 앵커 자리가 그와 늘 으르렁거리는 왕재수 라이벌에게 돌아갔다는 것을 알게 되자  수 백만 시청자 앞에서 정신없이 욕을 퍼붓는다  방송국에서 쫓겨난 건 불 보듯 뻔한 일  하지만 바로 그날 설상가상으로 브루스는 건달들에게 몰매를 맞고  차가 엉망이 되고  재수 없어도 오부지게 없는 일들만 반복된다  화가 나 폭발하기 일보직전엔 브루스는 하늘을 향해 삿대질을 해대며  자신의 불행은 신 탓이라며 원망한다  이때 삐삐가 울리고 번호 하나가 찍 다  몇 번을 무시한 끝에 그 정체 모를 번호에 전화를 걸게 된 브루스는                사 라는 이상한 낡은 건물로 향하게 되고  거기서 정체불명의 청소부 모건 프리먼 을 만난다  그런데 그 청소부는 놀랍게도 브루스에게 자신이 신이라고 소개한다  브루스의 원망에 응답해 모습을 나타낸 신은  이 열 잘 받는 전직 리포터에게 자신의 전지전능한  을 주고  얼마나 더 나은 세상을 만들 수 있는지 보자고 한다  이게 꿈인가 생신가  자신의 능력을 시험해본 브루스는 자신에게 주어진  이 악몽도 환상도 아님을 알게 되고  무엇이든 마음대로 할 수 있는 전능한 존재가 됐음을 알게 된다  이제 브루스 놀란은 우주에서 가장 강력한 망나니가 되고  마음대로 손가락을 휘둘러대기 시작한다  과연 브루스는 자신에게 가장 소중한 것을 찾아낼 수 있을 것인가 ,comedy
15,거미집, 결말만 바꾸면 걸작이 된다  딱 이틀이면 돼       년대 꿈도 예술도 검열당하던 시대 성공적이었던 데뷔작 이후  악평과 조롱에 시달리던 김감독 송강호 은 촬영이 끝난 영화  거미집 의 새로운 결말에 대한 영감을 주는 꿈을 며칠째 꾸고 있다  그대로만 찍으면 틀림없이 걸작이 된다는 예감  그는 딱 이틀 간의 추가 촬영을 꿈꾼다  그러나 대본은 심의에 걸리고  제작자 백회장 장영남 은 촬영을 반대한다  제작사 후계자인 신미도 전여빈 를 설득한 김감독은 베테랑 배우 이민자 임수정   톱스타 강호세 오정세   떠오르는 스타 한유림 정수정 까지 불러 모아 촬영을 강행하지만  스케줄 꼬인 배우들은 불만투성이다  설상가상 출장 갔던 제작자와 검열 담당자까지 들이닥치면서 현장은 아수라장이 되는데  과연  거미집 은 세기의 걸작으로 완성될 수 있을까 ,comedy
16,루카(패키지: 자막판+더빙판+부가영상),이탈리아 리비에라의 아름다운 해변 마을  바다 밖 세상이 궁금하지만  두렵기도 한 호기심 많은 소년  루카   자칭 인간세상 전문가  알베르토 와 함께 모험을 감행하지만  물만 닿으면 바다 괴물로 변신하는 비밀 때문에 아슬아슬하기만 하다   새로운 친구  줄리아 와 함께 젤라또와 파스타를 실컷 먹고 스쿠터 여행을 꿈꾸는 여름은 그저 즐겁기만 한데   과연 이들은 언제까지 비밀을 감출 수 있을까   함께라서 행복한 여름  우리들의 잊지 못할 모험이 시작된다 ,comedy
17,NULL,NULL,comedy
18,드래곤 길들이기,용맹한 바이킹과 사나운 드래곤들의 싸움이 끊이지 않는 버크섬  바이킹 족장의 아들   컵 은 드래곤 사냥에 소질 없는 마을의 사고뭉치  어느 날 그는 부상 당한 드래곤   투슬리스 를 구하게 되고  아무도 몰래 그를 돌본다  서로를 알아가며  드래곤들의 친구가 된   컵   그들과의 새로운 생활을 만끽하던   컵 은 드래곤들의 위험한 비밀을 알게 되는데 ,comedy
19,유브 갓 메일,죠 폭스          톰 행크스 분 와 케슬린 켈리                 멕 라이언 분 는 둘 다 뉴욕의 거리와 정취를 사랑하며 뉴욕에 살고있는 뉴요커  그들은 서로의 존재를 모른 채 몇 블록 떨어지지 않은 가까운 곳에 살면서  각자 자바스 슈퍼에서 장을 보고  스타벅스 커피숍에서 커피를 마시고  같은 하늘을 보며 생활을 한다  죠와 케슬린은 판이한 환경 속에 살며 서로를 모르지만 이들을 이어주는 건 인터넷 메일  케슬린은 자신의 생일에 우연  채팅룸에 들어가서 죠를 만나게 되고 둘은 문학을  자신이 얼마나 뉴욕을 사랑하는지 이야기 하면서 죠는          케슬린은            이라는   로 이메일을 주고 받으면서 친해진다  카슬린은 동네의 작은 아동 전문 서점                             의 주인이고  죠는 맨하튼의 대형 체인서점  폭스 북스 의 사장인 것을 꿈에도 상상치 못한 채  두 사람이 우정과 사랑 사이에서 헷갈려 할 즈음  죠 폭스는  폭스북스 의 새 체인점을 케슬린이 운영하는 서점 가까운 곳에 개점하게 된다  케슬린의 작은 서점은 물량 공세와 박리다매 전술과 서점 내 에스프레소 카페 등으로 서비스하며 기업 규모로 운영하는 첨단 서점  폭스북스 와 애초부터 경쟁상대가 될 수가 없었다  케슬린의 서점은 작지만 그 동네를 상징하는 동네의 명소이자 어머니로부터 물려받은 유산으로 캐슬린의 어릴 적 추억이 담긴 곳  현재 자신의 생계수단이기까지 한 서점이 문을 닫게될지도 모를 상황에 다다른 케슬린은 자신의 참담한 심정을      에게 털어놓고 상상도 못했던         의 정체를 알게된 죠는 당황한다  또한  우연  케슬린의 모습을 실제로 보면서 점점 그녀에게 빠져들게 되고 고민에 빠진다   폭스 북스 를 증오하는 케슬린에게 어떻게 자신이 그곳의 체인점 사장인 죠 폭스라고 밝  것인가 ,comedy
