,title,synopsis,category
0,NULL,NULL,documentary
1,NULL,NULL,documentary
2,과거는 낯선 나라다,    년  월   일  대한민국 서울  서울대학교 앞 신림 사거리에서 당시 서울대학교 학생이었던   살의 청년 김세진 이재호 두 사람이    여명의 학생들과 군사훈련인 전방입소 반대 시위를 벌이던 중  반전반핵 양키고홈   북미 평화협정 체결   미 제국주의 축출   등의 구호를 외치며 분신하였다  이는     년 한국전쟁 이후 남한에서 벌어진 최초의 대중적인 반미 구호였다  한국사회는 엄청난 충격에 휩싸였다    년이 흘렀다  세상은 변하였다  남북의 정상이 만난다  미국은 북한과의  평화협정 을 논의한다  상상할 수도 없던 일들이 벌어진다  두 사람의 죽음을 목격했던 친구들은 지금 무엇을 하고 있을까  그들은 무엇을 기억하고 무엇을 망각하고 있을까  세상이 변한 것만큼 그들도 변했을까  순응의 페르소나들  부적응의 표정 얼굴 들   역사는 흘러가는 것이 아니라 다가오는 것이다   그 진실에 관하여 친구들과 감독이 인터뷰어와 인터뷰이의 위치를 바꾸며 증언한다 ,documentary
3,나비와 바다,뇌병변 장애를 앓고 있는 재년 애칭 제제 과 우영 애칭 노인네   띠동갑 나이차를 극복하고 만남을 시작한 지 어언  년  이젠  그녀를 바래다 주지 못하는 미안한 마음을 벗어 던지고  그를 배웅해야 하는 아쉬운 헤어짐을 끝내고 싶다  그러나  미처 몰랐다  결혼이 이렇게 어려운 것인 줄   내가 다 책임질게  오빠만 믿으라 는 우영의 프로포즈가 거듭될수록 제제의 고민은 깊어져 갔다  험한 세상에 덜컥 둘만 남겨진 기분   남편과 아내 로 규정되는 새로운 역할에 대한 부담은 점점 커져만 갔고  주변의 우려 섞인 시선은 공포로 다가왔다  과연  제제와 우영은 결혼에 성공할 수 있을까 ,documentary
4,맥코리아,맥쿼리는 세계적인 자산운용회사로     년 한국에 지사를 설립했다  이명박 정권이 집권한     년  월 이후 대한민국의 공공재인  인천대교    인천공항고속도로    우면산터널    마창대교  등을 통해 매년 수천억원의 이자를 챙기고 있다  국내 산업을 닥치는대로 집어 삼키고 있는 맥쿼리  과연 독자적으로 가능한 일일까   모두에게 물을 것이다   맥쿼리를 아십니까    국회의원  기자  정치평론가  맥쿼리에 의문을 제기하고 나선 사람들  매각당사자인 공기업의 관계자들  송경순 맥쿼리 인프라의 감독이사  청와대의 대통령  그리고  우리는 아주 단순한 진리를 얻게 될 것이다  바로  이익을 얻는 자가 범인이라는 것 ,documentary
5,I AM. (아이엠),단 한 순간의 감동을 위한 수년간의 노력과 열정 그리고 꿈을 담은        리얼  스토리      년   월   일  아시아 가수 최초로 팝의 본고장 뉴욕 매디슨 스퀘어 가든 무대에 오른               시간의 땀과 눈물로 채워진 연습생 시절부터 역사적인 뉴욕 무대에 오르기까지 강타  보아  동방신기  슈퍼주니어  소녀시대  샤이니      의 성장하고  꿈꾸며  끝없이 도전하는 청춘 스토리가 스크린에 공개된다 ,documentary
6,프란체스코와 교황,바티칸의  시스티나 예배당 성가대 로 교황 앞에서 노래를 부를 수 있는 것이 영광스러운  프란체스코 는 아직 초등학교  학년이다  로마의  포르투엔스 에서 엄마와 쌍둥이 형들과 함께 사는 소년은 일요일이면 미사에 참석하기 위해 바티칸으로 간다  일요일에는 다른 아이들처럼 축구도 하고 형제들과 친구들과 놀고 싶은 마음은 똑같지만 자신이 해야 할 일을 잘 알고 있다 그러던 중 프란체스코는 합창에서 솔로로 독창을 할 수 있는 기회를 얻는다  천상의 목소리를 지닌 프란체스코이지만 존경하는 교황님 앞에서 실수하지 않기 위해 연습 또 연습에 매진한다  한편 교황 베네딕토   세는 복음을 전파하기 위해 전세계를 방문한다  카메룬 야운데에 방문 후 콘돔 사용을 반대한다는 주장을 펼쳐 논란이 되기도 했던 장면이나 이스라엘 예루살렘에 방문하여 유대교와의 화해와 공존을 설파하는 모습을 담고 있다  다시 바티칸으로 돌아온 교황은 프란체스코의 첫번째 독창 무대에서 드디어 만나게 되는데 ,documentary
7,픽쳐 미 : 모델 다이어리,  세 때 하굣길에서 캐스팅되어 모델이 된 사라 지프가  샤넬    캘빈 클라인  부터  돌체 앤 가바나 에 이르는 각종 유명 브랜드의 화려하고 섹시한 광채를 뽐내는 젊고 아름다운 광고모델로 나선  년간  남자친구인 올리 셀과 그녀는 패션 쇼 막후의 파티  캐스팅  호텔객실 안  런웨이 무대 뒤를  년 동안 하루도 빠짐없이 모든 일상을 작은 비디오 카메라에 담았다  이들의 카메라는 일반인이 알지 못하는 패션업계의 모델들이 공개적으로 말하지 못했던 그들의 세계에 들어가 본다 ,documentary
8,아프리칸캣츠,땅과 바다  아프리카 고양이들의 장엄한 서사시  지구에서 사람의 손이 닿지 않는 평원  야생의 땅에 가정을 이루려는 두 가족들의 특별한 모험을 함께 해 보자  멋진 영상에 담긴 사바나의 동물의 왕과  그들의 사랑과  유머  운명을 만나게 된 순간을 숨 죽이며 함께 빠져들게 될 것  장엄한 야생에서 펼쳐지는 끈끈한 가족의 결속력이 감동적인 디즈니 네이쳐의 다큐멘터리 ,documentary
9,NULL,NULL,documentary
10,NULL,NULL,documentary
11,할매꽃,하고 싶어도 차마 하지 못했던 핏빛 시대의 뜨거운 증언  대한민국 현대사의 비극이 내 가족 안에 있었다  평생 정신병으로 고생하던 작은 외할아버지가 돌아가신 후 나는 우연  그 분의 일기를 보게 되고  한 번도 들어보지 못한 슬픈 가족사와 맞닥뜨린다  반세기 전 산골의 한 작은 마을에서 일어난 계급  이념간의 갈등과 남  북 그리고 일본 땅으로 흩어지게 된 가족들    역사책에서만 접했던 우리 현대사의 비극이 내 가족 안에 있었다 ,documentary
12,꼬마 철학자들,개성 만점 교장 선생님과 학생들은 도시의 쇠퇴  종파 간 다툼  빈곤과 약물 중독 등에 시달리는 도심 지역의 운명을 바꾸기 위해 노력한다  벨파스트 아르도인에 위치한 이 초등학교는 벨파스트 분쟁 이후 폭력에 의문을 던지는 논의의 장이 된다  교장 선생님은 학생들을 그리스 철학자들의 지혜로 무장시키고  아이들은 지속된 다툼과 편견을 부수기 위해 도전한다 ,documentary
13,버텨내고 존재하기,음악을 만드는 사람의 얼굴 같은 음악 공간을 지켜내는 사람의 얼굴 같은 공간     년 개관  호남지역 최초의 극장  광주극장 은 오늘도 같은 자리에서 영화를 상영 중이다    년간 변함없는 얼굴로 관객들을 맞이했을 이곳의 매표소  상영관  영사실  사무실  계단과 복도  이곳에 고상지 이자원  곽푸른하늘  김사월  김일두  불나방스타쏘세지클럽  아마도이자람밴드  정우  최고은 주소영 등 영화를 사랑하는 국내 최고의 인디 뮤지션  팀이 모였다   버텨내고 존재하는  모든 것들을 위한 음악의 다정한 러브레터  바라건데 가치있게  흔쾌  버텨내고 존재하기 ,documentary
14,쉬스토리,방직공장에 근무하던 새희는     항쟁에서 은화의 죽음을  목격한 후  트라우마에 사로잡혀 고통스러워한다   하지만 수십 년이 지나도 진실이 규명되지 않았다   살아남은 새희는 배회하던 오월영령들과 함께  진실을 위해서 연대한다 ,documentary
15,김다예 선언,사람들에게는 당당하고 자신감 넘치는 다예 그러나 실상은 우울증 공황장애 환자이다  정신질환환자에 대해 선입견 넘치는 이 세상에 다예는 자신의 병을 선언하게 된다  가족들에게만 제외하고 주변인 모두에게 선언을 하기 시작하는데 선언을 하며 받은 사람들의 리액션에 가족들에게까지 고백할 용기가 생긴다     년간 친오빠의 일탈로 다예의 집은 크게 무너졌다  엄마와 아빠는 이혼을 해야하지만 하지 않고 매일 밤 고함을 지르고 싸우는 관계  아빠는 오빠를 불쌍하다고 여기며 잘해주지만 자신이 제일  들다고 믿는다  엄마는 자신의 몸에서 나온 남자  자신과 평생을 기약한 남자를 모두 증오한다  다예를 죽여버리고 싶다고 말한 역마살이 껴서   년간 집을 들어오지 않았던 오빠   다예는   년 전 화목했던 가족을 생각하며 스스로를 등대라고 믿고 모두가 제자리로 돌아올때까지 버틴다  엄마와 아빠와 오빠 모두 다예만을 가족의 희망이며 자랑으로 여긴다  다예는   년동안 항상 스스로에게 말한다   너가 기둥이니까  기둥이 잘 버티고 있으면 언젠가 사람들은 돌아오게 되어있어   그렇게   년이 지났다  다예도 모르게 다예 안에는 마음의 병이 자랐다   혼날까봐  꾀병이라고 믿겨질까봐 말 못했던 다예  드디어 사람들에게 용기를 내어 가족들에게 자신의 병을 선언한다   덤덤하게 자신의 죄라며 평생 아무데도 가지 않고 지켜주기로 약속한 엄마    년이 지나 집에 들어왔지만  자신의 직접적인 잘못은 없다고 하는 오빠  자신의 이기심을 인정한 아빠   세가족이 드디어 다예의 선언으로   년간의 대화를 시도한다    년이 지나도 오빠는 다예의 선언에도 변하지 않았다  그래도 다예는 엄마와 아빠와 함께 오빠를 끝까지 기다려보기로 한다 ,documentary
16,이터널 메모리,시간마저 뛰어 넘은 영원한 사랑  이토록 위대한 기억의 재구성  칠레의 저명한 저널리스트이자 피노체트 정권의 범죄를 기록한 작가 아우구스토와 배우이자 활동가이며 문화부장관을 역임한 파울리나는   년간 사랑을 이어온 백발의 연인이다   년 전 아우구스토가 알츠하이머 판정을 받은 이후  악화되고 있는 병세 앞에 무기력함을 느낀다  그러나 파울리나는 아우구스토가 끝까지 스스로를 잃어버리지 않도록  타협하지 않는 헌신으로 함께 치열하게 싸우고자 한다  서로의 얼굴을 어루만지는 손길을 따라 주름 하나하나에 애정과 슬픔의 기억들을 채우고  인생이라는 극에서 천천  퇴장하고 있는 그들의 깊고 진한 사랑은 절찬리 진행 중이다 ,documentary
17,블루스 온 빌,테네시 주 멤피스의 유명한 빌 스트리트에 있는 블루스 클럽에서 전적으로 촬영된  블루스 온 빌 은 블루스 재단이 주최하고 주최하는 연례 행사인 제  회 국제 블루스 챌린지의 사람들  영혼  그리고 음악을 화면에 담았다      년 초가을부터 전 세계 블루스 협회는 블루스 밴드와 솔로 듀오를 위한 지역 대회를 개최했다  이 대회의 우승자들은     년  월 말에 국제 블루스 챌린지에 참가하기 위해 멤피스로 여행할 수 있는 자격을 얻었다  이 지역 대회의    명의 우승자들은 유명한 빌 스트리트를 따라   개의 클럽에서 공연함으로써 메달  인정  그리고 가능한 음반 계약을 할 수 있게 되었다  이러한 이점을 경쟁하기 위해 사람들은 세계에서 가장 유명한 블루스 지역인 멤피스로 희망과 열망을 가져왔다       년    는 아마도 코로나  가 세계를 잠식하기 전에 진행된 마지막 주요 음악 행사였을 것이다 ,documentary
18,가면-감춰진 진실,중국이 수십억 달러를 들여 설립한  공자학원 이라는 중국어 학습기관의 정체를 폭로하고  이를 둘러싸고 비등하는 국제적 논란  학문의 진실성을 유린하고  외세의 영향을 받으며  인권규정을 위반할 뿐 아니라 국가 안보를 위협한다 는 을 소개한 최초의 다큐멘터리이다  공자학원은 중국이 외국 대학 등 해외교육기관과 파트너십을 맺어서 설립하는 중국의 어학  문화교육 프로그램이다      년 이후  공자학원은 그들의 방식으로 세계      여 대학과 학교들에 세워졌다  베이징은 공자학원을 중국의  해외공작소 건립 에 중요한 일부라고 공언하며    주에  개씩 새로운 공자학원을 계속해서 설립하고 있다  그러나     년 이후 공자학원과의 협약을 종결하는 학교가 늘어나고 있다 ,documentary
19,싱 오버 미,    년대 초 전 세계적으로 유명해진 복음가수 데니스 저니건  어릴 때부터 그는 감성적인 성향과 동성애적 정체성으로 극심한 내적 갈등을 겪었고  피아노와 찬양은 그에게 유일한 안식처였다  자신에게 찾아온 하나님을 만난 그는 놀라운 구원의 여정에 들어서게 된다  현재 그는 찬양 사역으로 사람들에게 자신이 경험한 기적과 소망의 이야기를 전하고 있다 ,documentary
20,뷰티풀 차일드,매일 밤 성 마이클 기숙학교에서는 어린 아이들의 비명소리가 들려왔다    세기 후반 캐나다 정부가 실시한 문화 동화 정책에 따라 원주민들의 문화와 관습을 없애기 위해 그들의 어린 아이들을 부모에게 떼어내어 기숙학교에 집어 넣었다  그리고 하나님의 이름으로 반복된 정신적  육체적  성적인 학대가 가해졌다  원주민들은 기나긴 시간을 영혼을 빼앗긴 채 살아와야 했고  수치심에 못 이겨 술과 마약 그리고 범죄에 빠져 살았다  기숙학교에서 살아 나온 생존자    가 끔찍한 트라우마를 가지고 평생을 살아가고 있다  기나긴 폭력의 역사는 기숙학교가 폐교한 시기인     년까지 계속 되었고 깊어질 대로 깊어진 갈등의 골은 그 누구도 해결 할 수 없을 거라 생각했다  하지만 그 틈을 담대하게 비집고 들어가 화해의 중재자가 되어 준 한인 선교사들  세상을 감동시킬 따뜻한 화해와 용서의 장이 펼쳐진다 ,documentary
21,미라클 여행기,세상의 문제에 관심을 갖기에는 자신이 처한 상황을 헤쳐나가는데도  겨운   대 후반의 청년백수 최미라는 이러한 자신의 신세에 답답하던 차에 제주도 강정마을에 책을 기부하는 행사를 알게 되고 삼 만권의 책을 나르는 배에 승선하게 된다   배에는  백 여명의 자원봉사들이 타고 있고 미라는 본인의 심정에 더 몰두하지만 자연스럽게 배에 승선한 사람들과 어울리게 되면서어렴풋하게나마 강정마을에 대해서 알게 된다  하지만 제주도에 가서 개인적  링을 하는 것이 더 중요한 미라     아무 생각 없이 배를 탄 주인공은 과연 그 곳에서 어떤 일들을 겪게 될까 ,documentary
22,부귀영화,시각 예술가들을 지원하기 위한 레지던스가 개최되고  국내외 작가들은 참가를 위해 오지에 가까운 장소로 모여든다  그리고 배과수원 내의 축사를 개조시킨 숙소에서 합숙을 시작한다  전시 기간이 다가오자 그들의 작품을 관람하려는 관람객들이 레지던스를 찾아오고  이들과 함께 묘령의 여인  율리 가 찾아온다  이후 연이어 작가들이 실종되는 사건이 일어나고  레지던스 안은 이전 같지 않은 스산한 기운이 감돌기 시작하는데   ,documentary
23,영화감독 노동주,시각이 단절된 채 시각적인 예술인 영화에 도전하는  노동주  감독  그가 도전하는 건 세상의 편견과 장벽들이다  인간 노동주의 삶과 감독 노동주의 영화 제작기를 통해 바라본 우리 사회의 편견과 시선은 어떤 모습일까 ,documentary
24,고흐의 방,화가의 꿈을 키우는 재인이의 하루 일상을 그린 단편 영화,documentary
25,동행: 10년의 발걸음, 시각장애인에게 불가능이란 없다 라는 의지로 시각장애인 복지재단을 이끌고 있던 광명복지재단 명선목 이사장은 프랑스 파리 장애인 학교 학장으로부터 시각장애인은 현악기를 다루기  들다는 이야기를 듣고 자극을 받는다  그는 불가능이라는 한계를 뛰어넘기 위해 인천혜광학교에 방과후 수업으로 현악기 수업을 추가하고  여러 노력 끝에     년 시각장애인 오케스트라를 창단했다  그렇게 시작된  혜광브라인드 오케스트라 는 수없이 많은 희노애락을 겪으며   년의 시간을 견뎌왔다    년간 그들이 어떤 변화를 만들어 냈는지  앞으로 더 큰 변화를 위해 어떤 계획을 가지고 있는지 혜광브라인드 오케스트라와 동행한 단원  스텝  관계자 등 그들의 인터뷰를 통해   년의 발걸음을 따라가 본다 ,documentary
26,그대라는기억 연숙씨,치매라는 진단을 받고 차츰 병이 악화되는 아내 연숙씨  기억은 사라지고 말을 잊기 시작한 그녀의 시간은 거꾸로 흘러가고 있다  그녀의 곁을 지킨 사람은 남편 규홍씨  다 잊어도 유일하게 아내가 기억하는 사람은 남편뿐  하루를 온전  아내를 위해 보내는 남편은 어느 날 시한부 선고를 받는다    년을 자신보다 아내가 먼저였던 남편  아내는 기억을 잃어가고  남편은 기운을 잃어간다 ,documentary
27,NULL,NULL,documentary
28,우키시마호,    년  월   일  조선인 만여 명을 태운 귀국선  우키시마호가 출항을 시작한다  목적지는 부산이었다   하지만 출항 이틀 후  우키시마호는 갑작스럽게 폭발 그리고 침몰   배에 탄 수천 명의 조선인이 목숨을 잃었다   사건이 발생한 지   년  우키시마호 폭발 원인은 여전  밝혀지지 않고 있다  이제 우리가  그 원인을 밝혀야만 한다 ,documentary
29,NULL,NULL,documentary
