,title,synopsis,category
0,아바타: 물의 길(세트 : 아바타 1~2편), 아바타  물의 길 은 판도라 행성에서  제이크 설리 와  네이티리 가 이룬 가족이 겪게 되는 무자비한 위협과 살아남기 위해 떠나야 하는 긴 여정과 전투  그리고 견뎌내야 할 상처에 대한 이야기를 그렸다  월드와이드 역대 흥행 순위  위를 기록한 전편  아바타 에 이어 제임스 카메론 감독이   년만에 선보이는 영화로  샘 워싱턴  조 샐다나  시고니 위버  스티븐 랭  케이트 윈슬렛이 출연하고 존 랜도가 프로듀싱을 맡았다 ,sf_fantasy
1,앱솔루틀리 애니씽,애완견  데니스  로빈 윌리엄스 와 대화를 나누는 것이 유일한 낙인 별일 없이 사는  닐  사이먼 페그 에게 어느 날 갑자기 손만 흔들면 말하는 대로 이뤄지는 전지전능한 초능력이 생기게 된다  은하계 고등생물 위원회가 지구의 존폐를 결정하기 위해 무작위로 실험대상을 선정해 닐에게 초능력을 준 것이다  지구의 운명이 자신에게 달린 줄은 꿈에도 모르고 초능력으로 아래층에 사는  캐서린 케이트 베킨세일  이 자신을 사랑하게 해달라는 소원을 말하는 닐  하지만 그의    부족한 초능력 사용 때문에 생각과 달리 상황은 점점 의도치 않게 흘러 가는데   과연  닐은 초능력으로 사랑을 쟁취하고 은하계에서 지구를 지켜낼 수 있을까 ,sf_fantasy
2,이노센스,공각기동대 그 후로  년        년  전뇌          로봇 기술 등의 발달에 따라 인간이 전뇌로 사고    와 커뮤니케이션을 하고  자신의 육체를 스스로 기계화하는 것이 가능한 시대  인간과 사이보그 육체를 기계화한 인간   인간형 로봇이 공존하는 사회  테러를 막는 정부 직속기관 공안  과의 형사  버트 는 대부분의 신체를 기계화 한  사이보그   그가 인간이라는 증거는 뇌의 일부분과  년 전 자신의 파트너였으나 실종된  쿠사나기 라는 한 여성에 대한 기억 뿐이다  버트는 최근에 파트너가 된  토그사 와 함께 각종 사이버 테러와 통제를 벗어난 로봇에 대한 사건을 수사하고 있다  어느날  섹스 전용으로 프로그래밍 된 가이노이드 소녀형 로봇 가 갑자기 이상을 일으키며  인간들을 살해하는 사건이 발생한다  버트와 토그사는 이 로봇을 만들어낸 제조업체  로커스 솔루스  의 내력을 조사하던 중  인간이란 무엇인가   인간은 왜 로봇을 인간의 모습과 감정을 지닌 존재로 만들려고 하는가  등에 대한 화두를 던지는 다양한 인물들을 만나게 된다  스스로 자살을 선택한 안드로이드  로봇에 더 가까워 진 여성  축제 기간에 인형 로봇 을 불태우는 인간들  스스로 육체를 버리고 네트에 융합해 인간을 초월했다고 자만하는 남자    이들을 통해 버트는 살인 사건의 진실에 점점 다가간다 ,sf_fantasy
3,라이프,인류 역사상 가장 위대한 발견을 한  인의 우주인 화성에서 발견한 생명체의 등장에 지구 전체가 들뜨지만  생명체가 움직이기 시작하자 위대한 발견은 곧 가장 위험한 존재가 된다  순식간에 인류를 위협하는 지능과 능력을 지닌 존재로 진화한 생명체   억 인류를 구하기 위해  인의 우주인은 결국 목숨을 건 선택의 기로에 놓이게 된다 ,sf_fantasy
4,백 투 더 퓨쳐 2,브라운 박사                            코리스토퍼 로이드 분 와   년 후의 미래로 온 마티              마이클    폭스 분 와 제니퍼                  엘리자베스 슈 분   그러나 제니퍼는 타임머쉰과 미래세계에 자신이 있음에 놀라 기절한다  아들을 깽들로부터 구하고 기절한 제니퍼를 데리고 다시 현대로 돌아온 마티와 브라운 박사는 그러나 뒤죽박죽된 세상에 소스라치게 놀란다  아버지는 묘지에 묻혀 있고 어머니는 마티의 집에서 일하던 밥과 원치 않은 결혼을 해 으리으리한 집에 살고 있다  바로 미래에 갔던 마티와 브라운의 타임머신을 그곳에 있던 늙은 밥이 훔쳐타고 그간에 있었던 스포츠 게임의 승부전이 있는 잡지를   년 전 과거의 젊은 밥                    토마스    윌슨 분  자신에게 주어 도박으로 일약 부자가 된 것이다 ,sf_fantasy
5,어메이징 스파이더맨 2(2.35:1 극장판),스파이더맨의 삶에 완전  적응한 피터 파커 앤드류 가필드 는 거미줄로 뉴욕을 활강하며 위험에 처한 시민들을 구해주고 사랑하는 연인 그웬 엠마 스톤 과 데이트를 즐기며 행복하게 살아간다  그러던 어느 날  스파이더맨의 열렬한 팬이자 오스코프사의 전기 엔지니어인 맥스 제이미 폭스 는 작업 중 치명적인 사고로 자신에게 엄청난 능력이 생긴 것을 발견한다  하지만 이 능력으로 인해 뉴욕을 마비시킨 대규모 정전사태가 발생하고 사태를 해결하기 위해 나선 자신의 영웅 스파이더맨에게 공격을 당하자 배신감을 느끼고 분노한다  여기에 해리 오스본 데인 드한 은 맥스에게 자신과 함께 스파이더맨에게 복수를 하자며 손을 내미는데   더욱 강력해진 적들의 등장  진짜 전쟁은 지금부터다 ,sf_fantasy
6,유령 신부,지루한 일상에 비해 활기가 넘치는 지하세계  인간들에 비해 더욱 생동감 넘치는 유령들의 축제 등 감독 특유의 기이하고 몽환적인 상상의 세계가 놀랄 만큼 흥미롭게 펼쳐진다  여기에 팀 버튼의 영원한 단짝 조니 뎁을 비롯해 헬레나 본햄 카터  에밀리 왓슨  알버트 피니  크리스토퍼 리 등 연기파 배우들의 목소리 출연이 작품에 생기를 불어 넣는다  특   배우들과 꼭 닮은 모습의 캐릭터들은  유령신부 가 즐거운 또 하나의 이유이다  결혼이 두려운 소심한 신랑 빅터 조니 뎁 가 겪는 환상적인 이야기  결혼식을 하루 앞둔 빅터는 예행연습에서 계속 실수를 하자 밖으로 뛰쳐나간다  숲 속에서 홀로 연습하던 도중  땅 위로 튀어나온 손가락 뼈에 반지를 끼웠다가 유령신부 헬레나 본햄 카터 의 오해로 지하세계에 끌려가게 되는 색다른 경험을 하게 되는 것이다 ,sf_fantasy
7,무드 인디고,당신의 사랑은 어떤 색인가요         칵테일을 제조하는 피아노를 발명해 부자가 된 콜랭과 당대 최고의 철학가 장 솔 파르트르에게 빠진 그의 절친 시크  두 사람은 우연  클로에와 알리즈를 만나게 되면서 운명과도 같은 사랑을 시작한다          서툴지만 진실된 고백으로 클로에와 결혼에 성공한 콜랭  반면 시크는 알리즈와 함께 파르트르의 강연에 다니고  그의 물건을 수집하는 등 값비싼 열정을 이어간다        그러던 어느 날  콜랭은 클로에의 폐에 수련이 자라고 있다는 청천벽력 같은 소식을 듣게 되고  치료를 위해 전재산을 바치기에 이른다  한편  시크는 콜랭이 결혼자금으로 건넨 돈마저 파르트르 물건 수집에 모두 써버리고  이런 그에게 알리즈는 점점 지쳐간다             사랑하는 이를 위해 난생 처음 험난한 노동을 시작한 콜랭과 우상에 미쳐 사랑을 등진 시크  마침내 두 사람의 사랑에 대한 환상은 색을 점점 잃어가는데 ,sf_fantasy
8,NULL,NULL,sf_fantasy
9,신비한 동물들과 그린델왈드의 범죄, 뉴트 스캐맨더  에디 레드메인 의 활약으로 강력한 어둠의 마법사  겔러트 그린델왈드  조니 뎁 가 미합중국 마법부       에 붙잡 지만  이내 장담했던 대로 탈출해 추종자를 모으기 시작한다  순혈 마법사의 세력을 모아 마법을 사용하지 않는 사람들을 지배하려는 그린델왈드의 야욕을 막기 위해  알버스 덤블도어  주드 로 는 제자였던 뉴트에게 도움을 요청한다  마법사 사회는 점점 더 분열되어 가는 가운데  앞날의 위험을 알지 못한 채 뉴트는 이를 승낙하는데 ,sf_fantasy
10,워크래프트: 전쟁의 서막,두 개의 운명  하나의 세계 공존할 것인가  맞설 것인가   서로 다른 차원에 살고 있던 인간과 오크  오크의 행성이 황폐해지기 시작하자  이들은 인간의 행성으로 넘어와 새로운 왕국을 건설하려 한다  생존을 위해 서로의 도움이 필요하다고 믿는 인간 종족의 영웅  로서 와 오크 종족의 영웅  듀로탄   하지만  공존에 반대하는 또 다른 세력이 분열되면서 두 진영은 더 큰 혼란에 빠지게 되는데   세상의 운명을 건 피할 수 없는 전쟁이 시작된다 ,sf_fantasy
11,마스크,에지 시             은행에서 단조로운 일상을 보내고 있던 평범한 은행원 스탠리  어느날 그는 우연한 기회로 고대 시대의 유물인 마스크를 발견한다  그런데 이 마스크는 아주 신비로운  을 가지고 있다  스탠리가 마스크를 쓰면 초인적인  을 가진 불사신이 된다  스탠리는 나이트클럽 가수인 티나를 사랑하지만 그녀는 악당 조직 보스의 정부다  스탠리의 마스크 때문에 여러가지 소동이 일어나고 경찰은 스탠리를 뒤쫓는다  티나가 보스를 사랑하지도 않으며 빠져나올 기회만을 노리고 있다는 것을 알고 그녀를 돕는다  스탠리의 마스크 때문에 일어난 여러가지 소동으로 경찰은 그를 추적하고 엎친데 덮친격으로 조직까지 가세  쫓고 쫓기는 사건이 벌어진다  조직의 사주를 받은 어느 여기자에 의해 정체가 탄로난 스탠리는 조직에게 마스크를 빼앗기고 조직의 보스는 마스크를 이용하여 도시의 세력을 장악 하려고 한다  이때부터 스탠리는 이들의 음모에 홀로 맞서는데 ,sf_fantasy
12,NULL,NULL,sf_fantasy
13,능력소녀,어떤 교실  전교  등으로 부러움을 한 몸에 받는  능력소녀  공미나와 반에서 존재감마저 없는  무능력소녀  맹주리  어느 날 갑자기  미나의 눈꺼풀이 감기지 않고 주리에겐 몰랐던 능력이 찾아오는데  이들 십대 소녀들에게 펼쳐지는 의외의 일들은 모두를 경악케 한다    제  회 서울독립영화제 ,sf_fantasy
14,시크릿 가든,한 순간 부모를 잃고 혼자가 되어 이모부  아치볼드  콜린 퍼스 의 대저택에 보내진 고집불통 소녀  메리  딕시 에저릭스    아치볼드 는  메리 에게 그녀의 방 외에는 허락없이 들어가지 말라고 경고하지만 호기심 많은  메리 는 남몰래 저택을 돌아다니다 오랫동안 감춰져 있던 비밀의 문을 발견한다  그 너머엔 지금껏 본 적 없는 신비롭고 아름다운 정원이 숨겨져 있었는데     굳게 닫  정원의 문이 열리는 순간 마법 같은 일들이 펼쳐진다 ,sf_fantasy
15,몬스터 호텔 3,평생 몬스터 호텔을 지키며 단 하루도 쉴 틈이 없었던 몬스터 호텔 주인 드라큘라  드락    아빠의 생애 첫 휴가를 위해 딸  마비스 는 일생일대 크루즈 가족 여행을 계획하고  여름을 맞이한 몬스터 호텔 가족들은 인간 세상으로 생애 첫 바캉스를 떠난다   시작부터 좌충우돌인 바캉스에서  드락 은 미모의 크루즈 선장  에리카 에게 첫눈에 반하고  급기야 그녀의 무시무시한 비밀이 밝혀지면서 완벽했던 몬스터 호텔 가족들의 휴가는 오싹한 악몽으로 뒤바뀌는데   그래서 진짜 휴가는 언제 가는 거죠 ,sf_fantasy
16,신데렐라(패키지상품 : 더빙판 추가증정),친절하고 상냥한 아릉다운 아가씨 신데렐라는 맘씨 나쁜 새 엄마와 시기심 많은 언니들의 구박을 받으면서도 희망을 잃지 않았다  친구들이라고는 거스와 자크같은 생쥐뿐이지만 그들은 무슨 일이든 신데렐라를 도왔고  왕자님의 무도회가 열리던 날에는 착한 요정이 나타나 신데렐라에게 아름다운 드레스와 호박으로 만든 마차를 준비해 주었을 때에도 말이 되어 신데렐라와 동행한다  궁정의 무도회에 참석해서 멋진 왕자님을 만난 신데렐라  하지만  시계가   시를 가리키자 마법은 풀려나고 신데렐라는 유리구두 한짝을 떨군 채 왕자님에게 인사도 못하고 도망치듯 궁전을 빠져나온다  신데렐라의 이름도 모른 채 헤어진 왕자는 유리구두에 발이 맞는 아가씨를 찾아 온 나라의 아가씨에게 유리 구두를 신켜 보고 마침내 신데렐라의 집에서 신데렐라를 찾아낸다 ,sf_fantasy
17,매트릭스 2 - 리로디드, 편의 엔딩 크레딧과 함께 인류를 구원해야 하는 자신의 운명을 받아들이며 하늘로 날아오른 네오 키아누 리브스   내일 이 전쟁이 끝난다면  한번 싸워 볼만하지 않을까     목숨도 걸어 볼만 하지 않을까     모피어스 로렌스 피쉬번 와 트리니티 캐리 앤 모스 가 전에 자신에게 던졌던 질문을 스스로에게 던져보는 네오는 마침내  중대한 결정을 내린다  시온이 컴퓨터 군단에게 장악될 위기에 처하면서  네오는 자신의 능력에 대한 더 큰 통제력을 갖게 된다  이제 몇시간 후면 지구상에 남은 인류 최후의 보루인 시온이 인간 말살을 목적으로 프로그래밍 된 센티넬 무리에 의해 짓밟 게 될 터    그러나 시온의 시민들은 오라클의 예언이 이루어져 전쟁이 끝날 것이라는 모피어스의 신념에 용기를 얻고  네오에게 모든 희망과 기대를 걸어보기로 한다  서로에 대한 사랑의  으로  스스로에 대한 믿음으로 용기를 얻은 네오와 트리니티는 모피어스와 함께 인간을 억압하고 착취하는 시스템에 맞서기 위해  매트릭스 로 돌아간다  그리고  수소문 끝에 매트릭스의 심장부로 그들을 안내할  키메이커 의 행적을 찾아낸 트리니티와 모피어스  하지만   키메이커 는 신출귀몰한 악당 트윈스에게 철저하게 감시당하고 있다  시스템에 대항하기 위해  키메이커  구출이라는 위험한 임무를 감행하는 세 사람  한편  에이전트 스미스 휴고 위빙 는 네오에 대한 불타는 복수심으로 시스템에 불복종하게 되고  그 결과 삭제될 위기에 처한다  이제 그는 도망자의 신세가 되어  계속 네오를 추적한다  한때 자신이 그토록 경멸했던 인간성을 어느새 자기 자신도 갖게된 스미스는 복수를 위해 수단 방법을 가리지 않는데     매트릭스 의 내부 구조로 깊이 들어갈수록  그리고  인류의 운명을 좌우할 자신의 역할에 눈 떠 갈수록  네오는 더 큰 저항과 더 무서운 진실에 직면하게 된다  그리고 상상할 수 없는 불가능에 가까운 선택을 강요 받는다  사랑과 신념  목적과 명분    이 모든 것의 합류점에서 네오는 자신이 택한 길을 따라가야 한다  그는 자문한다   만약 내가 못해낸다면       만약 실패한다면      대답은 한가지 뿐이다  시온이 멸망할 것이라는 것  그리고 마침내    인류의 운명을 건 필사의 전투가 시작된다  ,sf_fantasy
18,NULL,NULL,sf_fantasy
19,NULL,NULL,sf_fantasy
20,신과함께-인과 연,천 년 동안   명의 망자를 환생시킨 저승 삼차사  한 명만 더 환생시키면 그들도 새로운 삶을 얻을 수 있다  하지만 강림 하정우 은 원귀였던 수홍 김동욱 을 자신들의 마지막 귀인으로 정하는 이해할 수 없는 선택을 한다  저승법 상 원귀는 소멸되어야 마땅하나 염라대왕 이정재 은 저승 삼차사에게 새로운 조건을 내걸며 강림의 제안을 수락한다  염라의 조건은 성주신 마동석 이 버티고 있어 저승 차사들이 가는 족족 실패하는 허춘삼 노인을 수홍의 재판이 끝나기 전까지 저승으로 데려오는 것   허춘삼을 데리러 이승으로 내려간 해원맥 주지훈 과 덕춘 김향기   하지만 성주신의 막강한   앞에 속수무책으로 당하기만 하던 중 우연  그가 천 년 전 과거에 해원맥과 덕춘을 저승으로 데려간 저승 차사였다는 사실을 알게 된다  스스로도 기억 못 하는 과거에 대한 호기심으로 해원맥과 덕춘은 성주신과 거래를 시작하는데   이승과 저승  현재와 과거를 오가는 천 년의 비밀이 밝혀진다 ,sf_fantasy
21,진격의 거인 파트 2,거인들의 무차별 살상  희망이 사라진 세계  세계의 멸망을 부르는 것은 거인인가  인간인가  정체를 알 수 없는 거인의 숨겨진 비밀이 드러나고  인류멸망에 맞선 최후의 사투가 시작된다 ,sf_fantasy
22,라스트 위치 헌터,   년 전  유럽 전역에 흑사병을 일으킨 마녀  위치 퀸 과의 전쟁 중 영생불사의 저주를 받은  코울더   그는 현재  언젠가 다시 만날  위치 퀸 을 기다리며 사람들 틈 속에서 숨어 최고의 마녀 사냥꾼으로 살아간다  어느 날  수상해진 마녀들의 움직임 속에  위치 퀸 의 부활을 감지한  코울더   멸망으로부터 인류를 보호하기 위한 유일한 방법은  위치 퀸 의 심장을 손에 넣는 것   과연  최고의 마녀 사냥꾼  코울더 는  위치 퀸 을 제거할 단 한번의 기회를 잡을 수 있을 것인가  ,sf_fantasy
23,스타트렉 다크니스,우주를 항해하던 거대함선     엔터프라이즈호를 이끌고 귀환한  커크  함장 크리스 파인   하지만 누군가의 무자비한 공격으로 인해 전세계는 거대한 위기에 빠지고  스타플릿 내부까지 공격 당하며 공포와 충격은 더욱 커져만 간다  테러의 주인공이 다름아닌 스타플릿의 최정예 대원  존 해리슨  베네딕트 컴버배치 라는 사실이 밝혀지고  그의 분노가 극대화될 수록 세상은 걷잡을 수 없는 혼란에 휩싸이기 시작한다  내부의 적에 의해 절체절명의 위기를 맞게 된 엔터프라이즈호  커크 함장과 대원들은 초토화된 전쟁터 한복판에서 인류의 미래가 걸린 선택의 기로에 놓이게 되는데        인류 최대의 위협  그의 분노를 막아라 ,sf_fantasy
24,노아,타락한 인간 세상에서 신의 계시를 받은 유일한 인물  노아  러셀 크로우    그는 대홍수로부터 세상을 구할 수 있는 거대한 방주를 짓기 시작한다   방주에 탈 수 있는 이는 생명이 있는 모든 존재의 암수 한 쌍과 노아의 가족들 뿐   하지만 세상 사람들은  노아 의 방주를 조롱하기 시작하고  가족들간의 의견 대립마저 생겨나는데    세상을 집어삼킬 대홍수의 시작   가족과 새로운 세상을 지켜내기 위한  노아 의 드라마틱한 삶이 펼쳐진다 ,sf_fantasy
25,브이 포 벤데타,미래  제 차 세계대전이 일어난 후     년 영국  정부 지도자와 피부색  성적 취향  정치적 성향이 다른 이들은  정신집중 캠프 로 끌려간 후 사라지고  거리 곳곳에 카메라와 녹음 장치가 설치되어 모든 이들이 통제를 받으며 살아가고 있다  그러나 어느 누구도 세상이 잘못되었다고 생각하지 않는 평온한 삶을 유지한다  어느 날 밤   이비 라는 소녀가 위험에 처하자 어디선가 한 남자가 나타나 놀라운 전투력으로 그녀의 목숨을 구해준다  옛날  국회의사당을 폭파하려다 사형당한 가이 포크스의 가면을 쓰고 뛰어난 무예와 현란한 두뇌회전  모든 것을 압도하는 카리스마를 가진 남자는    라는 이니셜로만 알려진 의문의 사나이  세상을 조롱하는 셰익스피어의 희곡  맥베스  헨리  세 의 대사들을 인용하고  분열되고 투쟁하는 현실세계의 아픔을 노래한 윌리엄 블레이크의 시를 읊으며 악을 응징하는 브이는 자신을 따르는 이들을 모아 폭력과 압제에 맞서 싸우며 세상을 구할 혁명을 계획하고 있다  브이의 숨겨진 과거를 알아가는 동안 자신에 관한 진실을 깨달아가는 이비는 점점 브이에게 이끌려 그의 혁명에 동참하게 된다  과연 그들은 자신들의  으로 왜곡된 세계의 질서를 바로 잡을 수 있을 것인가 ,sf_fantasy
26,터미네이터 2:오리지널,미래  인류와 기계의 전쟁은 계속 되는 가운데 스카이넷은 인류 저항군 사령관 존 코너를 없애기 위해 액체 금속형 로봇인       을 과거의 어린 존 코너에게로 보낸다   미래의 인류 운명을 쥔 어린 존 코너  스카이넷의       은 거침없이 숨 가쁜 추격을 시작하는데 ,sf_fantasy
27,몬스터 콜,기댈 곳 없이 빛을 잃어가던 소년  코너   어느 날 밤   코너 의 방으로 상상 속에서만 존재하던 거대한  몬스터 가 찾아온다   코너 는 매일 밤 그를 만나 이야기를 나누면서 외면했던 마음 속 상처들을 마주하게 되는데 ,sf_fantasy
28,후크,피터 배닝은 기반을 갖춘   세의 미국인 변호사이며  사랑하는 아내와 남매가 있는 그야말로 부러울것 없는 사내  하나 그는 사업에만 몰두하고 가족들의 일엔 점점 소홀해진다  아들 잭의 야구 시합에도 사업 때문에 참석하지 못한다  한편 아내 모이라와 할머니인 웬디는 평생동안 고아들을 위해 헌신하였고  피터 배닝도 웬디가 데려다 키운 고아 출신  피터는 웬디에게 바치는 고아병원 개원식에 연설을 하러 런던으로 비행기를 타고 떠나는데  실은 그는 고소 공포증 환자이다    년만에 찾는 피터를 웬디는 따뜻하게 맞이하고 피터는 성공리에 연설을 마치는데 딴 세상인 마법섬에서 온 후크선장은 피터 배닝의 남매인 잭과 매기를 납치한다  웬디는 피터의 과거시절인 피터 팬의 기억을 일깨워 주려 노력하지만  피터는 자신의 과거가 기억나지 않는다  한편 요정 팅거벨은 피터를 마법섬으로 데려가고  거기서 피터는 무모하게 나서다 후크선장에게 잡 고 만다  후크는 피터에게 날아보라면서 조롱하나 아직도 피터는 마법섬의 세계와 현실을 구분하지 못한다  위기의 순간 팅거벨은 후크 선장에게  일간의 여유를 주면 옛날의 피터팬으로 변하게 할테니 그때 정정당당  싸우자고 한다  순간의 자만에 도취된 나머지 후크는 피터를 놓아준다  팅거벨의 도움으로 위기를 벗어난 피터는 이전의 동료들인 마법섬의 고아들과 같이 훈련하면서 자신의 기억을 찾으려 애를 쓰는데  후크의 부하인 스미는 피터 자식들을 후크선장의 편으로 만들면 피터팬에게 더할 나위없는 복수가 될 것이라 설득하여  피터의 아들 잭에게 여태 피터가 소홀이 한점을 이용하여 끈질기게 설득하여 자신의 편으로 만든다  피터는 기억들을 되찾고  행복한 생각 을 하여 드디어 나는데 성공한다  또한 요정 팅거벨을 사랑하게 된다  이윽고 약속한 날이되어 맞서게 된 후크선장과 피터팬  피터팬은 아들 잭이 후크의 편이 되어 있는 것을 보고 충격을 받으나  후크선장을 물리치고 사랑으로 아들과 딸을 되찾는다 ,sf_fantasy
29,팟 제너레이션,임신 출산     이제는 팟이 대신 낳아드립니다   기술이 자연을 능가하게 된 머지않은 미래  거대 테크회사 임원 레이철은 승진하면서 모두가 탐내는 최첨단 자궁센터의 예약 기회를 얻는다  인공 자궁인  팟 을 통해 임신과 출산이 편리해지고 평등하게 공유할 수 있는 경험이 된 것  흙과 자연을 사랑하는 식물학자 남편 앨비는 이  자연스럽지  못한 과정에 반기를 들지만  이내 레이철에 대한 사랑으로 팟 출산을 감행하기로 한다  알을 닮은 인공 자궁 팟  모니터링 앱     상담사까지  상상할 수 없던  팟 제너레이션  부모 되기 여정이 지금 펼쳐진다 ,sf_fantasy
