,title,synopsis,category
0,업(패키지상품 : 더빙판 추가증정),평생 모험을 꿈꿔 왔던  칼  할아버지는 수천 개의 풍선을 매달아 집을 통째로 남아메리카로 날려 버리는데   칼  할아버지의 이 위대한 모험에 초대 받지 않은 불청객이 있었으니  바로 황야의 탐험가  러셀   지구상에 둘도 없을 이 어색한 커플이 함께 하는 대모험  그들은 과연 남미의 잃어버린 세계에서 사라져 버린 꿈과 희망  행복을 다시 찾을 수 있을까 ,animation
1,극장판 짱구는 못말려: 격돌! 낙서왕국과 얼추 네 명의 용사들,아이들의 낙서가 사라져 붕괴 위기에 처한 낙서왕국은 낙서 에너지를 모으기 위해 지구 침공을 시작한다   낙서왕국의 위험한 작전을 막기 위해 지상의 용사로 선택 받은 짱구는 그림에 생명을 불어넣는  미라클 크레용 을 얻게 된다   쓰윽 쓰윽  그려 그려   짱구가 미라클 크레용으로 그림을 그리자 브리프  가짜 이슬이 누나  부리부리 용사가 스케치북 밖으로 튀어나오는데     과연  크레용 용사 짱구는 낙서 용사들과 함께 위험에 빠진 떡잎마을과 세계를 구할 수 있을까  ,animation
2,플레이모빌: 더 무비,진짜 장난감 세계에 빠지게 된 남매에게 이상한 나라의 앨리스보다 더 다양하고 판타지한 토이 어드벤처가 기다리고 있다  로봇  시크릿 에이전트  바이킹  요정  공룡 그리고 또  ,animation
3,소중한 날의 꿈,달리기에서만은 한 번도 져 본적 없던 이랑은 계주에서 처음으로 상대에게 추월당하자 지지 않기 위해 일부러 넘어진다  그 후  이랑은 육상부 선생님의 끈질긴 설득에도 불구하고 지는 것이 두려워 달리기를 하지 않게 된다  어느 날 이랑은 레코드 가게에서 서울에서 온 전학생 수민을 만나 친구가 된다  수민은 얼굴도 예쁘고 어른스러워서 남학생들에게 인기가 많다  이랑은 항상 자신감 넘치는 수민을 보며 잘하는 것 하나 없는 스스로에 대해 고민하기 시작한다  어느 날 학교에서 철수라는 남학생이 비행실험을 하다 추락해 다치는 소동이 일어나고 이랑은 철수에게 호기심을 갖게 된다  그러던 중 읍내에 고장 난 라디오 수리를 맡기러 간 이랑은 그 전파사에서 삼촌 대신 수리를 하고 있는 철수를 만난다  두 사람은 비행실험에 대해 이야기를 나누며 가까워진다  철수는 비행과 우주탐사에 대한 꿈을 이야기하고 이랑은 열정적으로 노력하는 철수를 보며 설렌다  한편  꿈과 재능이 넘치는 수민과 철수를 만나며 이랑은 자신의 미래에 대해 더욱 고민하게 되는데   ,animation
4,"모아나(패키지상품 : 더빙판 추가증정, 코멘터리+부가영상 제공)",모든 것이 완벽했던 모투누이 섬이 저주에 걸리자 바다가 선택한 소녀 모아나는 섬을 구하기 위해 머나먼 항해를 떠난다  저주를 풀기 위해서는 오직 신이 선택한 전설의 영웅 마우이의  이 필요한 상황  모아나는 마우이를 우여곡절 끝 설득해  운명적 모험을 함께 떠나는데   바다가 부르면 운명적 모험이 시작된다 ,animation
5,너의 이름은.(2023 재더빙판),꿈 속에서 몸이 뒤바뀐 도시 소년  타키 와 시골 소녀  미츠하   만난 적 없는 두 사람이 만들어가는 기적과 사랑에 관한 이야기  너의 이름은    잊고 싶지 않은 사람 잊으면 안 되는 사람 너의 이름은 ,animation
6,NULL,NULL,animation
7,겨울왕국 2(패키지: 자막판+더빙판+싱어롱+부가영상),어느 날 부턴가 의문의 목소리가 엘사를 부르고  평화로운 아렌델 왕국을 위협한다  트롤은 모든 것은 과거에서 시작되었음을 알려주며 엘사의  의 비밀과 진실을 찾아 떠나야한다고 조언한다   위험에 빠진 아렌델 왕국을 구해야만 하는 엘사와 안나는 숨겨진 과거의 진실을 찾아 크리스토프  올라프 그리고 스벤과 함께 위험천만한 놀라운 모험을 떠나게 된다  자신의  을 두려워했던 엘사는 이제 이 모험을 헤쳐나가기에 자신의  이 충분하다고 믿어야만 하는데   두려움을 깨고 새로운 운명을 만나다 ,animation
8,씽2게더,대국민 오디션 이후 각자의 자리에서 꿈을 이루고 있는 버스터 문 매튜 맥커너  과 크루들에게 레드 쇼어 시티에서 전 세계가 주목하는 사상 최고의 쇼가 펼쳐진다는 소식이 들려오고 버스터 문과 크루들은 도전에 나선다   그러나 최고의 스테이지에 서기 위한 경쟁은 이전과는 비교도 할 수 없을 만큼 치열하고  버스터 문은 완벽한 라이브를 위해 종적을 감춘 레전드 뮤지션 클레이 보노 를 캐스팅하겠다는 파격 선언을 하는데 ,animation
9,플레이모빌: 더 무비,진짜 장난감 세계에 빠지게 된 남매에게 이상한 나라의 앨리스보다 더 다양하고 판타지한 토이 어드벤처가 기다리고 있다  로봇  시크릿 에이전트  바이킹  요정  공룡 그리고 또  ,animation
10,토이 스토리 4(세트: 1~4편),장난감의 운명을 거부하고 떠난 새 친구  포키 를 찾기 위해 길 위에 나선  우디 는 우연  오랜 친구  보핍 을 만나고 그녀를 통해 새로운 세상에 눈을 뜨게 된다  한편   버즈 와 친구들은 사라진  우디 와  포키 를 찾아 세상 밖 위험천만한 모험을 떠나게 되는데 ,animation
11,극장판 짱구는 못말려: 신혼여행 허리케인~ 사라진 아빠!,아름다운 호주의 한 섬으로 신혼여행을 떠난 짱구네 가족  즐거운 시간도 잠시  수수께끼 원주민 가면족에게 사로잡혀 아빠가 사라진다   이 섬에는   년에 한 번 엄청난 보물을 얻을 수 있다는 전설이 있는데  그 보물을 여는 열쇠가 바로 아빠라고  여기에 보물을 노리는 트레저 헌터들까지 합세해 치열한 아빠 쟁탈전이 벌어지는데     위기에 처한 짱구네 가족은 무사  아빠를 되찾을 수 있을까 ,animation
12,장화신은 고양이: 끝내주는 모험,아홉 개의 목숨 중 단 하나의 목숨만 남은 장화신은 고양이  마지막 남은 목숨을 지키기 위해  어로의 삶 대신 반려묘의 삶을 선택한 그에게 찾아온 마지막 기회  바로 소원을 들어주는 소원별이 있는 곳을 알려주는 지도   잃어버린 목숨을 되찾고 다시  어로가 되기를 꿈꾸는 장화신은 고양이는 뜻밖의 동료가 된 앙숙 파트너  키티 말랑손   그저 친구들과 함께 라면 모든 게 행복한 강아지  페로 와 함께 소원별을 찾기 위해 길을 떠난다  그리고 소원별을 노리는 또 다른 빌런들과 마주치게 되는데   새해를 여는 끝내주는 모험이 시작된다 ,animation
13,드래곤 길들이기 3,영원한 친구  컵과 투슬리스의 활약으로 사람과 드래곤이 공존하며 평화롭게 살아가는 버크섬  새로운 드래곤  라이트 퓨어리 를 쫓아간 투슬리스를 찾다가  컵은 누구도 찾지 못했던 드래곤의 파라다이스   든월드 를 우연  발견하게 된다  하지만 평화도 잠시  역대 최악의 드래곤 헌터 그리멜의 등장으로 드래곤들의 안전과 버크섬의 평화까지 위협받기 시작하는데 ,animation
14,월-E(패키지상품 : 더빙판 추가증정), 니모를 찾아서 의 감독과  카 와  라따뚜이 를 탄생시킨 작가들이 다시 한 번 손을 잡았다  당신을 그리 멀지 않은 은하계로 데려가 새로운 모험을 경험하게 해줄 애니메이션  텅 빈 지구에서 수백년 동안 혼자 쓰레기를 수거하던 호기심 많고 사랑스러운 로봇 월  에게 삶의 소중한 목표가 생겼다  탐사로봇 이브를 만나게 된 월  의 짜릿하고 상상이 넘치는 웃음 넘치는 환성적인 대모험 ,animation
15,스파이더맨: 뉴 유니버스(부가영상 추가증정),평범한   대  마일스 모랄레스 는 우연  방사능 거미에 물려 스파이더맨 능력을 가지게 된다  혼란스러워하던  마일스 는 악당과 싸우고 있는  피터 파커 를 마주치게 되고  피터 파커 는  마일스 가 자신과 같은 능력을 가지고 있음을 직감한다  여러 개의 평행세계가 존재한다는 것을 알게 된  마일스 와  피터 파커 는 이후 스파이더우먼  스파이더 그웬    스파이더맨 누아르    스파이더햄  등 평행세계 속 공존하는 모든 스파이더맨들을 만나게 되는데  하나의 유니버스에서 만나 팀을 결성한 스파이더맨들은 과연 세계를 구할 수 있을까   스파이더맨들의 새로운 시대가 열린다 ,animation
16,센과 치히로의 행방불명,금지된 세계의 문이 열렸다   이사 가던 날  수상한 터널을 지나자 인간에게는 금지된 신들의 세계로 오게 된 치 로   신들의 음식을 먹은 치 로의 부모님은 돼지로 변해버린다    걱정마  내가 꼭 구해줄게    겁에 질린 치 로에게 다가온 정체불명의 소년 하쿠  그의 따뜻한 말에  을 얻은 치 로는 인간 세계로 돌아가기 위해 사상 초유의 미션을 시작하는데 ,animation
17,라따뚜이(패키지상품 : 더빙판 추가증정),절대미각  빠른 손놀림  끓어 넘치는 열정의 소유자  레미   프랑스 최고의 요리사를 꿈꾸는 그에게 단 한가지 약점이 있었으니  바로 주방 퇴치대상  호인  생쥐 라는 것  그러던 어느 날  하수구에서 길을 잃은 레미는 운명처럼 파리의 별 다섯개짜리 최고급 레스토랑에 떨어진다  그러나 생쥐의 신분으로 주방이란 그저 그림의 떡  보글거리는 수프  둑닥둑닥 도마소리  향긋한 허브 내음에 식욕이 아닌  요리욕 이 북받친 레미의 작은 심장은 콩닥콩닥 뛰기 시작하는데  쥐면 쥐답게 쓰레기나 먹고 살라는 가족들의 핀잔에도 굴하지 않고 끝내 주방으로 들어가는 레미  깜깜한 어둠 속에서 요리에 열중하다 재능 없는 견습생  링귀니 에게  딱  걸리고 만다  하지만 해고위기에 처해있던 링귀니는 레미의 재능을 한눈에 알아보고 의기투합을 제안하는데  과연 궁지에 몰린 둘은 환상적인 요리 실력을 발휘할 수 있을 것인가  레니와 링귀니의 좌충우돌 공생공사 프로젝트가 아름다운 파리를 배경으로 이제 곧 펼쳐진다 ,animation
18,NULL,NULL,animation
19,엔칸토: 마법의 세계(패키지: 자막판+더빙판+싱어롱+부가영상),콜롬비아의 깊은 산 속  놀라운 마법과 활기찬 매력이 넘치는 세계  엔칸토    그 곳에는 특별한 능력을 지닌 마드리갈 패밀리가 살고 있다    엔칸토 의 마법 덕분에 초인적    치유하는   등 저마다 특별한 능력을 가지고 태어난 마드리갈 패밀리  하지만  미라벨 은 가족 중 유일하게 아무런 능력이 없다   어느 날   엔칸토 를 둘러싼 마법의  이 위험에 처하자  미라벨 은 유일하게 평범한 자신이 특별한 이 가족의 마지막 희망일지 모른다고 생각하는데    평범한  미라벨 은 과연 기적을 만들 수 있을까   전 세대 관객들에게 따뜻한 웃음과 감동을 선사할 마법 같은 영화  디즈니의 매직이 또 한 번 시작된다,animation
20,빅 히어로(패키지: 자막판+더빙판),천재 공학도  테디 가 개발한  링로봇  베이맥스     테디 의 동생이자 로봇 전문가인   로 는 도시가 파괴될 위기에 처하자   베이맥스 를 슈퍼 어로로 업그레이드 하는데   과연 이들은 도시의 위험을 막아낼 수 있을까 ,animation
21,라푼젤(패키지: 자막판+더빙판),올드보이도 못 견뎠을 장장  년을 탑 안에서만 지낸 끈기만점의 소녀 라푼젤  어느 날 자신의 탑에 침입한 왕국 최고의 대도를 한방에 때려잡는다  그리고 그를 협박해 꿈에도 그리던 집밖으로의 모험을 단행한다  과잉보호 모친의 영향으로 세상을 험난한 곳으로만 상상하던 라푼젤  그런 그녀 앞에 군기 빡 쎈 왕실 경비마 맥시머스의 추격  라이더에게 복수의 칼날을 가는 스태빙턴 형제의 위협  라푼젤의 가짜 엄마 고델의 무서운 음모 등이 얽 고 설켜 점점 흥미진진한 사건들이 터지기 시작한다  그러나 세상물정 깜깜한 우리의 라푼젤은 자신 앞에 펼쳐진 스릴 넘치는 세상을 맘껏 즐기는데   ,animation
22,천로역정: 천국을 찾아서,희망도  기쁨도 없는 멸망도시에서 살아가던  크리스천 은 어느 날  한 권의 책을 통해 천국도시가 존재하며  곧 멸망도시가 불바다로 변할 것이라는 사실을 알게 된다   바깥세상은 죽음뿐이라는 모두의 만류를 뒤로하고  크리스천 은 천국도시를 찾아서 모험의 길로 접어 드는데 ,animation
23,장화신은 고양이: 끝내주는 모험,아홉 개의 목숨 중 단 하나의 목숨만 남은 장화신은 고양이  마지막 남은 목숨을 지키기 위해  어로의 삶 대신 반려묘의 삶을 선택한 그에게 찾아온 마지막 기회  바로 소원을 들어주는 소원별이 있는 곳을 알려주는 지도   잃어버린 목숨을 되찾고 다시  어로가 되기를 꿈꾸는 장화신은 고양이는 뜻밖의 동료가 된 앙숙 파트너  키티 말랑손   그저 친구들과 함께 라면 모든 게 행복한 강아지  페로 와 함께 소원별을 찾기 위해 길을 떠난다  그리고 소원별을 노리는 또 다른 빌런들과 마주치게 되는데   새해를 여는 끝내주는 모험이 시작된다 ,animation
24,명탐정 코난: 비색의 탄환,위험천만한 아카이 일가  대집결  그들이 모두 모일 때  운명은 뒤바뀐다   전 세계인의 축제                        의 개최를 앞둔 일본  이를 기념해 시속        를 자랑하는 진공 초전도 리니어의 개통이 발표된다  모두가 이를 주목하는 가운데     의 공식 후원사 대표들이 연쇄 납치를 당하고  코난은 이 사건이   년 전 미국 보스턴에서 발생한     연쇄 납치 사건과 관련이 있다는 것을 밝혀내는데  이를 지켜보는 아카이 슈이치와      그리고 절대로 만나서는 안 될 위험천만한 가족이 모인다   시속        로 질주하는 진공 초전도 리니어  범인과의 목숨을 건 마지막 결판이 펼쳐진다 ,animation
25,극장판 신비아파트 극장판 차원도깨비와 7개의 세계,평화롭던  개의 평행 세계가 새로운 악당  어나더 의 등장으로 위험에 처했다  차원도깨비  키비 는 평행 세계의 질서를 거스르는  어나더 를 막기 위해  하리 와  신비 에게 도움을 요청한다    키비 로 인해 또 다른  개의 세계가 존재하고 그곳에는 자신과 똑같은 외모와 이름을 가진 사람들이 살고 있다는 것을 알게 된  하리   갑자기 사라진 동생  두리 와  금비 도  어나더 의 세계에 떨어졌다는 사실을 듣게 된다   동생을 찾기 위해  평행세계를 구하기 위해  하리는 마지막 희망의 열쇠가 있는 제  세계로 모험을 떠난다 ,animation
26,NULL,NULL,animation
27,몬스터 호텔: 뒤바뀐 세계(패키지: 자막판+더빙판),몬스터 호텔의    주년 기념 파티  반 헬싱의 발명품  몬스터 변신 광선 으로 드락과 괴물 친구들은 인간이  조니는 몬스터가 되어버린다  인간의 몸이 되면서  을 잃은 드락과 괴물로서의 삶을 즐기게 된 기운 넘치는 조니 하지만  몬스터 변신 광선  부작용으로 조니는 점점 이성을 잃고  마비스와 친구들은 조니와 드락을 더 늦기 전에 원래 모습으로 되돌려 놓아야한다 ,animation
28,씽2게더(패키지: 자막판+더빙판),대국민 오디션 이후 각자의 자리에서 꿈을 이루고 있는 버스터 문 매튜 맥커너  과 크루들에게 레드 쇼어 시티에서 전 세계가 주목하는 사상 최고의 쇼가 펼쳐진다는 소식이 들려오고 버스터 문과 크루들은 도전에 나선다   그러나 최고의 스테이지에 서기 위한 경쟁은 이전과는 비교도 할 수 없을 만큼 치열하고  버스터 문은 완벽한 라이브를 위해 종적을 감춘 레전드 뮤지션 클레이 보노 를 캐스팅하겠다는 파격 선언을 하는데 ,animation
29,NULL,NULL,animation
