,title,synopsis,category
20,쥬만지,    년  커다란 공장을 운영하는 아버지를 둔   세 소년 알랜 패리쉬             아담 한 바이드 분 는 어느날 친구 사라              로라 번디 분 와 함께 공장의 신축 공사장에서 이상한 북소리를 듣고 나무로 만들어진 이상한 게임판을 발견한다  이 게임을 하던 알랜은 그만 게임의 마법에 의해 게임판 속으로 흔적도 없이 사라진다      년  주디                크리스틴 던스트 분 와 피터                 브래드리 피어스 분 는 교통사고로 부모를 여의고 고모와 함께 살기 위해 왠지 값이 싼 커다란 집으로 이사온다  어느날 고모가 직장으로 출근하고 난 뒤  두 아이는 먼지 쌓인 다락방에서 들려오는 이상한 북소리를 듣는다  공포와 호기심이 뒤섞인 채 다락방으로 올라간 주디와 피터가 찾아낸 것은 바로 쥬만지 게임판  호기심 많은 주디가 게임판에 새겨진 지시에 따라 주사위를 던지는 순간  갑자기 게임판에서 이제껏 본적 없는 괴조류떼가 튀어나와 물건들을 닥치는대로 부수어대기 시작한다  놀란 주디와 피터는 뒤늦게 후회하지만 이미 사태는 엎지러진 물  당황하는 주디와 피터 앞에   년전 쥬만지 게임을 하다가 게임판 안에 갇혀버린 알랜 패리쉬               로빈 윌리암스 분 가 나타나면서 주디와 피터는 이것이 단순한 게임의 수준을 넘어서는 초현실적인 것임을 깨닫고 전율한다  이제 알랜은   년이라는 잃어버린 세월을 찾기위해  주디와 피터는 자신들이 무심코 저지른 장난의 결과를 되돌려 놓기 위해 게임판 앞에 앉는다  이 세사람에 더해 알랜이 수소문끝에 찾은   년전의 친구 사라                보니 헌트 분 가 합류한다  그러나 좀체로 게임의 끝은 보이지 않고  게임판에서 나온 동물들은 주디와 피터의 집뿐 아니라 온 마을 전체를 휘젓기에 이른다  급기야 주디와 피터의 집은 정글로 변하고 쏟아지는 폭우속에 떠내려가던 네 사람은 운명을 건 마지막 주사위를 던진다 ,comedy
21,내안의 그놈,엘리트 아재 판수 박성웅 를 우연  옥상에서 떨어진 고등학생 동현 진영 이 덮치면서 제대로 바뀐다  게다가 판수는 동현의 몸으로 첫사랑 미선 라미란 과 존재도 몰랐던 딸 현정 이수민 을 만나게 되는데  대유잼의 향연  넌 이미 웃고 있다 ,comedy
22,정직한 후보,거짓말이 제일 쉬운  선 국회의원  주상숙 에게 청천벽력이 떨어진다  하루아침에 거짓말은  도 할 수 없는  진실의 주둥이 를 갖게 된 것   최고의 무기인  거짓말 을 잃자 그녀의 인생은 송두리째 흔들리게 되는데   웃음 빵  속이 뻥  뚫리는 통쾌한 웃음 폭격이 시작된다 ,comedy
23,에브리씽 에브리웨어 올 앳 원스+(확장판),미국에 이민 와  겹게 세탁소를 운영하던 에블린은 세무당국의 조사에 시달리던 어느 날 남편의 이혼 요구와 삐딱하게 구는 딸로 인해 대혼란에 빠진다  그 순간 에블린은 멀티버스 안에서 수천  수만의 자신이 세상을 살아가고 있다는 사실을 알게 되고  그 모든 능력을 빌려와 위기의 세상과 가족을 구해야 하는 운명에 처한다 ,comedy
24,육사오(6/45),우연   등 당첨 로또를 주운 말년 병장  천우   심장이 터질듯한 설렘도 잠시  순간의 실수로 바람을 타고 군사분계선을 넘어간 로또  바사삭 부서진 멘탈을 부여잡고 기필코 다시 찾아야 한다   우연  남쪽에서 넘어온  등 당첨 로또를 주운 북한 병사  용호   이거이 남조선 인민의 고혈을 쥐어 짜내는 육사오라는 종이쪼가리란 말인가  근데 무려 당첨금이   억이라고    당첨금을 눈앞에서 놓칠 위기에 처한  천우 와 북에선 한낱 종이쪼가리일 뿐일 로또를 당첨금으로 바꿔야 하는  용호   여기에 예상치 못한 멤버들   까지 합류하고   억을 사수하기 위한    팀이 결성되는데   주운 자    또 주운 자 아슬아슬 선 넘는 지분 협상이 시작된다 ,comedy
25,NULL,NULL,comedy
26,토이 스토리(패키지상품 : 더빙판 추가증정),우디 톰 행크스 목소리 분 는  살짜리 남자 아이 앤디가 가장 아끼는 카우보이 인형인데  어느날 접었다 폈다 하는 날개와 레이저 디지털 음성을 가진 최신 액션 인형 버즈 팀 알렌 목소리 연기 가 나타나자 그의 위치가 흔들리기 시작한다  모든 장난감들의 최고의 공포는 새로운 장난감들에 의해 밀려나는 것이다  애타는 우디의 심정에도 불구하고 버즈는 앤디의 최고 인형으로 자리를 잡고  장난감 세계   우디의 친구인 강아지 슬링키 짐 바니 목소리 분   참을성 없는     포테토 돈 리클스 목소리 분   마음 약한 공룡 렉스 월레스 숀 목소리 분   돼지 저금통 햄 존 래츤버거 목소리 분   아름다운 사기 램프 인형인 보 피프 애니 파츠 목소리 분    에서도 인기가 급상승한다  한편  기세등등한 버즈가 자신이 장난감이 아닌  외계에서 불시착한 우주 전사라고 믿는다  우디는 버즈를 없앨 계획을 세우나  우여곡적 끝에 둘은 바깥세상에서 서로의  을 합치지 않으면 살아남을 수 없는 상황에 이른다  한편 라이벌에서 동료사이로 변한 그들은 인형과 장난감을 못살게 하는 악명높은 무서운 아이 시드의 손아귀에 들어가게 된다  시드와 그를 닮은 개 스커드에게서 벗어나기 위해서 그 둘은 더욱 가까워진다  버즈는 그가 진짜 우주전사가 아니라는걸 깨닫고 삶을 포기하기까지 이르나 우디의 도움으로 본인의 진짜 가치   장난감으로서   를 깨닫게 된다  카우보이와 우주전사는 목숨을 건 모험을 통해 진정한 우정과 신뢰를 배우게 된다 ,comedy
27,내 이야기!!,남자에게는 인기만점  여자에게는 인기빵점 고릴라 같은 외모의 소년  타케오 에게 어느 날  운명 같은 첫사랑이 시작된다   하지만 잘 생긴 것들이 난무하는 이 세상  나를 좋아해줄까     아니  절대 그럴리 없어  차마  좋아한다 는 고백은 입 밖으로 꺼내지 못한 채 절친  스나카와 와 함께 매일 그녀의 주위를 맴돌게 되는데   과연 소년의 첫사랑은 이뤄질까 ,comedy
28,여인의 향기,퇴역 장교 프랭크 슬레드                      알 파치노 분 는 맹인이며 시적인 분위기와 철학적인 면모  그러면서도 괴팍한 성격을 가진 그러나 진실을 소유하였으며 사랑을 느낄 수 있는 맹인인 퇴역 장교이다  사촌들과 함께 살고 있으며 슬레드를 제외한 가족들은 추수감사절 여행을 떠나기로 되어있다  찰리 심스                크리스 오도넬 분 는 하버드 대학을 목표로 예비학교에 다니는 장학생이며 모범학생이다  찰리는 생각치 않은 뉴욕행 비행기를 타게 되고 슬레드의 험난한 인생 교육은 시작된다  최고급 호텔과 식당  리무진 사이를 오가면서 괴팍한 성격의 슬레드를 돌보는 작업이 시작되는데 찰리에게는 생소한 경험이 된다  즉 여자의 모든 것을 알아버리는 초능력적인  을 말한다  그러나 그 뒤에는 고독감과 죽음의 유혹이 있다는 것을 안 찰리는 인생의 의미를 부여하려 한다  그러나 슬레드는 중령정복을 차려입고 방아쇠를 당기려고 한다   당신에게는 인생이 있잖아요     인생  무슨인생  나에게는 어둠뿐이란 말이야     하지만 당신처럼 멋지게 탱고를 출 수 있고 스포츠카를 잘 모는 사람은 본 일이 없단 말이예요    그런 경험은 찰리에게는 아주  든 과정이었다  그러면서 찰리와 슬레드는 서로를 알게되고 슬레드는 찰리에게 인생에 있어서 한번의 빚을 지게 된다  고된 뉴욕여행을 끝내고 다시 마을로 돌아왔을 때 슬레드는 찰리 아버지 자격으로 찰리가 처한  학교 교장으로부터 부당한 요구와 처우에 대항하여 멋지게 한판승을 보여주어 학생들로부터 박수를 받으면서 찰리와 함께 명예롭게 퇴장을 한다  찰리는 슬레드의 집앞에까지 마중을 해주고 슬레드가 조카들과 함께 다정스럽게 담소하는 것을 본 후 안심하여 뒤돌아서서 자기의 갈 길을 가게 된다 ,comedy
29,페어런트 트랩,즐거운 여름캠프의 추억을 만들기 위해 몰려든 소녀들로 붐비는 캠프 월든  멀리 캘리포니아에서 이곳까지 날아온 할리 파커도 그들 중 하나다  드넓은 포도 농장에서 아빠와 함께 살고 있는 할리는 함께 말타기도 즐기고  비밀도 나눌 수 있는 최고의 아빠를 두었지만  대신 엄마가 없었다  할리가 캠프장에서 새로운 친구들을 사귀고 있을 무렵  의리의리한 리무진 한 대가 캠프장 안으로 미끄러져 들어온다  그 안에서 사뿐  내려선 소녀는 애니 제임스  바다 건너 런던에서 온 애니는 웨딩 드레스 디자이너인 멋쟁이 엄마와 함께 살고 있다  말쑥한 옷 맵시에 프랑스어를 유창하게 구사하며  카드 놀이까지 잘하는 완벽한 꼬마 숙녀지만  아버지에 대해서는 하나도 아는 것이 없다  갓난 아기였을 때부터 가족이라곤 엄마와 애니  그리고 할아버지 이렇게 셋 뿐이었으며  엄마는 아빠이야기도 거의 해주지 않았기 때문이다  캠프 월든에서 할리와 애니  두 소녀가 만났을 때  친구들과 선생님들은 놀란 입을 다물 수 없었다 두 소녀가 너무나 꼭 닮아있었기 때문이다  하지만  누구보다고 놀란것은 본인들이었다  알고보니 이들은 쌍둘이 자매였던 것이다  꿈에도 그리던 엄마  아빠가 살아있다는 것을 알게 된 할리와 애니는 깜찍한 계획을 세운다  캠프가 끝나는 날  서로가 상대방으로 가장하여 생활하고  결국에는 두 분이 재결합하도록 일을 꾸미기로 한 것이다  런던에서 상냥하고 멋진 엄마와 함께 살게 된 할리는 꿈같은 나날을 보낸다  하지만 애니는 아빠와 꿈같은 나날을 시작하기도 전에 악몽같은 현실에 부딪 다  아빠에게 젊은 애인이 생긴 것이다  이럴수가  이제야 온 가족이 함께 살아보는가 했는데    애니는 황급  할리에게 긴급 구조요청을 하고  할리는 런던의 가족들에게 모든 사실을 털어놓고서 부랴부랴 엄마를 이끌고 캘리포니아로 날아오는데 ,comedy
