,title,synopsis,category
0,NULL,NULL,documentary
1,밤쉘, 어떤 젊은 여성도 매혹적으로 보일 수 있다  가만  서서 바보처럼 보이기만 하면 된다     헤디 라머    세상에서 가장 아름다운 여인  헤디 라머  화려했던 할리우드 데뷔      년대 찾아온 전성기  끊이지 않던 스캔들 그리고 뒤늦게 밝혀진 그녀의 과학적 발명  이 아름다운 배우가  와이파이 를 발명한 사람이라고  영화보다 더 파란만장한 삶을 살았던 그녀를 집중 조명한다 ,documentary
2,NULL,NULL,documentary
3,장마,북한에서 북송     재일교포의 아들로 태어나 굶주림과 인권 탄압에 시달리다 자유를 찾아 대한민국으로 탈북한 북송 재일교포  세인 시민사회운동가 이은택의 탈북과정과 탈북 스토리  좌충우돌 대한민국 정착기  북한 인권운동가에서 시민사회운동가로 변신하기까지의 우여곡절을 담은 다큐멘터리이다 ,documentary
4,"어떤여행, 시민창작뮤지컬",당신은 여행을 떠나본 적 있나요   매일 비행기를 타지만 한 번도 진짜 여행을 한 적 없는 승무원  인아   매일 공항으로 출근하지만 한 번도 비행기에 타본 적 없는 특수경비  광일   어느 날   인아 는 공항에서 브로치를 도둑맞고  현장에 있던  광일 은 그 뒤를 쫓는다   한바탕 소동 끝에 드디어 붙잡은 범인은 정체를 알 수 없는 묘령의 할머니   자신의 집도  이름도  사라진 브로치도 모르쇠로 일관하는 범인의 정체를 밝 기 위해   인아 와  광일 은 원치 않은 동행을 시작하는데   과연  두 사람은 범인의 정체를 밝 고 도둑맞은 브로치를 다시 찾을 수 있을까   모든 소동을 끝내고 평온했던 일상으로 돌아가길 원하는 두 사람 앞에 펼쳐진 미래는 ,documentary
5,NULL,NULL,documentary
6,당신은 아름답다,깊은 눈  오뚝한 코  짙은 쌍꺼풀  수북한 털을 가진  천년의 역사를 간직한 일본의 소수민족 아이누  민족 특유의 전통적 생활관습을 지키고자 했던 아이누의 신념과는 달리 일본 정부는 수년간 억압하고 핍박하며 그들의 존재를 부정했지만  현재까지 약  만 여명의 아이누가 홋카이도에 살고 있다  한편  미나를 중심으로 젊은 아이누들은  아이누레블스  라는 그룹을 결성해 자신들의 정체성과 차별을 알리기 위한 랩  노래 등으로 활발한 활동을 하고 있다  아이누레블스는 자연과 음악을 사랑하는 아이누의 전통문화를 알리고 자신들의 꿈을 이루기 위한 공연을 준비하는데    아이누족  아이누는  천년 전부터 일본 홋카이도와 러시아 사할린  쿠릴 열도 등지에 분포하던 소수 민족이다  메이지 정부는 아이누의 전통적 생활관습을 금지하고 강제 이주  토지 약탈은 물론 민족말살을 위한 동화 정책을 펼쳤다  일본인들과 다른 외모와 풍습을 지녔다는 이유로 아이누는 오랜 시간 억압과 차별을 견뎌야만 했다  이로써 독특한 문화를 고수해왔던 아이누의 전통 문화는 파괴되었으며  급격  인구가 감소했다  현재  홋카이도에는 약  만 여명의 아이누가 거주하고 있으며  이중 순수혈통은 극  일부다 ,documentary
7,태안,    년 한국전쟁 당시 충남 태안군에서도 국민보도연맹원 학살이 시작된다  그해  월   일께 태안경찰서는 후퇴하기 직전에  사기실재 에서    명의 민간인을 학살한다  당시 국가권력은 이들 민간인들이 곧 들이닥칠 인민군에 동조할 것이라는 짐작만으로 집단학살한다  태안의 피해는 여기서 그치지 않았다  태안을 점령한 인민군 측은 반동을 처단한다는 이유로    명의 민간인을 학살한다  그러나 이는 이후에 벌어질 대참사에 대한 예고편에 불과했다 ,documentary
8,1984 최동원(가치봄영화:시청각장애인용),무쇠팔  부산의 심장  최고의 투수  등번호   번  불꽃 투혼  금테 안경 우리가 그를 부르는 이름  프로야구 역사상 가장 극적인 우승  레전드 한국 시리즈  기적 같은 우승 우리가 기억하는     년 가을      년 프로야구 한국 시리즈 롯데 자이언츠    삼성 라이온즈 모두가 절대 강자 삼성의 우승을 의심하지 않던 한국시리즈   코리안 시리즈에 올라왔으니까  제가  이 되는 데 까지는 열심  해서 전 게임을 다 나가더라도 이길 수 있는 게임은 전부다 이기고 싶습니다   한국시리즈  차전  번 등판   승  패  완봉승  완투승  구원승 전세계 유일무이 깨지지 않을 만화 같은 기록  희망  열정  도전  투혼  기록 이 아닌  기적 을 선물한 최동원 선수  눈물 나게 그리운 그 이름 무쇠팔 최동원   주기 첫 번째 다큐멘터리  야구가 제 인생 아니겠습니까 ,documentary
9,NULL,NULL,documentary
10,그대라는기억 연숙씨,치매라는 진단을 받고 차츰 병이 악화되는 아내 연숙씨  기억은 사라지고 말을 잊기 시작한 그녀의 시간은 거꾸로 흘러가고 있다  그녀의 곁을 지킨 사람은 남편 규홍씨  다 잊어도 유일하게 아내가 기억하는 사람은 남편뿐  하루를 온전  아내를 위해 보내는 남편은 어느 날 시한부 선고를 받는다    년을 자신보다 아내가 먼저였던 남편  아내는 기억을 잃어가고  남편은 기운을 잃어간다 ,documentary
11,NULL,NULL,documentary
12,연인과 독재자,    년대 한국 영화계를 주름잡던 슈퍼스타 커플 영화감독 신상옥 톱스타 여배우 최은희  어느 날  홍콩으로 여행 갔던 최은희가 소리소문 없이 사라지고 얼마 후 최은희를 찾으러 홍콩으로 떠났던 신상옥 역시 행방이 묘연해진다  단숨에 세계 최고의 가십으로 떠오른 두 사람의 실종사건  전 세계의 언론은 이 사건을  세기의 납치 스캔들 로 일컬으며 수많은 루머를 양산해낸다   그리고  년이 흐른 후 나타난 신상옥과 최은희    우리는 홍콩에서 북한으로 납치 당했고  목숨을 걸고 탈출했다  그리고 여기 북한에서의  년 간의 기록이 담긴  증거 가 있다    그들이 내민 것은 김정일 국방위원장의  육성 이 담겨 있는 녹음기  과연  년 동안 그들에겐 무슨 일이 있었던 것일까  전 세계를 뒤흔든 세기의 납치 스캔들  그 진실이 낱낱이 드러난다 ,documentary
13,가면-감춰진 진실,중국이 수십억 달러를 들여 설립한  공자학원 이라는 중국어 학습기관의 정체를 폭로하고  이를 둘러싸고 비등하는 국제적 논란  학문의 진실성을 유린하고  외세의 영향을 받으며  인권규정을 위반할 뿐 아니라 국가 안보를 위협한다 는 을 소개한 최초의 다큐멘터리이다  공자학원은 중국이 외국 대학 등 해외교육기관과 파트너십을 맺어서 설립하는 중국의 어학  문화교육 프로그램이다      년 이후  공자학원은 그들의 방식으로 세계      여 대학과 학교들에 세워졌다  베이징은 공자학원을 중국의  해외공작소 건립 에 중요한 일부라고 공언하며    주에  개씩 새로운 공자학원을 계속해서 설립하고 있다  그러나     년 이후 공자학원과의 협약을 종결하는 학교가 늘어나고 있다 ,documentary
14,타이거 우즈: 아이콘,골프는 인생에 대한 비유이며  자연의  과의 싸움이자 자기 자신과의 싸움이기도 하다  타이거 우즈가 어린 시절부터 골프 신동으로 어떤 행보를 걸어왔고  아버지께 어떤 교육을 받아왔으며  재단을 세우고 교육에  써 온 그가 수많은 아이들과 어른들에게 어떤 영향력을 끼쳤는지  백인과 중산층의 전유물이었던 골프를 그가 어떻게 대중화시켰는지  골프 산업에서 얼마나 큰 상업적 가치를 창출해 냈는지  또한 그가 사생활 논란과 교통사고로 인한 중상을 어떻게 극복하고 다시 필드로 돌아왔는지에 대해 그의 인내와 끈기  강인한 정신력에 집중하여 서술하고 있다 ,documentary
15,총을 들지 않는 사람들: 금기에 도전,    년부터 시작해 보수정권   년여를 거쳐     년 헌법재판소의 대체복무제도가 결정되기까지 자신의 존재를 증명하고 사회에 울림을 준 활동의 역사  양심적 병역거부 운동이 걸어온  평화의 발자취    금기에 도전 한 시간 속으로 들어가 본다 ,documentary
16,타다: 대한민국 스타트업의 초상,한국의 우버로 불리며 폭발적으로 성장하던 모빌리티 플랫폼 타다        출시한 지  개월 만에    만 유저를 확보하며 승승장구하던 중 택시업계의 반발로 법적 공방에 휘말린다  뜨거운 논란 속 치러진  심에서 무죄 판결을 받은 날  모든 팀원들은 함께 모여  종이컵 와인 파티 로 자축한다  하지만 그로부터 단   일 뒤   타다금지법 이 통과됐다는 청천벽력의 소식이 들려오는데    그들은 이 최악의 위기를 뚫고 타다를 새롭게 부활시킬 수 있을까   모빌리티 플랫폼 타다의 이야기로 세상에 공개되는  스타트업 에 대한 국내 최초의 다큐멘터리 필름,documentary
17,아-하: 테이크 온 미,메가  트송             의 주인공 레전드 밴드     의 탄생과 성공 그리고 음악으로 연대하는 이들의 무대 위  무대 밖의 진짜 이야기  전율의 이름     의 스크린 콘서트가 시작된다 ,documentary
18,소리에 놀라지 않는 사자처럼, 서리를 맞으며 달을 벗삼는다  시끄러운 도심 속 가장 고요했던 상월선원 아홉 스님의 위대하고 특별한   일간의 동안거가 시작됐다   하루   시간 정진  하루 한 끼 공양  옷 한 벌 삭발 목욕 금지  묵언  무문 규약을 어길 시 조계종 승적에서 제외 강렬한 청규  항이 더해진 혹독했던 용맹정진 천막결사의 여정   가장 추웠던 그 해 겨울  치열했던 아홉 스님과 함께한   일간의 소리가 세상 밖으로 울려 퍼진다 ,documentary
19,NULL,NULL,documentary
20,바세코의 아이들,바닷가의 쓰레기 더미를 놀이공간 삼아 뛰어 놀면서도 해맑은 웃음만큼은 잃지 않는 바세코의 아이들  행복이 무엇인지 알기도 전에 맞이한 차가운 삶의 덫은 이들의 삶에 대한 작은 희망마저 앗아 가려 한다  그러던 어느 날  신승철 선교사가 이끄는 세계선교공동체     일원들이 바세코를 찾는다  굶주린 아이들에게 따뜻한 한끼의 식사를 대접하고  학교에 가지 못하는 아이들에게는 빵 만드는 기술을 가르치며 그들을 위해 기도하는 이들  과연  절망의 땅에 희망의 빛을 전해줄 수 있을까  바세코의 작은 천사들의 아름다운 날개짓이 시작된다 ,documentary
21,웰컴 투 X-월드,구로동 집에는 나  엄마 그리고 친할아버지가 산다    년 전 아빠가 돌아가신 후에도 엄마는 시아버지를 모시고 산다  희생하는 엄마를 보고 자란 나는 결혼이 싫다,documentary
22,NULL,NULL,documentary
23,고양이 집사,이름 빼고 다 주는 바이올린 가게 아저씨  짜장면 대신 고양이 도시락 배달하는 중국집 사장님부터 급식소 만들어 주는 주민센터 사람들  남겨질 고양이들을 걱정하며 밥을 주는 생선가게 할머니  급식소를 제작하는 청사포 마을 청년 사업가까지  함께 살아갈 수 있다면 모든 것을 털려도 행복한 집사들의 사랑 이야기가 시작된다 ,documentary
24,NULL,NULL,documentary
25,NULL,NULL,documentary
26,나의 노래는 멀리멀리,깔끔하고 섬세한 연주가 장기인 풋내기 기타리스트 김지희  기타를 잘 치는 것 말고는 다른 꿈이 없는 스물넷 소녀지만  감정 표현이 서툴러 연주가 제자리인 것이 조금 고민이다  무대 위에서는 기타에  일상에서는 엄마 뒤에 숨었던 지희가 어느 날 불쑥  자신의 노래를 만들고 싶다며 목소리를 내는데   마음 깊은 곳  오래오래 간직했던 소녀의 꿈과 희망 멀리멀리 전하고픈 풋내기 기타리스트의 노래가 시작된다 ,documentary
27,에움길,각양각색의 할머니들로 조용할 날이 없는  나눔의 집  이곳에서 유쾌한 그녀들의 삶을 마주하다   노래를 너무나도 사랑하는 박옥선 할머니부터 자유분방한 강일출 할머니  다재다능한 배춘희 할머니까지  이토록 정겨운 할머니들을 보았는가   고난과 역경의 길이 아닌 함께 걷는 따뜻한 길 이옥선 할머니는 오늘도 살랑이는 꽃들과 마주한다 ,documentary
28,NULL,NULL,documentary
29,NULL,NULL,documentary
